gutenberg_id,short_title,gutenberg_title,genre,year,author,section,class,act,scene,character,line_number,text
1540,Tempest,THE TEMPEST,Comedy,1611,William Shakespeare,contents,dialogue,ACT II,SCENE II,CALIBAN,1004,And after bite me; then like hedgehogs which
1540,Tempest,THE TEMPEST,Comedy,1611,William Shakespeare,contents,dialogue,ACT II,SCENE II,CALIBAN,1005,"Lie tumbling in my barefoot way, and mount"
1540,Tempest,THE TEMPEST,Comedy,1611,William Shakespeare,contents,dialogue,ACT II,SCENE II,CALIBAN,1006,Their pricks at my footfall; sometime am I
1540,Tempest,THE TEMPEST,Comedy,1611,William Shakespeare,contents,dialogue,ACT II,SCENE II,CALIBAN,1007,"All wound with adders, who with cloven tongues"
1540,Tempest,THE TEMPEST,Comedy,1611,William Shakespeare,contents,dialogue,ACT II,SCENE II,CALIBAN,1008,Do hiss me into madness.
1540,Tempest,THE TEMPEST,Comedy,1611,William Shakespeare,contents,directions,ACT II,SCENE II,NA,NA,Enter Trinculo.
1540,Tempest,THE TEMPEST,Comedy,1611,William Shakespeare,contents,dialogue,ACT II,SCENE II,CALIBAN,1009,"Lo, now, lo!"
1540,Tempest,THE TEMPEST,Comedy,1611,William Shakespeare,contents,dialogue,ACT II,SCENE II,CALIBAN,1010,"Here comes a spirit of his, and to torment me"
1540,Tempest,THE TEMPEST,Comedy,1611,William Shakespeare,contents,dialogue,ACT II,SCENE II,CALIBAN,1011,For bringing wood in slowly. I’ll fall flat;
1540,Tempest,THE TEMPEST,Comedy,1611,William Shakespeare,contents,dialogue,ACT II,SCENE II,CALIBAN,1012,Perchance he will not mind me.
1540,Tempest,THE TEMPEST,Comedy,1611,William Shakespeare,contents,dialogue,ACT II,SCENE II,TRINCULO,1013,"Here’s neither bush nor shrub to bear off any weather at all, and"
1540,Tempest,THE TEMPEST,Comedy,1611,William Shakespeare,contents,dialogue,ACT II,SCENE II,TRINCULO,1014,another storm brewing; I hear it sing i’ th’ wind. Yond same black
1540,Tempest,THE TEMPEST,Comedy,1611,William Shakespeare,contents,dialogue,ACT II,SCENE II,TRINCULO,1015,"cloud, yond huge one, looks like a foul bombard that would shed his"
1540,Tempest,THE TEMPEST,Comedy,1611,William Shakespeare,contents,dialogue,ACT II,SCENE II,TRINCULO,1016,"liquor. If it should thunder as it did before, I know not where to hide"
1540,Tempest,THE TEMPEST,Comedy,1611,William Shakespeare,contents,dialogue,ACT II,SCENE II,TRINCULO,1017,my head: yond same cloud cannot choose but fall by pailfuls. What have
1540,Tempest,THE TEMPEST,Comedy,1611,William Shakespeare,contents,dialogue,ACT II,SCENE II,TRINCULO,1018,we here? a man or a fish? dead or alive? A fish: he smells like a fish;
1540,Tempest,THE TEMPEST,Comedy,1611,William Shakespeare,contents,dialogue,ACT II,SCENE II,TRINCULO,1019,a very ancient and fish-like smell; a kind of not of the newest
1540,Tempest,THE TEMPEST,Comedy,1611,William Shakespeare,contents,dialogue,ACT II,SCENE II,TRINCULO,1020,"Poor-John. A strange fish! Were I in England now, as once I was, and"
1540,Tempest,THE TEMPEST,Comedy,1611,William Shakespeare,contents,dialogue,ACT II,SCENE II,TRINCULO,1021,"had but this fish painted, not a holiday fool there but would give a"
1540,Tempest,THE TEMPEST,Comedy,1611,William Shakespeare,contents,dialogue,ACT II,SCENE II,TRINCULO,1022,piece of silver: there would this monster make a man; any strange beast
1540,Tempest,THE TEMPEST,Comedy,1611,William Shakespeare,contents,dialogue,ACT II,SCENE II,TRINCULO,1023,there makes a man. When they will not give a doit to relieve a lame
1540,Tempest,THE TEMPEST,Comedy,1611,William Shakespeare,contents,dialogue,ACT II,SCENE II,TRINCULO,1024,"beggar, they will lay out ten to see a dead Indian. Legg’d like a man,"
1540,Tempest,THE TEMPEST,Comedy,1611,William Shakespeare,contents,dialogue,ACT II,SCENE II,TRINCULO,1025,"and his fins like arms! Warm, o’ my troth! I do now let loose my"
1540,Tempest,THE TEMPEST,Comedy,1611,William Shakespeare,contents,dialogue,ACT II,SCENE II,TRINCULO,1026,"opinion, hold it no longer: this is no fish, but an islander, that hath"
1540,Tempest,THE TEMPEST,Comedy,1611,William Shakespeare,contents,dialogue,ACT II,SCENE II,TRINCULO,1027,"lately suffered by thunderbolt. [Thunder.] Alas, the storm is come"
1540,Tempest,THE TEMPEST,Comedy,1611,William Shakespeare,contents,dialogue,ACT II,SCENE II,TRINCULO,1028,again! My best way is to creep under his gaberdine; there is no other
1540,Tempest,THE TEMPEST,Comedy,1611,William Shakespeare,contents,dialogue,ACT II,SCENE II,TRINCULO,1029,shelter hereabout: misery acquaints a man with strange bed-fellows. I
1540,Tempest,THE TEMPEST,Comedy,1611,William Shakespeare,contents,dialogue,ACT II,SCENE II,TRINCULO,1030,will here shroud till the dregs of the storm be past.
1540,Tempest,THE TEMPEST,Comedy,1611,William Shakespeare,contents,directions,ACT II,SCENE II,NA,NA,Enter Stephano singing; a bottle in his hand.
1540,Tempest,THE TEMPEST,Comedy,1611,William Shakespeare,contents,dialogue,ACT II,SCENE II,STEPHANO,1031,"I shall no more to sea, to sea,"
1540,Tempest,THE TEMPEST,Comedy,1611,William Shakespeare,contents,dialogue,ACT II,SCENE II,STEPHANO,1032,Here shall I die ashore—
1540,Tempest,THE TEMPEST,Comedy,1611,William Shakespeare,contents,dialogue,ACT II,SCENE II,STEPHANO,1033,This is a very scurvy tune to sing at a man’s funeral.
1540,Tempest,THE TEMPEST,Comedy,1611,William Shakespeare,contents,dialogue,ACT II,SCENE II,STEPHANO,1034,"Well, here’s my comfort."
1540,Tempest,THE TEMPEST,Comedy,1611,William Shakespeare,contents,directions,ACT II,SCENE II,NA,NA,[Drinks.]
1540,Tempest,THE TEMPEST,Comedy,1611,William Shakespeare,contents,dialogue,ACT II,SCENE II,STEPHANO,1035,"The master, the swabber, the boatswain, and I,"
1540,Tempest,THE TEMPEST,Comedy,1611,William Shakespeare,contents,dialogue,ACT II,SCENE II,STEPHANO,1036,"The gunner, and his mate,"
1540,Tempest,THE TEMPEST,Comedy,1611,William Shakespeare,contents,dialogue,ACT II,SCENE II,STEPHANO,1037,"Lov’d Mall, Meg, and Marian, and Margery,"
1540,Tempest,THE TEMPEST,Comedy,1611,William Shakespeare,contents,dialogue,ACT II,SCENE II,STEPHANO,1038,But none of us car’d for Kate:
1540,Tempest,THE TEMPEST,Comedy,1611,William Shakespeare,contents,dialogue,ACT II,SCENE II,STEPHANO,1039,"For she had a tongue with a tang,"
1540,Tempest,THE TEMPEST,Comedy,1611,William Shakespeare,contents,dialogue,ACT II,SCENE II,STEPHANO,1040,Would cry to a sailor “Go hang!”
1540,Tempest,THE TEMPEST,Comedy,1611,William Shakespeare,contents,dialogue,ACT II,SCENE II,STEPHANO,1041,"She lov’d not the savour of tar nor of pitch,"
1540,Tempest,THE TEMPEST,Comedy,1611,William Shakespeare,contents,dialogue,ACT II,SCENE II,STEPHANO,1042,Yet a tailor might scratch her where’er she did itch.
1540,Tempest,THE TEMPEST,Comedy,1611,William Shakespeare,contents,dialogue,ACT II,SCENE II,STEPHANO,1043,"Then to sea, boys, and let her go hang."
1540,Tempest,THE TEMPEST,Comedy,1611,William Shakespeare,contents,dialogue,ACT II,SCENE II,STEPHANO,1044,This is a scurvy tune too: but here’s my comfort.
1540,Tempest,THE TEMPEST,Comedy,1611,William Shakespeare,contents,directions,ACT II,SCENE II,NA,NA,[Drinks.]
1540,Tempest,THE TEMPEST,Comedy,1611,William Shakespeare,contents,dialogue,ACT II,SCENE II,CALIBAN,1045,Do not torment me: O!
1540,Tempest,THE TEMPEST,Comedy,1611,William Shakespeare,contents,dialogue,ACT II,SCENE II,STEPHANO,1046,What’s the matter? Have we devils here? Do you put tricks upon ’s with
1540,Tempest,THE TEMPEST,Comedy,1611,William Shakespeare,contents,dialogue,ACT II,SCENE II,STEPHANO,1047,"savages and men of Ind? Ha? I have not scap’d drowning, to be afeard"
1540,Tempest,THE TEMPEST,Comedy,1611,William Shakespeare,contents,dialogue,ACT II,SCENE II,STEPHANO,1048,"now of your four legs; for it hath been said, As proper a man as ever"
1540,Tempest,THE TEMPEST,Comedy,1611,William Shakespeare,contents,dialogue,ACT II,SCENE II,STEPHANO,1049,went on four legs cannot make him give ground; and it shall be said so
1540,Tempest,THE TEMPEST,Comedy,1611,William Shakespeare,contents,dialogue,ACT II,SCENE II,STEPHANO,1050,"again, while Stephano breathes at’ nostrils."
1540,Tempest,THE TEMPEST,Comedy,1611,William Shakespeare,contents,dialogue,ACT II,SCENE II,CALIBAN,1051,The spirit torments me: O!
1540,Tempest,THE TEMPEST,Comedy,1611,William Shakespeare,contents,dialogue,ACT II,SCENE II,STEPHANO,1052,"This is some monster of the isle with four legs, who hath got, as I"
1540,Tempest,THE TEMPEST,Comedy,1611,William Shakespeare,contents,dialogue,ACT II,SCENE II,STEPHANO,1053,"take it, an ague. Where the devil should he learn our language? I will"
1540,Tempest,THE TEMPEST,Comedy,1611,William Shakespeare,contents,dialogue,ACT II,SCENE II,STEPHANO,1054,"give him some relief, if it be but for that. If I can recover him and"
1540,Tempest,THE TEMPEST,Comedy,1611,William Shakespeare,contents,dialogue,ACT II,SCENE II,STEPHANO,1055,"keep him tame, and get to Naples with him, he’s a present for any"
1540,Tempest,THE TEMPEST,Comedy,1611,William Shakespeare,contents,dialogue,ACT II,SCENE II,STEPHANO,1056,emperor that ever trod on neat’s-leather.
1540,Tempest,THE TEMPEST,Comedy,1611,William Shakespeare,contents,dialogue,ACT II,SCENE II,CALIBAN,1057,"Do not torment me, prithee; I’ll bring my wood home faster."
1540,Tempest,THE TEMPEST,Comedy,1611,William Shakespeare,contents,dialogue,ACT II,SCENE II,STEPHANO,1058,"He’s in his fit now, and does not talk after the wisest. He shall taste"
1540,Tempest,THE TEMPEST,Comedy,1611,William Shakespeare,contents,dialogue,ACT II,SCENE II,STEPHANO,1059,"of my bottle: if he have never drunk wine afore, it will go near to"
1540,Tempest,THE TEMPEST,Comedy,1611,William Shakespeare,contents,dialogue,ACT II,SCENE II,STEPHANO,1060,"remove his fit. If I can recover him, and keep him tame, I will not"
1540,Tempest,THE TEMPEST,Comedy,1611,William Shakespeare,contents,dialogue,ACT II,SCENE II,STEPHANO,1061,"take too much for him. He shall pay for him that hath him, and that"
1540,Tempest,THE TEMPEST,Comedy,1611,William Shakespeare,contents,dialogue,ACT II,SCENE II,STEPHANO,1062,soundly.
1540,Tempest,THE TEMPEST,Comedy,1611,William Shakespeare,contents,dialogue,ACT II,SCENE II,CALIBAN,1063,"Thou dost me yet but little hurt; thou wilt anon,"
1540,Tempest,THE TEMPEST,Comedy,1611,William Shakespeare,contents,dialogue,ACT II,SCENE II,CALIBAN,1064,I know it by thy trembling: now Prosper works upon thee.
1540,Tempest,THE TEMPEST,Comedy,1611,William Shakespeare,contents,dialogue,ACT II,SCENE II,STEPHANO,1065,Come on your ways. Open your mouth; here is that which will give
1540,Tempest,THE TEMPEST,Comedy,1611,William Shakespeare,contents,dialogue,ACT II,SCENE II,STEPHANO,1066,"language to you, cat. Open your mouth. This will shake your shaking, I"
1540,Tempest,THE TEMPEST,Comedy,1611,William Shakespeare,contents,dialogue,ACT II,SCENE II,STEPHANO,1067,"can tell you, and that soundly. [gives Caliban a drink] You cannot"
1540,Tempest,THE TEMPEST,Comedy,1611,William Shakespeare,contents,dialogue,ACT II,SCENE II,STEPHANO,1068,tell who’s your friend: open your chaps again.
1540,Tempest,THE TEMPEST,Comedy,1611,William Shakespeare,contents,dialogue,ACT II,SCENE II,TRINCULO,1069,I should know that voice: it should be—but he is drowned; and these are
1540,Tempest,THE TEMPEST,Comedy,1611,William Shakespeare,contents,dialogue,ACT II,SCENE II,TRINCULO,1070,"devils. O, defend me!"
1540,Tempest,THE TEMPEST,Comedy,1611,William Shakespeare,contents,dialogue,ACT II,SCENE II,STEPHANO,1071,Four legs and two voices; a most delicate monster! His forward voice
1540,Tempest,THE TEMPEST,Comedy,1611,William Shakespeare,contents,dialogue,ACT II,SCENE II,STEPHANO,1072,now is to speak well of his friend; his backward voice is to utter foul
1540,Tempest,THE TEMPEST,Comedy,1611,William Shakespeare,contents,dialogue,ACT II,SCENE II,STEPHANO,1073,"speeches and to detract. If all the wine in my bottle will recover him,"
1540,Tempest,THE TEMPEST,Comedy,1611,William Shakespeare,contents,dialogue,ACT II,SCENE II,STEPHANO,1074,I will help his ague. Come. Amen! I will pour some in thy other mouth.
1540,Tempest,THE TEMPEST,Comedy,1611,William Shakespeare,contents,dialogue,ACT II,SCENE II,TRINCULO,1075,Stephano!
1540,Tempest,THE TEMPEST,Comedy,1611,William Shakespeare,contents,dialogue,ACT II,SCENE II,STEPHANO,1076,Doth thy other mouth call me? Mercy! mercy!
1540,Tempest,THE TEMPEST,Comedy,1611,William Shakespeare,contents,dialogue,ACT II,SCENE II,STEPHANO,1077,"This is a devil, and no monster: I will leave him; I"
1540,Tempest,THE TEMPEST,Comedy,1611,William Shakespeare,contents,dialogue,ACT II,SCENE II,STEPHANO,1078,have no long spoon.
1540,Tempest,THE TEMPEST,Comedy,1611,William Shakespeare,contents,dialogue,ACT II,SCENE II,TRINCULO,1079,"Stephano! If thou beest Stephano, touch me, and speak to me; for I am"
1540,Tempest,THE TEMPEST,Comedy,1611,William Shakespeare,contents,dialogue,ACT II,SCENE II,TRINCULO,1080,Trinculo—be not afeared—thy good friend Trinculo.
1540,Tempest,THE TEMPEST,Comedy,1611,William Shakespeare,contents,dialogue,ACT II,SCENE II,STEPHANO,1081,"If thou beest Trinculo, come forth. I’ll pull thee by the lesser legs:"
1540,Tempest,THE TEMPEST,Comedy,1611,William Shakespeare,contents,dialogue,ACT II,SCENE II,STEPHANO,1082,"if any be Trinculo’s legs, these are they. Thou art very Trinculo"
1540,Tempest,THE TEMPEST,Comedy,1611,William Shakespeare,contents,dialogue,ACT II,SCENE II,STEPHANO,1083,indeed! How cam’st thou to be the siege of this moon-calf? Can he vent
1540,Tempest,THE TEMPEST,Comedy,1611,William Shakespeare,contents,dialogue,ACT II,SCENE II,STEPHANO,1084,Trinculos?
1540,Tempest,THE TEMPEST,Comedy,1611,William Shakespeare,contents,dialogue,ACT II,SCENE II,TRINCULO,1085,"I took him to be kill’d with a thunderstroke. But art thou not drown’d,"
1540,Tempest,THE TEMPEST,Comedy,1611,William Shakespeare,contents,dialogue,ACT II,SCENE II,TRINCULO,1086,Stephano? I hope now thou are not drown’d. Is the storm overblown? I
1540,Tempest,THE TEMPEST,Comedy,1611,William Shakespeare,contents,dialogue,ACT II,SCENE II,TRINCULO,1087,hid me under the dead moon-calf’s gaberdine for fear of the storm. And
1540,Tempest,THE TEMPEST,Comedy,1611,William Shakespeare,contents,dialogue,ACT II,SCENE II,TRINCULO,1088,"art thou living, Stephano? O Stephano, two Neapolitans scap’d!"
1540,Tempest,THE TEMPEST,Comedy,1611,William Shakespeare,contents,dialogue,ACT II,SCENE II,STEPHANO,1089,"Prithee, do not turn me about. My stomach is not constant."
1540,Tempest,THE TEMPEST,Comedy,1611,William Shakespeare,contents,directions,ACT II,SCENE II,NA,NA,"[Aside.] These be fine things, an if they be not sprites."
1540,Tempest,THE TEMPEST,Comedy,1611,William Shakespeare,contents,dialogue,ACT II,SCENE II,CALIBAN,1090,"That’s a brave god, and bears celestial liquor."
1540,Tempest,THE TEMPEST,Comedy,1611,William Shakespeare,contents,dialogue,ACT II,SCENE II,CALIBAN,1091,I will kneel to him.
1540,Tempest,THE TEMPEST,Comedy,1611,William Shakespeare,contents,dialogue,ACT II,SCENE II,STEPHANO,1092,How didst thou scape? How cam’st thou hither? Swear by  this bottle how
1540,Tempest,THE TEMPEST,Comedy,1611,William Shakespeare,contents,dialogue,ACT II,SCENE II,STEPHANO,1093,"thou cam’st hither—I escaped upon a butt of sack, which the sailors"
1540,Tempest,THE TEMPEST,Comedy,1611,William Shakespeare,contents,dialogue,ACT II,SCENE II,STEPHANO,1094,"heaved o’erboard, by this bottle! which I made of the bark of a tree"
1540,Tempest,THE TEMPEST,Comedy,1611,William Shakespeare,contents,dialogue,ACT II,SCENE II,STEPHANO,1095,"with mine own hands, since I was cast ashore."
1540,Tempest,THE TEMPEST,Comedy,1611,William Shakespeare,contents,dialogue,ACT II,SCENE II,CALIBAN,1096,"I’ll swear upon that bottle to be thy true subject, for the liquor is"
1540,Tempest,THE TEMPEST,Comedy,1611,William Shakespeare,contents,dialogue,ACT II,SCENE II,CALIBAN,1097,not earthly.
1540,Tempest,THE TEMPEST,Comedy,1611,William Shakespeare,contents,dialogue,ACT II,SCENE II,STEPHANO,1098,Here. Swear then how thou escapedst.
1540,Tempest,THE TEMPEST,Comedy,1611,William Shakespeare,contents,dialogue,ACT II,SCENE II,TRINCULO,1099,"Swum ashore, man, like a duck: I can swim like a duck, I’ll be sworn."
1540,Tempest,THE TEMPEST,Comedy,1611,William Shakespeare,contents,dialogue,ACT II,SCENE II,STEPHANO,1100,"Here, kiss the book. Though thou canst swim like a duck, thou art made"
1540,Tempest,THE TEMPEST,Comedy,1611,William Shakespeare,contents,dialogue,ACT II,SCENE II,STEPHANO,1101,like a goose.
1540,Tempest,THE TEMPEST,Comedy,1611,William Shakespeare,contents,dialogue,ACT II,SCENE II,TRINCULO,1102,"O Stephano, hast any more of this?"
1540,Tempest,THE TEMPEST,Comedy,1611,William Shakespeare,contents,dialogue,ACT II,SCENE II,STEPHANO,1103,"The whole butt, man: my cellar is in a rock by th’ seaside, where my"
1540,Tempest,THE TEMPEST,Comedy,1611,William Shakespeare,contents,dialogue,ACT II,SCENE II,STEPHANO,1104,"wine is hid. How now, moon-calf! How does thine ague?"
1540,Tempest,THE TEMPEST,Comedy,1611,William Shakespeare,contents,dialogue,ACT II,SCENE II,CALIBAN,1105,Hast thou not dropped from heaven?
1540,Tempest,THE TEMPEST,Comedy,1611,William Shakespeare,contents,dialogue,ACT II,SCENE II,STEPHANO,1106,"Out o’ the moon, I do assure thee: I was the Man in the Moon, when time"
1540,Tempest,THE TEMPEST,Comedy,1611,William Shakespeare,contents,dialogue,ACT II,SCENE II,STEPHANO,1107,was.
1540,Tempest,THE TEMPEST,Comedy,1611,William Shakespeare,contents,dialogue,ACT II,SCENE II,CALIBAN,1108,"I have seen thee in her, and I do adore thee. My mistress showed me"
1540,Tempest,THE TEMPEST,Comedy,1611,William Shakespeare,contents,dialogue,ACT II,SCENE II,CALIBAN,1109,"thee, and thy dog, and thy bush."
1540,Tempest,THE TEMPEST,Comedy,1611,William Shakespeare,contents,dialogue,ACT II,SCENE II,STEPHANO,1110,"Come, swear to that. Kiss the book. I will furnish it anon with new"
1540,Tempest,THE TEMPEST,Comedy,1611,William Shakespeare,contents,dialogue,ACT II,SCENE II,STEPHANO,1111,contents. Swear.
1540,Tempest,THE TEMPEST,Comedy,1611,William Shakespeare,contents,dialogue,ACT II,SCENE II,TRINCULO,1112,"By this good light, this is a very shallow monster. I afeard of him? A"
1540,Tempest,THE TEMPEST,Comedy,1611,William Shakespeare,contents,dialogue,ACT II,SCENE II,TRINCULO,1113,very weak monster. The Man i’ the Moon! A most poor credulous monster!
1540,Tempest,THE TEMPEST,Comedy,1611,William Shakespeare,contents,dialogue,ACT II,SCENE II,TRINCULO,1114,"Well drawn, monster, in good sooth!"
1540,Tempest,THE TEMPEST,Comedy,1611,William Shakespeare,contents,dialogue,ACT II,SCENE II,CALIBAN,1115,I’ll show thee every fertile inch o’ the island; and I will kiss thy
1540,Tempest,THE TEMPEST,Comedy,1611,William Shakespeare,contents,dialogue,ACT II,SCENE II,CALIBAN,1116,"foot. I prithee, be my god."
1540,Tempest,THE TEMPEST,Comedy,1611,William Shakespeare,contents,dialogue,ACT II,SCENE II,TRINCULO,1117,"By this light, a most perfidious and drunken monster. When ’s god’s"
1540,Tempest,THE TEMPEST,Comedy,1611,William Shakespeare,contents,dialogue,ACT II,SCENE II,TRINCULO,1118,"asleep, he’ll rob his bottle."
1540,Tempest,THE TEMPEST,Comedy,1611,William Shakespeare,contents,dialogue,ACT II,SCENE II,CALIBAN,1119,I’ll kiss thy foot. I’ll swear myself thy subject.
1540,Tempest,THE TEMPEST,Comedy,1611,William Shakespeare,contents,dialogue,ACT II,SCENE II,STEPHANO,1120,"Come on, then; down, and swear."
1540,Tempest,THE TEMPEST,Comedy,1611,William Shakespeare,contents,dialogue,ACT II,SCENE II,TRINCULO,1121,I shall laugh myself to death at this puppy-headed monster. A most
1540,Tempest,THE TEMPEST,Comedy,1611,William Shakespeare,contents,dialogue,ACT II,SCENE II,TRINCULO,1122,"scurvy monster! I could find in my heart to beat him,—"
1540,Tempest,THE TEMPEST,Comedy,1611,William Shakespeare,contents,dialogue,ACT II,SCENE II,STEPHANO,1123,"Come, kiss."
1540,Tempest,THE TEMPEST,Comedy,1611,William Shakespeare,contents,dialogue,ACT II,SCENE II,TRINCULO,1124,But that the poor monster’s in drink. An abominable monster!
1540,Tempest,THE TEMPEST,Comedy,1611,William Shakespeare,contents,dialogue,ACT II,SCENE II,CALIBAN,1125,I’ll show thee the best springs; I’ll pluck thee berries;
1540,Tempest,THE TEMPEST,Comedy,1611,William Shakespeare,contents,dialogue,ACT II,SCENE II,CALIBAN,1126,"I’ll fish for thee, and get thee wood enough."
1540,Tempest,THE TEMPEST,Comedy,1611,William Shakespeare,contents,dialogue,ACT II,SCENE II,CALIBAN,1127,A plague upon the tyrant that I serve!
1540,Tempest,THE TEMPEST,Comedy,1611,William Shakespeare,contents,dialogue,ACT II,SCENE II,CALIBAN,1128,"I’ll bear him no more sticks, but follow thee,"
1540,Tempest,THE TEMPEST,Comedy,1611,William Shakespeare,contents,dialogue,ACT II,SCENE II,CALIBAN,1129,Thou wondrous man.
1540,Tempest,THE TEMPEST,Comedy,1611,William Shakespeare,contents,dialogue,ACT II,SCENE II,TRINCULO,1130,"A most ridiculous monster, to make a wonder of a poor drunkard!"
1540,Tempest,THE TEMPEST,Comedy,1611,William Shakespeare,contents,dialogue,ACT II,SCENE II,CALIBAN,1131,"I prithee, let me bring thee where crabs grow;"
1540,Tempest,THE TEMPEST,Comedy,1611,William Shakespeare,contents,dialogue,ACT II,SCENE II,CALIBAN,1132,And I with my long nails will dig thee pig-nuts;
1540,Tempest,THE TEMPEST,Comedy,1611,William Shakespeare,contents,dialogue,ACT II,SCENE II,CALIBAN,1133,"Show thee a jay’s nest, and instruct thee how"
1540,Tempest,THE TEMPEST,Comedy,1611,William Shakespeare,contents,dialogue,ACT II,SCENE II,CALIBAN,1134,To snare the nimble marmoset; I’ll bring thee
1540,Tempest,THE TEMPEST,Comedy,1611,William Shakespeare,contents,dialogue,ACT II,SCENE II,CALIBAN,1135,"To clustering filberts, and sometimes I’ll get thee"
1540,Tempest,THE TEMPEST,Comedy,1611,William Shakespeare,contents,dialogue,ACT II,SCENE II,CALIBAN,1136,Young scamels from the rock. Wilt thou go with me?
1540,Tempest,THE TEMPEST,Comedy,1611,William Shakespeare,contents,dialogue,ACT II,SCENE II,STEPHANO,1137,"I prithee now, lead the way without any more talking. Trinculo, the"
1540,Tempest,THE TEMPEST,Comedy,1611,William Shakespeare,contents,dialogue,ACT II,SCENE II,STEPHANO,1138,"King and all our company else being drowned, we will inherit here."
1540,Tempest,THE TEMPEST,Comedy,1611,William Shakespeare,contents,dialogue,ACT II,SCENE II,STEPHANO,1139,"Here, bear my bottle. Fellow Trinculo, we’ll fill him by and by again."
1540,Tempest,THE TEMPEST,Comedy,1611,William Shakespeare,contents,directions,ACT II,SCENE II,NA,NA,"[Sings drunkenly.] Farewell, master; farewell, farewell!"
1540,Tempest,THE TEMPEST,Comedy,1611,William Shakespeare,contents,dialogue,ACT II,SCENE II,TRINCULO,1140,"A howling monster, a drunken monster."
1540,Tempest,THE TEMPEST,Comedy,1611,William Shakespeare,contents,dialogue,ACT II,SCENE II,CALIBAN,1141,No more dams I’ll make for fish;
1540,Tempest,THE TEMPEST,Comedy,1611,William Shakespeare,contents,dialogue,ACT II,SCENE II,CALIBAN,1142,Nor fetch in firing
1540,Tempest,THE TEMPEST,Comedy,1611,William Shakespeare,contents,dialogue,ACT II,SCENE II,CALIBAN,1143,"At requiring,"
1540,Tempest,THE TEMPEST,Comedy,1611,William Shakespeare,contents,dialogue,ACT II,SCENE II,CALIBAN,1144,"Nor scrape trenchering, nor wash dish;"
1540,Tempest,THE TEMPEST,Comedy,1611,William Shakespeare,contents,dialogue,ACT II,SCENE II,CALIBAN,1145,"’Ban ’Ban, Cacaliban,"
1540,Tempest,THE TEMPEST,Comedy,1611,William Shakespeare,contents,dialogue,ACT II,SCENE II,CALIBAN,1146,Has a new master—Get a new man.
1540,Tempest,THE TEMPEST,Comedy,1611,William Shakespeare,contents,dialogue,ACT II,SCENE II,CALIBAN,1147,"Freedom, high-day! high-day, freedom! freedom,"
1540,Tempest,THE TEMPEST,Comedy,1611,William Shakespeare,contents,dialogue,ACT II,SCENE II,CALIBAN,1148,"high-day, freedom!"
1540,Tempest,THE TEMPEST,Comedy,1611,William Shakespeare,contents,dialogue,ACT II,SCENE II,STEPHANO,1149,O brave monster! lead the way.
1540,Tempest,THE TEMPEST,Comedy,1611,William Shakespeare,contents,directions,ACT II,SCENE II,NA,NA,[Exeunt.]
1540,Tempest,THE TEMPEST,Comedy,1611,William Shakespeare,contents,reference,ACT III,SCENE II,NA,NA,ACT III
1540,Tempest,THE TEMPEST,Comedy,1611,William Shakespeare,contents,reference,ACT III,SCENE I,NA,NA,SCENE I. Before Prospero’s cell.
1540,Tempest,THE TEMPEST,Comedy,1611,William Shakespeare,contents,directions,ACT III,SCENE I,NA,NA,Enter Ferdinand bearing a log.
1540,Tempest,THE TEMPEST,Comedy,1611,William Shakespeare,contents,dialogue,ACT III,SCENE I,FERDINAND,1150,"There be some sports are painful, and their labour"
1540,Tempest,THE TEMPEST,Comedy,1611,William Shakespeare,contents,dialogue,ACT III,SCENE I,FERDINAND,1151,Delight in them sets off: some kinds of baseness
1540,Tempest,THE TEMPEST,Comedy,1611,William Shakespeare,contents,dialogue,ACT III,SCENE I,FERDINAND,1152,Are nobly undergone; and most poor matters
1540,Tempest,THE TEMPEST,Comedy,1611,William Shakespeare,contents,dialogue,ACT III,SCENE I,FERDINAND,1153,Point to rich ends. This my mean task
1540,Tempest,THE TEMPEST,Comedy,1611,William Shakespeare,contents,dialogue,ACT III,SCENE I,FERDINAND,1154,"Would be as heavy to me as odious, but"
1540,Tempest,THE TEMPEST,Comedy,1611,William Shakespeare,contents,dialogue,ACT III,SCENE I,FERDINAND,1155,"The mistress which I serve quickens what’s dead,"
1540,Tempest,THE TEMPEST,Comedy,1611,William Shakespeare,contents,dialogue,ACT III,SCENE I,FERDINAND,1156,"And makes my labours pleasures: O, she is"
1540,Tempest,THE TEMPEST,Comedy,1611,William Shakespeare,contents,dialogue,ACT III,SCENE I,FERDINAND,1157,"Ten times more gentle than her father’s crabbed,"
1540,Tempest,THE TEMPEST,Comedy,1611,William Shakespeare,contents,dialogue,ACT III,SCENE I,FERDINAND,1158,And he’s compos’d of harshness. I must remove
1540,Tempest,THE TEMPEST,Comedy,1611,William Shakespeare,contents,dialogue,ACT III,SCENE I,FERDINAND,1159,"Some thousands of these logs, and pile them up,"
