gutenberg_id,short_title,gutenberg_title,genre,year,author,section,class,act,scene,character,line_number,text
1540,Tempest,THE TEMPEST,Comedy,1611,William Shakespeare,contents,dialogue,ACT I,SCENE II,PROSPERO,482,"Deservedly confin’d into this rock,"
1540,Tempest,THE TEMPEST,Comedy,1611,William Shakespeare,contents,dialogue,ACT I,SCENE II,PROSPERO,483,Who hadst deserv’d more than a prison.
1540,Tempest,THE TEMPEST,Comedy,1611,William Shakespeare,contents,dialogue,ACT I,SCENE II,CALIBAN,484,"You taught me language, and my profit on ’t"
1540,Tempest,THE TEMPEST,Comedy,1611,William Shakespeare,contents,dialogue,ACT I,SCENE II,CALIBAN,485,"Is, I know how to curse. The red plague rid you,"
1540,Tempest,THE TEMPEST,Comedy,1611,William Shakespeare,contents,dialogue,ACT I,SCENE II,CALIBAN,486,For learning me your language!
1540,Tempest,THE TEMPEST,Comedy,1611,William Shakespeare,contents,dialogue,ACT I,SCENE II,PROSPERO,487,"Hag-seed, hence!"
1540,Tempest,THE TEMPEST,Comedy,1611,William Shakespeare,contents,dialogue,ACT I,SCENE II,PROSPERO,488,"Fetch us in fuel; and be quick, thou ’rt best,"
1540,Tempest,THE TEMPEST,Comedy,1611,William Shakespeare,contents,dialogue,ACT I,SCENE II,PROSPERO,489,"To answer other business. Shrug’st thou, malice?"
1540,Tempest,THE TEMPEST,Comedy,1611,William Shakespeare,contents,dialogue,ACT I,SCENE II,PROSPERO,490,"If thou neglect’st, or dost unwillingly"
1540,Tempest,THE TEMPEST,Comedy,1611,William Shakespeare,contents,dialogue,ACT I,SCENE II,PROSPERO,491,"What I command, I’ll rack thee with old cramps,"
1540,Tempest,THE TEMPEST,Comedy,1611,William Shakespeare,contents,dialogue,ACT I,SCENE II,PROSPERO,492,"Fill all thy bones with aches, make thee roar,"
1540,Tempest,THE TEMPEST,Comedy,1611,William Shakespeare,contents,dialogue,ACT I,SCENE II,PROSPERO,493,That beasts shall tremble at thy din.
1540,Tempest,THE TEMPEST,Comedy,1611,William Shakespeare,contents,dialogue,ACT I,SCENE II,CALIBAN,494,"No, pray thee."
1540,Tempest,THE TEMPEST,Comedy,1611,William Shakespeare,contents,directions,ACT I,SCENE II,NA,NA,"[Aside.] I must obey. His art is of such power,"
1540,Tempest,THE TEMPEST,Comedy,1611,William Shakespeare,contents,dialogue,ACT I,SCENE II,CALIBAN,495,"It would control my dam’s god, Setebos,"
1540,Tempest,THE TEMPEST,Comedy,1611,William Shakespeare,contents,dialogue,ACT I,SCENE II,CALIBAN,496,And make a vassal of him.
1540,Tempest,THE TEMPEST,Comedy,1611,William Shakespeare,contents,dialogue,ACT I,SCENE II,PROSPERO,497,"So, slave, hence!"
1540,Tempest,THE TEMPEST,Comedy,1611,William Shakespeare,contents,directions,ACT I,SCENE II,NA,NA,[Exit Caliban.]
1540,Tempest,THE TEMPEST,Comedy,1611,William Shakespeare,contents,directions,ACT I,SCENE II,NA,NA,"Re-enter Ariel, playing and singing; Ferdinand following."
1540,Tempest,THE TEMPEST,Comedy,1611,William Shakespeare,contents,dialogue,ACT I,SCENE II,PROSPERO,498,ARIEL’S SONG.
1540,Tempest,THE TEMPEST,Comedy,1611,William Shakespeare,contents,dialogue,ACT I,SCENE II,PROSPERO,499,"Come unto these yellow sands,"
1540,Tempest,THE TEMPEST,Comedy,1611,William Shakespeare,contents,dialogue,ACT I,SCENE II,PROSPERO,500,And then take hands:
1540,Tempest,THE TEMPEST,Comedy,1611,William Shakespeare,contents,dialogue,ACT I,SCENE II,PROSPERO,501,"Curtsied when you have, and kiss’d"
1540,Tempest,THE TEMPEST,Comedy,1611,William Shakespeare,contents,dialogue,ACT I,SCENE II,PROSPERO,502,The wild waves whist.
1540,Tempest,THE TEMPEST,Comedy,1611,William Shakespeare,contents,dialogue,ACT I,SCENE II,PROSPERO,503,"Foot it featly here and there,"
1540,Tempest,THE TEMPEST,Comedy,1611,William Shakespeare,contents,dialogue,ACT I,SCENE II,PROSPERO,504,And sweet sprites bear
1540,Tempest,THE TEMPEST,Comedy,1611,William Shakespeare,contents,dialogue,ACT I,SCENE II,PROSPERO,505,"The burden. Hark, hark!"
1540,Tempest,THE TEMPEST,Comedy,1611,William Shakespeare,contents,dialogue,ACT I,SCENE II,PROSPERO,506,Burden dispersedly. Bow-wow.
1540,Tempest,THE TEMPEST,Comedy,1611,William Shakespeare,contents,dialogue,ACT I,SCENE II,PROSPERO,507,The watch dogs bark.
1540,Tempest,THE TEMPEST,Comedy,1611,William Shakespeare,contents,directions,ACT I,SCENE II,NA,NA,[Burden dispersedly.] Bow-wow.
1540,Tempest,THE TEMPEST,Comedy,1611,William Shakespeare,contents,dialogue,ACT I,SCENE II,PROSPERO,508,"Hark, hark! I hear"
1540,Tempest,THE TEMPEST,Comedy,1611,William Shakespeare,contents,dialogue,ACT I,SCENE II,PROSPERO,509,The strain of strutting chanticleer
1540,Tempest,THE TEMPEST,Comedy,1611,William Shakespeare,contents,dialogue,ACT I,SCENE II,PROSPERO,510,Cry cock-a-diddle-dow.
1540,Tempest,THE TEMPEST,Comedy,1611,William Shakespeare,contents,dialogue,ACT I,SCENE II,FERDINAND,511,Where should this music be? i’ th’ air or th’ earth?
1540,Tempest,THE TEMPEST,Comedy,1611,William Shakespeare,contents,dialogue,ACT I,SCENE II,FERDINAND,512,It sounds no more; and sure it waits upon
1540,Tempest,THE TEMPEST,Comedy,1611,William Shakespeare,contents,dialogue,ACT I,SCENE II,FERDINAND,513,"Some god o’ th’ island. Sitting on a bank,"
1540,Tempest,THE TEMPEST,Comedy,1611,William Shakespeare,contents,dialogue,ACT I,SCENE II,FERDINAND,514,"Weeping again the King my father’s wrack,"
1540,Tempest,THE TEMPEST,Comedy,1611,William Shakespeare,contents,dialogue,ACT I,SCENE II,FERDINAND,515,"This music crept by me upon the waters,"
1540,Tempest,THE TEMPEST,Comedy,1611,William Shakespeare,contents,dialogue,ACT I,SCENE II,FERDINAND,516,Allaying both their fury and my passion
1540,Tempest,THE TEMPEST,Comedy,1611,William Shakespeare,contents,dialogue,ACT I,SCENE II,FERDINAND,517,"With its sweet air: thence I have follow’d it,"
1540,Tempest,THE TEMPEST,Comedy,1611,William Shakespeare,contents,dialogue,ACT I,SCENE II,FERDINAND,518,"Or it hath drawn me rather,—but ’tis gone."
1540,Tempest,THE TEMPEST,Comedy,1611,William Shakespeare,contents,dialogue,ACT I,SCENE II,FERDINAND,519,"No, it begins again."
1540,Tempest,THE TEMPEST,Comedy,1611,William Shakespeare,contents,directions,ACT I,SCENE II,NA,NA,[Sings.]
1540,Tempest,THE TEMPEST,Comedy,1611,William Shakespeare,contents,dialogue,ACT I,SCENE II,ARIEL,520,Full fathom five thy father lies.
1540,Tempest,THE TEMPEST,Comedy,1611,William Shakespeare,contents,dialogue,ACT I,SCENE II,ARIEL,521,Of his bones are coral made.
1540,Tempest,THE TEMPEST,Comedy,1611,William Shakespeare,contents,dialogue,ACT I,SCENE II,ARIEL,522,Those are pearls that were his eyes.
1540,Tempest,THE TEMPEST,Comedy,1611,William Shakespeare,contents,dialogue,ACT I,SCENE II,ARIEL,523,Nothing of him that doth fade
1540,Tempest,THE TEMPEST,Comedy,1611,William Shakespeare,contents,dialogue,ACT I,SCENE II,ARIEL,524,But doth suffer a sea-change
1540,Tempest,THE TEMPEST,Comedy,1611,William Shakespeare,contents,dialogue,ACT I,SCENE II,ARIEL,525,Into something rich and strange.
1540,Tempest,THE TEMPEST,Comedy,1611,William Shakespeare,contents,dialogue,ACT I,SCENE II,ARIEL,526,Sea-nymphs hourly ring his knell:
1540,Tempest,THE TEMPEST,Comedy,1611,William Shakespeare,contents,dialogue,ACT I,SCENE II,ARIEL,527,Burden: Ding-dong.
1540,Tempest,THE TEMPEST,Comedy,1611,William Shakespeare,contents,dialogue,ACT I,SCENE II,ARIEL,528,"Hark! now I hear them: ding-dong, bell."
1540,Tempest,THE TEMPEST,Comedy,1611,William Shakespeare,contents,dialogue,ACT I,SCENE II,FERDINAND,529,The ditty does remember my drown’d father.
1540,Tempest,THE TEMPEST,Comedy,1611,William Shakespeare,contents,dialogue,ACT I,SCENE II,FERDINAND,530,"This is no mortal business, nor no sound"
1540,Tempest,THE TEMPEST,Comedy,1611,William Shakespeare,contents,dialogue,ACT I,SCENE II,FERDINAND,531,That the earth owes:—I hear it now above me.
1540,Tempest,THE TEMPEST,Comedy,1611,William Shakespeare,contents,dialogue,ACT I,SCENE II,PROSPERO,532,"The fringed curtains of thine eye advance,"
1540,Tempest,THE TEMPEST,Comedy,1611,William Shakespeare,contents,dialogue,ACT I,SCENE II,PROSPERO,533,And say what thou seest yond.
1540,Tempest,THE TEMPEST,Comedy,1611,William Shakespeare,contents,dialogue,ACT I,SCENE II,MIRANDA,534,What is’t? a spirit?
1540,Tempest,THE TEMPEST,Comedy,1611,William Shakespeare,contents,dialogue,ACT I,SCENE II,MIRANDA,535,"Lord, how it looks about! Believe me, sir,"
1540,Tempest,THE TEMPEST,Comedy,1611,William Shakespeare,contents,dialogue,ACT I,SCENE II,MIRANDA,536,It carries a brave form. But ’tis a spirit.
1540,Tempest,THE TEMPEST,Comedy,1611,William Shakespeare,contents,dialogue,ACT I,SCENE II,PROSPERO,537,"No, wench; it eats and sleeps and hath such senses"
1540,Tempest,THE TEMPEST,Comedy,1611,William Shakespeare,contents,dialogue,ACT I,SCENE II,PROSPERO,538,"As we have, such. This gallant which thou seest"
1540,Tempest,THE TEMPEST,Comedy,1611,William Shakespeare,contents,dialogue,ACT I,SCENE II,PROSPERO,539,"Was in the wrack; and, but he’s something stain’d"
1540,Tempest,THE TEMPEST,Comedy,1611,William Shakespeare,contents,dialogue,ACT I,SCENE II,PROSPERO,540,"With grief,—that’s beauty’s canker,—thou mightst call him"
1540,Tempest,THE TEMPEST,Comedy,1611,William Shakespeare,contents,dialogue,ACT I,SCENE II,PROSPERO,541,A goodly person: he hath lost his fellows
1540,Tempest,THE TEMPEST,Comedy,1611,William Shakespeare,contents,dialogue,ACT I,SCENE II,PROSPERO,542,And strays about to find ’em.
1540,Tempest,THE TEMPEST,Comedy,1611,William Shakespeare,contents,dialogue,ACT I,SCENE II,MIRANDA,543,I might call him
1540,Tempest,THE TEMPEST,Comedy,1611,William Shakespeare,contents,dialogue,ACT I,SCENE II,MIRANDA,544,A thing divine; for nothing natural
1540,Tempest,THE TEMPEST,Comedy,1611,William Shakespeare,contents,dialogue,ACT I,SCENE II,MIRANDA,545,I ever saw so noble.
1540,Tempest,THE TEMPEST,Comedy,1611,William Shakespeare,contents,directions,ACT I,SCENE II,NA,NA,"[Aside.] It goes on, I see,"
1540,Tempest,THE TEMPEST,Comedy,1611,William Shakespeare,contents,dialogue,ACT I,SCENE II,PROSPERO,546,"As my soul prompts it. Spirit, fine spirit! I’ll free thee"
1540,Tempest,THE TEMPEST,Comedy,1611,William Shakespeare,contents,dialogue,ACT I,SCENE II,PROSPERO,547,Within two days for this.
1540,Tempest,THE TEMPEST,Comedy,1611,William Shakespeare,contents,dialogue,ACT I,SCENE II,FERDINAND,548,"Most sure, the goddess"
1540,Tempest,THE TEMPEST,Comedy,1611,William Shakespeare,contents,dialogue,ACT I,SCENE II,FERDINAND,549,"On whom these airs attend! Vouchsafe, my prayer"
1540,Tempest,THE TEMPEST,Comedy,1611,William Shakespeare,contents,dialogue,ACT I,SCENE II,FERDINAND,550,May know if you remain upon this island;
1540,Tempest,THE TEMPEST,Comedy,1611,William Shakespeare,contents,dialogue,ACT I,SCENE II,FERDINAND,551,And that you will some good instruction give
1540,Tempest,THE TEMPEST,Comedy,1611,William Shakespeare,contents,dialogue,ACT I,SCENE II,FERDINAND,552,"How I may bear me here: my prime request,"
1540,Tempest,THE TEMPEST,Comedy,1611,William Shakespeare,contents,dialogue,ACT I,SCENE II,FERDINAND,553,"Which I do last pronounce, is, O you wonder!"
1540,Tempest,THE TEMPEST,Comedy,1611,William Shakespeare,contents,dialogue,ACT I,SCENE II,FERDINAND,554,If you be maid or no?
1540,Tempest,THE TEMPEST,Comedy,1611,William Shakespeare,contents,dialogue,ACT I,SCENE II,MIRANDA,555,"No wonder, sir;"
1540,Tempest,THE TEMPEST,Comedy,1611,William Shakespeare,contents,dialogue,ACT I,SCENE II,MIRANDA,556,But certainly a maid.
1540,Tempest,THE TEMPEST,Comedy,1611,William Shakespeare,contents,dialogue,ACT I,SCENE II,FERDINAND,557,My language! Heavens!
1540,Tempest,THE TEMPEST,Comedy,1611,William Shakespeare,contents,dialogue,ACT I,SCENE II,FERDINAND,558,"I am the best of them that speak this speech,"
1540,Tempest,THE TEMPEST,Comedy,1611,William Shakespeare,contents,dialogue,ACT I,SCENE II,FERDINAND,559,Were I but where ’tis spoken.
1540,Tempest,THE TEMPEST,Comedy,1611,William Shakespeare,contents,dialogue,ACT I,SCENE II,PROSPERO,560,How! the best?
1540,Tempest,THE TEMPEST,Comedy,1611,William Shakespeare,contents,dialogue,ACT I,SCENE II,PROSPERO,561,"What wert thou, if the King of Naples heard thee?"
1540,Tempest,THE TEMPEST,Comedy,1611,William Shakespeare,contents,dialogue,ACT I,SCENE II,FERDINAND,562,"A single thing, as I am now, that wonders"
1540,Tempest,THE TEMPEST,Comedy,1611,William Shakespeare,contents,dialogue,ACT I,SCENE II,FERDINAND,563,To hear thee speak of Naples. He does hear me;
1540,Tempest,THE TEMPEST,Comedy,1611,William Shakespeare,contents,dialogue,ACT I,SCENE II,FERDINAND,564,"And that he does I weep: myself am Naples,"
1540,Tempest,THE TEMPEST,Comedy,1611,William Shakespeare,contents,dialogue,ACT I,SCENE II,FERDINAND,565,"Who with mine eyes, never since at ebb, beheld"
1540,Tempest,THE TEMPEST,Comedy,1611,William Shakespeare,contents,dialogue,ACT I,SCENE II,FERDINAND,566,The King my father wrack’d.
1540,Tempest,THE TEMPEST,Comedy,1611,William Shakespeare,contents,dialogue,ACT I,SCENE II,MIRANDA,567,"Alack, for mercy!"
1540,Tempest,THE TEMPEST,Comedy,1611,William Shakespeare,contents,dialogue,ACT I,SCENE II,FERDINAND,568,"Yes, faith, and all his lords, the Duke of Milan,"
1540,Tempest,THE TEMPEST,Comedy,1611,William Shakespeare,contents,dialogue,ACT I,SCENE II,FERDINAND,569,And his brave son being twain.
1540,Tempest,THE TEMPEST,Comedy,1611,William Shakespeare,contents,directions,ACT I,SCENE II,NA,NA,[Aside.] The Duke of Milan
1540,Tempest,THE TEMPEST,Comedy,1611,William Shakespeare,contents,dialogue,ACT I,SCENE II,PROSPERO,570,"And his more braver daughter could control thee,"
1540,Tempest,THE TEMPEST,Comedy,1611,William Shakespeare,contents,dialogue,ACT I,SCENE II,PROSPERO,571,If now ’twere fit to do’t. At the first sight
1540,Tempest,THE TEMPEST,Comedy,1611,William Shakespeare,contents,dialogue,ACT I,SCENE II,PROSPERO,572,"They have changed eyes. Delicate Ariel,"
1540,Tempest,THE TEMPEST,Comedy,1611,William Shakespeare,contents,dialogue,ACT I,SCENE II,PROSPERO,573,"I’ll set thee free for this. [To Ferdinand.] A word, good sir."
1540,Tempest,THE TEMPEST,Comedy,1611,William Shakespeare,contents,dialogue,ACT I,SCENE II,PROSPERO,574,I fear you have done yourself some wrong: a word.
1540,Tempest,THE TEMPEST,Comedy,1611,William Shakespeare,contents,dialogue,ACT I,SCENE II,MIRANDA,575,Why speaks my father so ungently? This
1540,Tempest,THE TEMPEST,Comedy,1611,William Shakespeare,contents,dialogue,ACT I,SCENE II,MIRANDA,576,Is the third man that e’er I saw; the first
1540,Tempest,THE TEMPEST,Comedy,1611,William Shakespeare,contents,dialogue,ACT I,SCENE II,MIRANDA,577,That e’er I sigh’d for. Pity move my father
1540,Tempest,THE TEMPEST,Comedy,1611,William Shakespeare,contents,dialogue,ACT I,SCENE II,MIRANDA,578,To be inclin’d my way!
1540,Tempest,THE TEMPEST,Comedy,1611,William Shakespeare,contents,dialogue,ACT I,SCENE II,FERDINAND,579,"O! if a virgin,"
1540,Tempest,THE TEMPEST,Comedy,1611,William Shakespeare,contents,dialogue,ACT I,SCENE II,FERDINAND,580,"And your affection not gone forth, I’ll make you"
1540,Tempest,THE TEMPEST,Comedy,1611,William Shakespeare,contents,dialogue,ACT I,SCENE II,FERDINAND,581,The Queen of Naples.
1540,Tempest,THE TEMPEST,Comedy,1611,William Shakespeare,contents,dialogue,ACT I,SCENE II,PROSPERO,582,"Soft, sir; one word more."
1540,Tempest,THE TEMPEST,Comedy,1611,William Shakespeare,contents,directions,ACT I,SCENE II,NA,NA,[Aside.] They are both in either’s powers. But this swift business
1540,Tempest,THE TEMPEST,Comedy,1611,William Shakespeare,contents,dialogue,ACT I,SCENE II,PROSPERO,583,"I must uneasy make, lest too light winning"
1540,Tempest,THE TEMPEST,Comedy,1611,William Shakespeare,contents,dialogue,ACT I,SCENE II,PROSPERO,584,Make the prize light. [To Ferdinand.] One word more. I charge thee
1540,Tempest,THE TEMPEST,Comedy,1611,William Shakespeare,contents,dialogue,ACT I,SCENE II,PROSPERO,585,That thou attend me. Thou dost here usurp
1540,Tempest,THE TEMPEST,Comedy,1611,William Shakespeare,contents,dialogue,ACT I,SCENE II,PROSPERO,586,The name thou ow’st not; and hast put thyself
1540,Tempest,THE TEMPEST,Comedy,1611,William Shakespeare,contents,dialogue,ACT I,SCENE II,PROSPERO,587,"Upon this island as a spy, to win it"
1540,Tempest,THE TEMPEST,Comedy,1611,William Shakespeare,contents,dialogue,ACT I,SCENE II,PROSPERO,588,"From me, the lord on ’t."
1540,Tempest,THE TEMPEST,Comedy,1611,William Shakespeare,contents,dialogue,ACT I,SCENE II,FERDINAND,589,"No, as I am a man."
1540,Tempest,THE TEMPEST,Comedy,1611,William Shakespeare,contents,dialogue,ACT I,SCENE II,MIRANDA,590,There’s nothing ill can dwell in such a temple:
1540,Tempest,THE TEMPEST,Comedy,1611,William Shakespeare,contents,dialogue,ACT I,SCENE II,MIRANDA,591,"If the ill spirit have so fair a house,"
1540,Tempest,THE TEMPEST,Comedy,1611,William Shakespeare,contents,dialogue,ACT I,SCENE II,MIRANDA,592,Good things will strive to dwell with ’t.
1540,Tempest,THE TEMPEST,Comedy,1611,William Shakespeare,contents,directions,ACT I,SCENE II,NA,NA,[To Ferdinand.] Follow me.—
1540,Tempest,THE TEMPEST,Comedy,1611,William Shakespeare,contents,directions,ACT I,SCENE II,NA,NA,[To Miranda.] Speak not you for him; he’s a traitor.
1540,Tempest,THE TEMPEST,Comedy,1611,William Shakespeare,contents,directions,ACT I,SCENE II,NA,NA,[To Ferdinand.] Come;
1540,Tempest,THE TEMPEST,Comedy,1611,William Shakespeare,contents,dialogue,ACT I,SCENE II,PROSPERO,593,I’ll manacle thy neck and feet together:
1540,Tempest,THE TEMPEST,Comedy,1611,William Shakespeare,contents,dialogue,ACT I,SCENE II,PROSPERO,594,Sea-water shalt thou drink; thy food shall be
1540,Tempest,THE TEMPEST,Comedy,1611,William Shakespeare,contents,dialogue,ACT I,SCENE II,PROSPERO,595,"The fresh-brook mussels, wither’d roots, and husks"
1540,Tempest,THE TEMPEST,Comedy,1611,William Shakespeare,contents,dialogue,ACT I,SCENE II,PROSPERO,596,Wherein the acorn cradled. Follow.
1540,Tempest,THE TEMPEST,Comedy,1611,William Shakespeare,contents,dialogue,ACT I,SCENE II,FERDINAND,597,No;
1540,Tempest,THE TEMPEST,Comedy,1611,William Shakespeare,contents,dialogue,ACT I,SCENE II,FERDINAND,598,I will resist such entertainment till
1540,Tempest,THE TEMPEST,Comedy,1611,William Shakespeare,contents,dialogue,ACT I,SCENE II,FERDINAND,599,Mine enemy has more power.
1540,Tempest,THE TEMPEST,Comedy,1611,William Shakespeare,contents,directions,ACT I,SCENE II,NA,NA,"[He draws, and is charmed from moving.]"
1540,Tempest,THE TEMPEST,Comedy,1611,William Shakespeare,contents,dialogue,ACT I,SCENE II,MIRANDA,600,O dear father!
1540,Tempest,THE TEMPEST,Comedy,1611,William Shakespeare,contents,dialogue,ACT I,SCENE II,MIRANDA,601,"Make not too rash a trial of him, for"
1540,Tempest,THE TEMPEST,Comedy,1611,William Shakespeare,contents,dialogue,ACT I,SCENE II,MIRANDA,602,"He’s gentle, and not fearful."
1540,Tempest,THE TEMPEST,Comedy,1611,William Shakespeare,contents,dialogue,ACT I,SCENE II,PROSPERO,603,"What! I say,"
1540,Tempest,THE TEMPEST,Comedy,1611,William Shakespeare,contents,dialogue,ACT I,SCENE II,PROSPERO,604,"My foot my tutor? Put thy sword up, traitor;"
1540,Tempest,THE TEMPEST,Comedy,1611,William Shakespeare,contents,dialogue,ACT I,SCENE II,PROSPERO,605,"Who mak’st a show, but dar’st not strike, thy conscience"
1540,Tempest,THE TEMPEST,Comedy,1611,William Shakespeare,contents,dialogue,ACT I,SCENE II,PROSPERO,606,"Is so possess’d with guilt: come from thy ward,"
1540,Tempest,THE TEMPEST,Comedy,1611,William Shakespeare,contents,dialogue,ACT I,SCENE II,PROSPERO,607,For I can here disarm thee with this stick
1540,Tempest,THE TEMPEST,Comedy,1611,William Shakespeare,contents,dialogue,ACT I,SCENE II,PROSPERO,608,And make thy weapon drop.
1540,Tempest,THE TEMPEST,Comedy,1611,William Shakespeare,contents,dialogue,ACT I,SCENE II,MIRANDA,609,"Beseech you, father!"
1540,Tempest,THE TEMPEST,Comedy,1611,William Shakespeare,contents,dialogue,ACT I,SCENE II,PROSPERO,610,Hence! Hang not on my garments.
1540,Tempest,THE TEMPEST,Comedy,1611,William Shakespeare,contents,dialogue,ACT I,SCENE II,MIRANDA,611,"Sir, have pity;"
1540,Tempest,THE TEMPEST,Comedy,1611,William Shakespeare,contents,dialogue,ACT I,SCENE II,MIRANDA,612,I’ll be his surety.
1540,Tempest,THE TEMPEST,Comedy,1611,William Shakespeare,contents,dialogue,ACT I,SCENE II,PROSPERO,613,Silence! One word more
1540,Tempest,THE TEMPEST,Comedy,1611,William Shakespeare,contents,dialogue,ACT I,SCENE II,PROSPERO,614,"Shall make me chide thee, if not hate thee. What!"
1540,Tempest,THE TEMPEST,Comedy,1611,William Shakespeare,contents,dialogue,ACT I,SCENE II,PROSPERO,615,An advocate for an impostor? hush!
1540,Tempest,THE TEMPEST,Comedy,1611,William Shakespeare,contents,dialogue,ACT I,SCENE II,PROSPERO,616,"Thou think’st there is no more such shapes as he,"
1540,Tempest,THE TEMPEST,Comedy,1611,William Shakespeare,contents,dialogue,ACT I,SCENE II,PROSPERO,617,Having seen but him and Caliban: foolish wench!
1540,Tempest,THE TEMPEST,Comedy,1611,William Shakespeare,contents,dialogue,ACT I,SCENE II,PROSPERO,618,"To th’ most of men this is a Caliban,"
1540,Tempest,THE TEMPEST,Comedy,1611,William Shakespeare,contents,dialogue,ACT I,SCENE II,PROSPERO,619,And they to him are angels.
1540,Tempest,THE TEMPEST,Comedy,1611,William Shakespeare,contents,dialogue,ACT I,SCENE II,MIRANDA,620,My affections
1540,Tempest,THE TEMPEST,Comedy,1611,William Shakespeare,contents,dialogue,ACT I,SCENE II,MIRANDA,621,Are then most humble; I have no ambition
1540,Tempest,THE TEMPEST,Comedy,1611,William Shakespeare,contents,dialogue,ACT I,SCENE II,MIRANDA,622,To see a goodlier man.
1540,Tempest,THE TEMPEST,Comedy,1611,William Shakespeare,contents,directions,ACT I,SCENE II,NA,NA,[To Ferdinand.] Come on; obey:
1540,Tempest,THE TEMPEST,Comedy,1611,William Shakespeare,contents,dialogue,ACT I,SCENE II,PROSPERO,623,"Thy nerves are in their infancy again,"
1540,Tempest,THE TEMPEST,Comedy,1611,William Shakespeare,contents,dialogue,ACT I,SCENE II,PROSPERO,624,And have no vigour in them.
1540,Tempest,THE TEMPEST,Comedy,1611,William Shakespeare,contents,dialogue,ACT I,SCENE II,FERDINAND,625,So they are:
1540,Tempest,THE TEMPEST,Comedy,1611,William Shakespeare,contents,dialogue,ACT I,SCENE II,FERDINAND,626,"My spirits, as in a dream, are all bound up."
1540,Tempest,THE TEMPEST,Comedy,1611,William Shakespeare,contents,dialogue,ACT I,SCENE II,FERDINAND,627,"My father’s loss, the weakness which I feel,"
1540,Tempest,THE TEMPEST,Comedy,1611,William Shakespeare,contents,dialogue,ACT I,SCENE II,FERDINAND,628,"The wrack of all my friends, nor this man’s threats,"
1540,Tempest,THE TEMPEST,Comedy,1611,William Shakespeare,contents,dialogue,ACT I,SCENE II,FERDINAND,629,"To whom I am subdued, are but light to me,"
1540,Tempest,THE TEMPEST,Comedy,1611,William Shakespeare,contents,dialogue,ACT I,SCENE II,FERDINAND,630,Might I but through my prison once a day
1540,Tempest,THE TEMPEST,Comedy,1611,William Shakespeare,contents,dialogue,ACT I,SCENE II,FERDINAND,631,Behold this maid: all corners else o’ th’ earth
1540,Tempest,THE TEMPEST,Comedy,1611,William Shakespeare,contents,dialogue,ACT I,SCENE II,FERDINAND,632,Let liberty make use of; space enough
1540,Tempest,THE TEMPEST,Comedy,1611,William Shakespeare,contents,dialogue,ACT I,SCENE II,FERDINAND,633,Have I in such a prison.
1540,Tempest,THE TEMPEST,Comedy,1611,William Shakespeare,contents,directions,ACT I,SCENE II,NA,NA,[Aside.] It works. [To Ferdinand.] Come on.
1540,Tempest,THE TEMPEST,Comedy,1611,William Shakespeare,contents,dialogue,ACT I,SCENE II,PROSPERO,634,"Thou hast done well, fine Ariel! [To Ferdinand.] Follow me."
1540,Tempest,THE TEMPEST,Comedy,1611,William Shakespeare,contents,directions,ACT I,SCENE II,NA,NA,[To Ariel.] Hark what thou else shalt do me.
1540,Tempest,THE TEMPEST,Comedy,1611,William Shakespeare,contents,dialogue,ACT I,SCENE II,MIRANDA,635,Be of comfort;
1540,Tempest,THE TEMPEST,Comedy,1611,William Shakespeare,contents,dialogue,ACT I,SCENE II,MIRANDA,636,"My father’s of a better nature, sir,"
1540,Tempest,THE TEMPEST,Comedy,1611,William Shakespeare,contents,dialogue,ACT I,SCENE II,MIRANDA,637,Than he appears by speech: this is unwonted
1540,Tempest,THE TEMPEST,Comedy,1611,William Shakespeare,contents,dialogue,ACT I,SCENE II,MIRANDA,638,Which now came from him.
1540,Tempest,THE TEMPEST,Comedy,1611,William Shakespeare,contents,dialogue,ACT I,SCENE II,PROSPERO,639,Thou shalt be as free
1540,Tempest,THE TEMPEST,Comedy,1611,William Shakespeare,contents,dialogue,ACT I,SCENE II,PROSPERO,640,As mountain winds; but then exactly do
1540,Tempest,THE TEMPEST,Comedy,1611,William Shakespeare,contents,dialogue,ACT I,SCENE II,PROSPERO,641,All points of my command.
1540,Tempest,THE TEMPEST,Comedy,1611,William Shakespeare,contents,dialogue,ACT I,SCENE II,ARIEL,642,To th’ syllable.
1540,Tempest,THE TEMPEST,Comedy,1611,William Shakespeare,contents,directions,ACT I,SCENE II,NA,NA,"[To Ferdinand.] Come, follow. Speak not for him."
1540,Tempest,THE TEMPEST,Comedy,1611,William Shakespeare,contents,directions,ACT I,SCENE II,NA,NA,[Exeunt.]
1540,Tempest,THE TEMPEST,Comedy,1611,William Shakespeare,contents,reference,ACT II,SCENE II,NA,NA,ACT II
1540,Tempest,THE TEMPEST,Comedy,1611,William Shakespeare,contents,reference,ACT II,SCENE I,NA,NA,SCENE I. Another part of the island.
1540,Tempest,THE TEMPEST,Comedy,1611,William Shakespeare,contents,directions,ACT II,SCENE I,NA,NA,"Enter Alonso, Sebastian, Antonio, Gonzalo, Adrian, Francisco and"
1540,Tempest,THE TEMPEST,Comedy,1611,William Shakespeare,contents,dialogue,ACT II,SCENE I,PROSPERO,643,others.
1540,Tempest,THE TEMPEST,Comedy,1611,William Shakespeare,contents,dialogue,ACT II,SCENE I,GONZALO,644,"Beseech you, sir, be merry; you have cause,"
1540,Tempest,THE TEMPEST,Comedy,1611,William Shakespeare,contents,dialogue,ACT II,SCENE I,GONZALO,645,"So have we all, of joy; for our escape"
1540,Tempest,THE TEMPEST,Comedy,1611,William Shakespeare,contents,dialogue,ACT II,SCENE I,GONZALO,646,Is much beyond our loss. Our hint of woe
