gutenberg_id,short_title,gutenberg_title,genre,year,author,section,class,act,scene,character,line_number,text
1540,Tempest,THE TEMPEST,Comedy,1611,William Shakespeare,contents,dialogue,ACT IV,SCENE I,PROSPERO,1657,I have from their confines call’d to enact
1540,Tempest,THE TEMPEST,Comedy,1611,William Shakespeare,contents,dialogue,ACT IV,SCENE I,PROSPERO,1658,My present fancies.
1540,Tempest,THE TEMPEST,Comedy,1611,William Shakespeare,contents,dialogue,ACT IV,SCENE I,FERDINAND,1659,Let me live here ever.
1540,Tempest,THE TEMPEST,Comedy,1611,William Shakespeare,contents,dialogue,ACT IV,SCENE I,FERDINAND,1660,"So rare a wonder’d father and a wise,"
1540,Tempest,THE TEMPEST,Comedy,1611,William Shakespeare,contents,dialogue,ACT IV,SCENE I,FERDINAND,1661,Makes this place Paradise.
1540,Tempest,THE TEMPEST,Comedy,1611,William Shakespeare,contents,directions,ACT IV,SCENE I,NA,NA,"[Juno and Ceres whisper, and send Iris on employment.]"
1540,Tempest,THE TEMPEST,Comedy,1611,William Shakespeare,contents,dialogue,ACT IV,SCENE I,PROSPERO,1662,"Sweet now, silence!"
1540,Tempest,THE TEMPEST,Comedy,1611,William Shakespeare,contents,dialogue,ACT IV,SCENE I,PROSPERO,1663,"Juno and Ceres whisper seriously,"
1540,Tempest,THE TEMPEST,Comedy,1611,William Shakespeare,contents,dialogue,ACT IV,SCENE I,PROSPERO,1664,"There’s something else to do: hush, and be mute,"
1540,Tempest,THE TEMPEST,Comedy,1611,William Shakespeare,contents,dialogue,ACT IV,SCENE I,PROSPERO,1665,Or else our spell is marr’d.
1540,Tempest,THE TEMPEST,Comedy,1611,William Shakespeare,contents,dialogue,ACT IV,SCENE I,IRIS,1666,"You nymphs, call’d Naiads, of the windring brooks,"
1540,Tempest,THE TEMPEST,Comedy,1611,William Shakespeare,contents,dialogue,ACT IV,SCENE I,IRIS,1667,"With your sedg’d crowns and ever-harmless looks,"
1540,Tempest,THE TEMPEST,Comedy,1611,William Shakespeare,contents,dialogue,ACT IV,SCENE I,IRIS,1668,"Leave your crisp channels, and on this green land"
1540,Tempest,THE TEMPEST,Comedy,1611,William Shakespeare,contents,dialogue,ACT IV,SCENE I,IRIS,1669,Answer your summons; Juno does command.
1540,Tempest,THE TEMPEST,Comedy,1611,William Shakespeare,contents,dialogue,ACT IV,SCENE I,IRIS,1670,"Come, temperate nymphs, and help to celebrate"
1540,Tempest,THE TEMPEST,Comedy,1611,William Shakespeare,contents,dialogue,ACT IV,SCENE I,IRIS,1671,A contract of true love. Be not too late.
1540,Tempest,THE TEMPEST,Comedy,1611,William Shakespeare,contents,directions,ACT IV,SCENE I,NA,NA,Enter certain Nymphs.
1540,Tempest,THE TEMPEST,Comedy,1611,William Shakespeare,contents,dialogue,ACT IV,SCENE I,IRIS,1672,"You sun-burn’d sicklemen, of August weary,"
1540,Tempest,THE TEMPEST,Comedy,1611,William Shakespeare,contents,dialogue,ACT IV,SCENE I,IRIS,1673,"Come hither from the furrow, and be merry:"
1540,Tempest,THE TEMPEST,Comedy,1611,William Shakespeare,contents,dialogue,ACT IV,SCENE I,IRIS,1674,"Make holiday: your rye-straw hats put on,"
1540,Tempest,THE TEMPEST,Comedy,1611,William Shakespeare,contents,dialogue,ACT IV,SCENE I,IRIS,1675,And these fresh nymphs encounter every one
1540,Tempest,THE TEMPEST,Comedy,1611,William Shakespeare,contents,dialogue,ACT IV,SCENE I,IRIS,1676,In country footing.
1540,Tempest,THE TEMPEST,Comedy,1611,William Shakespeare,contents,directions,ACT IV,SCENE I,NA,NA,"Enter certain Reapers, properly habited: they join with the Nymphs in"
1540,Tempest,THE TEMPEST,Comedy,1611,William Shakespeare,contents,dialogue,ACT IV,SCENE I,IRIS,1677,"a graceful dance; towards the end whereof Prospero starts suddenly,"
1540,Tempest,THE TEMPEST,Comedy,1611,William Shakespeare,contents,dialogue,ACT IV,SCENE I,IRIS,1678,"and speaks; after which, to a strange, hollow, and confused noise,"
1540,Tempest,THE TEMPEST,Comedy,1611,William Shakespeare,contents,dialogue,ACT IV,SCENE I,IRIS,1679,they heavily vanish.
1540,Tempest,THE TEMPEST,Comedy,1611,William Shakespeare,contents,directions,ACT IV,SCENE I,NA,NA,[Aside.] I had forgot that foul conspiracy
1540,Tempest,THE TEMPEST,Comedy,1611,William Shakespeare,contents,dialogue,ACT IV,SCENE I,PROSPERO,1680,Of the beast Caliban and his confederates
1540,Tempest,THE TEMPEST,Comedy,1611,William Shakespeare,contents,dialogue,ACT IV,SCENE I,PROSPERO,1681,Against my life: the minute of their plot
1540,Tempest,THE TEMPEST,Comedy,1611,William Shakespeare,contents,dialogue,ACT IV,SCENE I,PROSPERO,1682,Is almost come. [To the Spirits.] Well done! avoid; no
1540,Tempest,THE TEMPEST,Comedy,1611,William Shakespeare,contents,dialogue,ACT IV,SCENE I,PROSPERO,1683,more!
1540,Tempest,THE TEMPEST,Comedy,1611,William Shakespeare,contents,dialogue,ACT IV,SCENE I,FERDINAND,1684,This is strange: your father’s in some passion
1540,Tempest,THE TEMPEST,Comedy,1611,William Shakespeare,contents,dialogue,ACT IV,SCENE I,FERDINAND,1685,That works him strongly.
1540,Tempest,THE TEMPEST,Comedy,1611,William Shakespeare,contents,dialogue,ACT IV,SCENE I,MIRANDA,1686,Never till this day
1540,Tempest,THE TEMPEST,Comedy,1611,William Shakespeare,contents,dialogue,ACT IV,SCENE I,MIRANDA,1687,Saw I him touch’d with anger so distemper’d.
1540,Tempest,THE TEMPEST,Comedy,1611,William Shakespeare,contents,dialogue,ACT IV,SCENE I,PROSPERO,1688,"You do look, my son, in a mov’d sort,"
1540,Tempest,THE TEMPEST,Comedy,1611,William Shakespeare,contents,dialogue,ACT IV,SCENE I,PROSPERO,1689,"As if you were dismay’d: be cheerful, sir:"
1540,Tempest,THE TEMPEST,Comedy,1611,William Shakespeare,contents,dialogue,ACT IV,SCENE I,PROSPERO,1690,"Our revels now are ended. These our actors,"
1540,Tempest,THE TEMPEST,Comedy,1611,William Shakespeare,contents,dialogue,ACT IV,SCENE I,PROSPERO,1691,"As I foretold you, were all spirits and"
1540,Tempest,THE TEMPEST,Comedy,1611,William Shakespeare,contents,dialogue,ACT IV,SCENE I,PROSPERO,1692,"Are melted into air, into thin air:"
1540,Tempest,THE TEMPEST,Comedy,1611,William Shakespeare,contents,dialogue,ACT IV,SCENE I,PROSPERO,1693,"And, like the baseless fabric of this vision,"
1540,Tempest,THE TEMPEST,Comedy,1611,William Shakespeare,contents,dialogue,ACT IV,SCENE I,PROSPERO,1694,"The cloud-capp’d towers, the gorgeous palaces,"
1540,Tempest,THE TEMPEST,Comedy,1611,William Shakespeare,contents,dialogue,ACT IV,SCENE I,PROSPERO,1695,"The solemn temples, the great globe itself,"
1540,Tempest,THE TEMPEST,Comedy,1611,William Shakespeare,contents,dialogue,ACT IV,SCENE I,PROSPERO,1696,"Yea, all which it inherit, shall dissolve,"
1540,Tempest,THE TEMPEST,Comedy,1611,William Shakespeare,contents,dialogue,ACT IV,SCENE I,PROSPERO,1697,"And, like this insubstantial pageant faded,"
1540,Tempest,THE TEMPEST,Comedy,1611,William Shakespeare,contents,dialogue,ACT IV,SCENE I,PROSPERO,1698,Leave not a rack behind. We are such stuff
1540,Tempest,THE TEMPEST,Comedy,1611,William Shakespeare,contents,dialogue,ACT IV,SCENE I,PROSPERO,1699,"As dreams are made on, and our little life"
1540,Tempest,THE TEMPEST,Comedy,1611,William Shakespeare,contents,dialogue,ACT IV,SCENE I,PROSPERO,1700,"Is rounded with a sleep. Sir, I am vex’d:"
1540,Tempest,THE TEMPEST,Comedy,1611,William Shakespeare,contents,dialogue,ACT IV,SCENE I,PROSPERO,1701,Bear with my weakness; my old brain is troubled.
1540,Tempest,THE TEMPEST,Comedy,1611,William Shakespeare,contents,dialogue,ACT IV,SCENE I,PROSPERO,1702,Be not disturb’d with my infirmity.
1540,Tempest,THE TEMPEST,Comedy,1611,William Shakespeare,contents,dialogue,ACT IV,SCENE I,PROSPERO,1703,"If you be pleas’d, retire into my cell"
1540,Tempest,THE TEMPEST,Comedy,1611,William Shakespeare,contents,dialogue,ACT IV,SCENE I,PROSPERO,1704,"And there repose: a turn or two I’ll walk,"
1540,Tempest,THE TEMPEST,Comedy,1611,William Shakespeare,contents,dialogue,ACT IV,SCENE I,PROSPERO,1705,To still my beating mind.
1540,Tempest,THE TEMPEST,Comedy,1611,William Shakespeare,contents,dialogue,ACT IV,SCENE I,PROSPERO,1706,"FERDINAND, MIRANDA."
1540,Tempest,THE TEMPEST,Comedy,1611,William Shakespeare,contents,dialogue,ACT IV,SCENE I,PROSPERO,1707,We wish your peace.
1540,Tempest,THE TEMPEST,Comedy,1611,William Shakespeare,contents,directions,ACT IV,SCENE I,NA,NA,[Exeunt.]
1540,Tempest,THE TEMPEST,Comedy,1611,William Shakespeare,contents,dialogue,ACT IV,SCENE I,PROSPERO,1708,"Come, with a thought. I thank thee, Ariel. Come!"
1540,Tempest,THE TEMPEST,Comedy,1611,William Shakespeare,contents,directions,ACT IV,SCENE I,NA,NA,Enter Ariel.
1540,Tempest,THE TEMPEST,Comedy,1611,William Shakespeare,contents,dialogue,ACT IV,SCENE I,ARIEL,1709,Thy thoughts I cleave to. What’s thy pleasure?
1540,Tempest,THE TEMPEST,Comedy,1611,William Shakespeare,contents,dialogue,ACT IV,SCENE I,PROSPERO,1710,"Spirit,"
1540,Tempest,THE TEMPEST,Comedy,1611,William Shakespeare,contents,dialogue,ACT IV,SCENE I,PROSPERO,1711,We must prepare to meet with Caliban.
1540,Tempest,THE TEMPEST,Comedy,1611,William Shakespeare,contents,dialogue,ACT IV,SCENE I,ARIEL,1712,"Ay, my commander. When I presented Ceres,"
1540,Tempest,THE TEMPEST,Comedy,1611,William Shakespeare,contents,dialogue,ACT IV,SCENE I,ARIEL,1713,I thought to have told thee of it; but I fear’d
1540,Tempest,THE TEMPEST,Comedy,1611,William Shakespeare,contents,dialogue,ACT IV,SCENE I,ARIEL,1714,Lest I might anger thee.
1540,Tempest,THE TEMPEST,Comedy,1611,William Shakespeare,contents,dialogue,ACT IV,SCENE I,PROSPERO,1715,"Say again, where didst thou leave these varlets?"
1540,Tempest,THE TEMPEST,Comedy,1611,William Shakespeare,contents,dialogue,ACT IV,SCENE I,ARIEL,1716,"I told you, sir, they were red-hot with drinking;"
1540,Tempest,THE TEMPEST,Comedy,1611,William Shakespeare,contents,dialogue,ACT IV,SCENE I,ARIEL,1717,So full of valour that they smote the air
1540,Tempest,THE TEMPEST,Comedy,1611,William Shakespeare,contents,dialogue,ACT IV,SCENE I,ARIEL,1718,For breathing in their faces; beat the ground
1540,Tempest,THE TEMPEST,Comedy,1611,William Shakespeare,contents,dialogue,ACT IV,SCENE I,ARIEL,1719,For kissing of their feet; yet always bending
1540,Tempest,THE TEMPEST,Comedy,1611,William Shakespeare,contents,dialogue,ACT IV,SCENE I,ARIEL,1720,Towards their project. Then I beat my tabor;
1540,Tempest,THE TEMPEST,Comedy,1611,William Shakespeare,contents,dialogue,ACT IV,SCENE I,ARIEL,1721,"At which, like unback’d colts, they prick’d their ears,"
1540,Tempest,THE TEMPEST,Comedy,1611,William Shakespeare,contents,dialogue,ACT IV,SCENE I,ARIEL,1722,"Advanc’d their eyelids, lifted up their noses"
1540,Tempest,THE TEMPEST,Comedy,1611,William Shakespeare,contents,dialogue,ACT IV,SCENE I,ARIEL,1723,"As they smelt music: so I charm’d their ears,"
1540,Tempest,THE TEMPEST,Comedy,1611,William Shakespeare,contents,dialogue,ACT IV,SCENE I,ARIEL,1724,That calf-like they my lowing follow’d through
1540,Tempest,THE TEMPEST,Comedy,1611,William Shakespeare,contents,dialogue,ACT IV,SCENE I,ARIEL,1725,"Tooth’d briers, sharp furzes, pricking goss, and thorns,"
1540,Tempest,THE TEMPEST,Comedy,1611,William Shakespeare,contents,dialogue,ACT IV,SCENE I,ARIEL,1726,Which enter’d their frail shins: at last I left them
1540,Tempest,THE TEMPEST,Comedy,1611,William Shakespeare,contents,dialogue,ACT IV,SCENE I,ARIEL,1727,"I’ th’ filthy-mantled pool beyond your cell,"
1540,Tempest,THE TEMPEST,Comedy,1611,William Shakespeare,contents,dialogue,ACT IV,SCENE I,ARIEL,1728,"There dancing up to th’ chins, that the foul lake"
1540,Tempest,THE TEMPEST,Comedy,1611,William Shakespeare,contents,dialogue,ACT IV,SCENE I,ARIEL,1729,O’erstunk their feet.
1540,Tempest,THE TEMPEST,Comedy,1611,William Shakespeare,contents,dialogue,ACT IV,SCENE I,PROSPERO,1730,"This was well done, my bird."
1540,Tempest,THE TEMPEST,Comedy,1611,William Shakespeare,contents,dialogue,ACT IV,SCENE I,PROSPERO,1731,Thy shape invisible retain thou still:
1540,Tempest,THE TEMPEST,Comedy,1611,William Shakespeare,contents,dialogue,ACT IV,SCENE I,PROSPERO,1732,"The trumpery in my house, go bring it hither"
1540,Tempest,THE TEMPEST,Comedy,1611,William Shakespeare,contents,dialogue,ACT IV,SCENE I,PROSPERO,1733,For stale to catch these thieves.
1540,Tempest,THE TEMPEST,Comedy,1611,William Shakespeare,contents,dialogue,ACT IV,SCENE I,ARIEL,1734,"I go, I go."
1540,Tempest,THE TEMPEST,Comedy,1611,William Shakespeare,contents,directions,ACT IV,SCENE I,NA,NA,[Exit.]
1540,Tempest,THE TEMPEST,Comedy,1611,William Shakespeare,contents,dialogue,ACT IV,SCENE I,PROSPERO,1735,"A devil, a born devil, on whose nature"
1540,Tempest,THE TEMPEST,Comedy,1611,William Shakespeare,contents,dialogue,ACT IV,SCENE I,PROSPERO,1736,"Nurture can never stick; on whom my pains,"
1540,Tempest,THE TEMPEST,Comedy,1611,William Shakespeare,contents,dialogue,ACT IV,SCENE I,PROSPERO,1737,"Humanely taken, all, all lost, quite lost;"
1540,Tempest,THE TEMPEST,Comedy,1611,William Shakespeare,contents,dialogue,ACT IV,SCENE I,PROSPERO,1738,"And as with age his body uglier grows,"
1540,Tempest,THE TEMPEST,Comedy,1611,William Shakespeare,contents,dialogue,ACT IV,SCENE I,PROSPERO,1739,"So his mind cankers. I will plague them all,"
1540,Tempest,THE TEMPEST,Comedy,1611,William Shakespeare,contents,dialogue,ACT IV,SCENE I,PROSPERO,1740,Even to roaring.
1540,Tempest,THE TEMPEST,Comedy,1611,William Shakespeare,contents,directions,ACT IV,SCENE I,NA,NA,"Re-enter Ariel, loaden with glistering apparel, &c."
1540,Tempest,THE TEMPEST,Comedy,1611,William Shakespeare,contents,dialogue,ACT IV,SCENE I,PROSPERO,1741,"Come, hang them on this line."
1540,Tempest,THE TEMPEST,Comedy,1611,William Shakespeare,contents,dialogue,ACT IV,SCENE I,PROSPERO,1742,"Prospero and Ariel remain invisible. Enter Caliban, Stephano and"
1540,Tempest,THE TEMPEST,Comedy,1611,William Shakespeare,contents,dialogue,ACT IV,SCENE I,PROSPERO,1743,Trinculo all wet.
1540,Tempest,THE TEMPEST,Comedy,1611,William Shakespeare,contents,dialogue,ACT IV,SCENE I,CALIBAN,1744,"Pray you, tread softly, that the blind mole may not"
1540,Tempest,THE TEMPEST,Comedy,1611,William Shakespeare,contents,dialogue,ACT IV,SCENE I,CALIBAN,1745,Hear a foot fall: we now are near his cell.
1540,Tempest,THE TEMPEST,Comedy,1611,William Shakespeare,contents,dialogue,ACT IV,SCENE I,STEPHANO,1746,"Monster, your fairy, which you say is a harmless fairy, has done little"
1540,Tempest,THE TEMPEST,Comedy,1611,William Shakespeare,contents,dialogue,ACT IV,SCENE I,STEPHANO,1747,better than played the Jack with us.
1540,Tempest,THE TEMPEST,Comedy,1611,William Shakespeare,contents,dialogue,ACT IV,SCENE I,TRINCULO,1748,"Monster, I do smell all horse-piss; at which my nose is in great"
1540,Tempest,THE TEMPEST,Comedy,1611,William Shakespeare,contents,dialogue,ACT IV,SCENE I,TRINCULO,1749,indignation.
1540,Tempest,THE TEMPEST,Comedy,1611,William Shakespeare,contents,dialogue,ACT IV,SCENE I,STEPHANO,1750,"So is mine. Do you hear, monster? If I should take a displeasure"
1540,Tempest,THE TEMPEST,Comedy,1611,William Shakespeare,contents,dialogue,ACT IV,SCENE I,STEPHANO,1751,"against you, look you,—"
1540,Tempest,THE TEMPEST,Comedy,1611,William Shakespeare,contents,dialogue,ACT IV,SCENE I,TRINCULO,1752,Thou wert but a lost monster.
1540,Tempest,THE TEMPEST,Comedy,1611,William Shakespeare,contents,dialogue,ACT IV,SCENE I,CALIBAN,1753,"Good my lord, give me thy favour still."
1540,Tempest,THE TEMPEST,Comedy,1611,William Shakespeare,contents,dialogue,ACT IV,SCENE I,CALIBAN,1754,"Be patient, for the prize I’ll bring thee to"
1540,Tempest,THE TEMPEST,Comedy,1611,William Shakespeare,contents,dialogue,ACT IV,SCENE I,CALIBAN,1755,Shall hoodwink this mischance: therefore speak softly.
1540,Tempest,THE TEMPEST,Comedy,1611,William Shakespeare,contents,dialogue,ACT IV,SCENE I,CALIBAN,1756,All’s hush’d as midnight yet.
1540,Tempest,THE TEMPEST,Comedy,1611,William Shakespeare,contents,dialogue,ACT IV,SCENE I,TRINCULO,1757,"Ay, but to lose our bottles in the pool!"
1540,Tempest,THE TEMPEST,Comedy,1611,William Shakespeare,contents,dialogue,ACT IV,SCENE I,STEPHANO,1758,"There is not only disgrace and dishonour in that, monster, but an"
1540,Tempest,THE TEMPEST,Comedy,1611,William Shakespeare,contents,dialogue,ACT IV,SCENE I,STEPHANO,1759,infinite loss.
1540,Tempest,THE TEMPEST,Comedy,1611,William Shakespeare,contents,dialogue,ACT IV,SCENE I,TRINCULO,1760,"That’s more to me than my wetting: yet this is your harmless fairy,"
1540,Tempest,THE TEMPEST,Comedy,1611,William Shakespeare,contents,dialogue,ACT IV,SCENE I,TRINCULO,1761,monster.
1540,Tempest,THE TEMPEST,Comedy,1611,William Shakespeare,contents,dialogue,ACT IV,SCENE I,STEPHANO,1762,"I will fetch off my bottle, though I be o’er ears for my labour."
1540,Tempest,THE TEMPEST,Comedy,1611,William Shakespeare,contents,dialogue,ACT IV,SCENE I,CALIBAN,1763,"Prithee, my King, be quiet. Seest thou here,"
1540,Tempest,THE TEMPEST,Comedy,1611,William Shakespeare,contents,dialogue,ACT IV,SCENE I,CALIBAN,1764,"This is the mouth o’ th’ cell: no noise, and enter."
1540,Tempest,THE TEMPEST,Comedy,1611,William Shakespeare,contents,dialogue,ACT IV,SCENE I,CALIBAN,1765,Do that good mischief which may make this island
1540,Tempest,THE TEMPEST,Comedy,1611,William Shakespeare,contents,dialogue,ACT IV,SCENE I,CALIBAN,1766,"Thine own for ever, and I, thy Caliban,"
1540,Tempest,THE TEMPEST,Comedy,1611,William Shakespeare,contents,dialogue,ACT IV,SCENE I,CALIBAN,1767,For aye thy foot-licker.
1540,Tempest,THE TEMPEST,Comedy,1611,William Shakespeare,contents,dialogue,ACT IV,SCENE I,STEPHANO,1768,Give me thy hand. I do begin to have bloody thoughts.
1540,Tempest,THE TEMPEST,Comedy,1611,William Shakespeare,contents,dialogue,ACT IV,SCENE I,TRINCULO,1769,O King Stephano! O peer! O worthy Stephano!
1540,Tempest,THE TEMPEST,Comedy,1611,William Shakespeare,contents,dialogue,ACT IV,SCENE I,TRINCULO,1770,Look what a wardrobe here is for thee!
1540,Tempest,THE TEMPEST,Comedy,1611,William Shakespeare,contents,dialogue,ACT IV,SCENE I,CALIBAN,1771,"Let it alone, thou fool; it is but trash."
1540,Tempest,THE TEMPEST,Comedy,1611,William Shakespeare,contents,dialogue,ACT IV,SCENE I,TRINCULO,1772,"O, ho, monster! we know what belongs to a frippery. O King Stephano!"
1540,Tempest,THE TEMPEST,Comedy,1611,William Shakespeare,contents,dialogue,ACT IV,SCENE I,STEPHANO,1773,"Put off that gown, Trinculo; by this hand, I’ll have that gown."
1540,Tempest,THE TEMPEST,Comedy,1611,William Shakespeare,contents,dialogue,ACT IV,SCENE I,TRINCULO,1774,Thy Grace shall have it.
1540,Tempest,THE TEMPEST,Comedy,1611,William Shakespeare,contents,dialogue,ACT IV,SCENE I,CALIBAN,1775,The dropsy drown this fool! What do you mean
1540,Tempest,THE TEMPEST,Comedy,1611,William Shakespeare,contents,dialogue,ACT IV,SCENE I,CALIBAN,1776,"To dote thus on such luggage? Let’t alone,"
1540,Tempest,THE TEMPEST,Comedy,1611,William Shakespeare,contents,dialogue,ACT IV,SCENE I,CALIBAN,1777,"And do the murder first. If he awake,"
1540,Tempest,THE TEMPEST,Comedy,1611,William Shakespeare,contents,dialogue,ACT IV,SCENE I,CALIBAN,1778,"From toe to crown he’ll fill our skins with pinches,"
1540,Tempest,THE TEMPEST,Comedy,1611,William Shakespeare,contents,dialogue,ACT IV,SCENE I,CALIBAN,1779,Make us strange stuff.
1540,Tempest,THE TEMPEST,Comedy,1611,William Shakespeare,contents,dialogue,ACT IV,SCENE I,STEPHANO,1780,"Be you quiet, monster. Mistress line, is not this my jerkin? Now is the"
1540,Tempest,THE TEMPEST,Comedy,1611,William Shakespeare,contents,dialogue,ACT IV,SCENE I,STEPHANO,1781,"jerkin under the line: now, jerkin, you are like to lose your hair, and"
1540,Tempest,THE TEMPEST,Comedy,1611,William Shakespeare,contents,dialogue,ACT IV,SCENE I,STEPHANO,1782,prove a bald jerkin.
1540,Tempest,THE TEMPEST,Comedy,1611,William Shakespeare,contents,dialogue,ACT IV,SCENE I,TRINCULO,1783,"Do, do: we steal by line and level, an’t like your Grace."
1540,Tempest,THE TEMPEST,Comedy,1611,William Shakespeare,contents,dialogue,ACT IV,SCENE I,STEPHANO,1784,I thank thee for that jest. Here’s a garment for ’t: wit shall not go
1540,Tempest,THE TEMPEST,Comedy,1611,William Shakespeare,contents,dialogue,ACT IV,SCENE I,STEPHANO,1785,"unrewarded while I am King of this country. “Steal by line and level,”"
1540,Tempest,THE TEMPEST,Comedy,1611,William Shakespeare,contents,dialogue,ACT IV,SCENE I,STEPHANO,1786,is an excellent pass of pate. There’s another garment for ’t.
1540,Tempest,THE TEMPEST,Comedy,1611,William Shakespeare,contents,dialogue,ACT IV,SCENE I,TRINCULO,1787,"Monster, come, put some lime upon your fingers, and away with the rest."
1540,Tempest,THE TEMPEST,Comedy,1611,William Shakespeare,contents,dialogue,ACT IV,SCENE I,CALIBAN,1788,"I will have none on’t. We shall lose our time,"
1540,Tempest,THE TEMPEST,Comedy,1611,William Shakespeare,contents,dialogue,ACT IV,SCENE I,CALIBAN,1789,"And all be turn’d to barnacles, or to apes"
1540,Tempest,THE TEMPEST,Comedy,1611,William Shakespeare,contents,dialogue,ACT IV,SCENE I,CALIBAN,1790,With foreheads villainous low.
1540,Tempest,THE TEMPEST,Comedy,1611,William Shakespeare,contents,dialogue,ACT IV,SCENE I,STEPHANO,1791,"Monster, lay-to your fingers: help to bear this away where my hogshead"
1540,Tempest,THE TEMPEST,Comedy,1611,William Shakespeare,contents,dialogue,ACT IV,SCENE I,STEPHANO,1792,"of wine is, or I’ll turn you out of my kingdom. Go to, carry this."
1540,Tempest,THE TEMPEST,Comedy,1611,William Shakespeare,contents,dialogue,ACT IV,SCENE I,TRINCULO,1793,And this.
1540,Tempest,THE TEMPEST,Comedy,1611,William Shakespeare,contents,dialogue,ACT IV,SCENE I,STEPHANO,1794,"Ay, and this."
1540,Tempest,THE TEMPEST,Comedy,1611,William Shakespeare,contents,dialogue,ACT IV,SCENE I,STEPHANO,1795,"A noise of hunters heard. Enter divers Spirits, in shape of dogs and"
1540,Tempest,THE TEMPEST,Comedy,1611,William Shakespeare,contents,dialogue,ACT IV,SCENE I,STEPHANO,1796,"hounds, and hunt them about; Prospero and Ariel setting them on."
1540,Tempest,THE TEMPEST,Comedy,1611,William Shakespeare,contents,dialogue,ACT IV,SCENE I,PROSPERO,1797,"Hey, Mountain, hey!"
1540,Tempest,THE TEMPEST,Comedy,1611,William Shakespeare,contents,dialogue,ACT IV,SCENE I,ARIEL,1798,"Silver! there it goes, Silver!"
1540,Tempest,THE TEMPEST,Comedy,1611,William Shakespeare,contents,dialogue,ACT IV,SCENE I,PROSPERO,1799,"Fury, Fury! There, Tyrant, there! hark, hark!"
1540,Tempest,THE TEMPEST,Comedy,1611,William Shakespeare,contents,directions,ACT IV,SCENE I,NA,NA,"[Caliban, Stephano and Trinculo are driven out.]"
1540,Tempest,THE TEMPEST,Comedy,1611,William Shakespeare,contents,dialogue,ACT IV,SCENE I,PROSPERO,1800,"Go, charge my goblins that they grind their joints"
1540,Tempest,THE TEMPEST,Comedy,1611,William Shakespeare,contents,dialogue,ACT IV,SCENE I,PROSPERO,1801,With dry convulsions; shorten up their sinews
1540,Tempest,THE TEMPEST,Comedy,1611,William Shakespeare,contents,dialogue,ACT IV,SCENE I,PROSPERO,1802,"With aged cramps, and more pinch-spotted make them"
1540,Tempest,THE TEMPEST,Comedy,1611,William Shakespeare,contents,dialogue,ACT IV,SCENE I,PROSPERO,1803,"Than pard, or cat o’ mountain."
1540,Tempest,THE TEMPEST,Comedy,1611,William Shakespeare,contents,dialogue,ACT IV,SCENE I,ARIEL,1804,"Hark, they roar."
1540,Tempest,THE TEMPEST,Comedy,1611,William Shakespeare,contents,dialogue,ACT IV,SCENE I,PROSPERO,1805,Let them be hunted soundly. At this hour
1540,Tempest,THE TEMPEST,Comedy,1611,William Shakespeare,contents,dialogue,ACT IV,SCENE I,PROSPERO,1806,Lies at my mercy all mine enemies.
1540,Tempest,THE TEMPEST,Comedy,1611,William Shakespeare,contents,dialogue,ACT IV,SCENE I,PROSPERO,1807,"Shortly shall all my labours end, and thou"
1540,Tempest,THE TEMPEST,Comedy,1611,William Shakespeare,contents,dialogue,ACT IV,SCENE I,PROSPERO,1808,Shalt have the air at freedom. For a little
1540,Tempest,THE TEMPEST,Comedy,1611,William Shakespeare,contents,dialogue,ACT IV,SCENE I,PROSPERO,1809,"Follow, and do me service."
1540,Tempest,THE TEMPEST,Comedy,1611,William Shakespeare,contents,directions,ACT IV,SCENE I,NA,NA,[Exeunt.]
1540,Tempest,THE TEMPEST,Comedy,1611,William Shakespeare,contents,reference,ACT V,SCENE I,NA,NA,ACT V
1540,Tempest,THE TEMPEST,Comedy,1611,William Shakespeare,contents,reference,ACT V,SCENE I,NA,NA,SCENE I. Before the cell of Prospero.
1540,Tempest,THE TEMPEST,Comedy,1611,William Shakespeare,contents,directions,ACT V,SCENE I,NA,NA,"Enter Prospero in his magic robes, and Ariel."
1540,Tempest,THE TEMPEST,Comedy,1611,William Shakespeare,contents,dialogue,ACT V,SCENE I,PROSPERO,1810,Now does my project gather to a head:
1540,Tempest,THE TEMPEST,Comedy,1611,William Shakespeare,contents,dialogue,ACT V,SCENE I,PROSPERO,1811,"My charms crack not; my spirits obey, and time"
1540,Tempest,THE TEMPEST,Comedy,1611,William Shakespeare,contents,dialogue,ACT V,SCENE I,PROSPERO,1812,Goes upright with his carriage. How’s the day?
1540,Tempest,THE TEMPEST,Comedy,1611,William Shakespeare,contents,dialogue,ACT V,SCENE I,ARIEL,1813,"On the sixth hour; at which time, my lord,"
1540,Tempest,THE TEMPEST,Comedy,1611,William Shakespeare,contents,dialogue,ACT V,SCENE I,ARIEL,1814,You said our work should cease.
1540,Tempest,THE TEMPEST,Comedy,1611,William Shakespeare,contents,dialogue,ACT V,SCENE I,PROSPERO,1815,"I did say so,"
1540,Tempest,THE TEMPEST,Comedy,1611,William Shakespeare,contents,dialogue,ACT V,SCENE I,PROSPERO,1816,"When first I rais’d the tempest. Say, my spirit,"
1540,Tempest,THE TEMPEST,Comedy,1611,William Shakespeare,contents,dialogue,ACT V,SCENE I,PROSPERO,1817,How fares the King and ’s followers?
1540,Tempest,THE TEMPEST,Comedy,1611,William Shakespeare,contents,dialogue,ACT V,SCENE I,ARIEL,1818,Confin’d together
1540,Tempest,THE TEMPEST,Comedy,1611,William Shakespeare,contents,dialogue,ACT V,SCENE I,ARIEL,1819,"In the same fashion as you gave in charge,"
1540,Tempest,THE TEMPEST,Comedy,1611,William Shakespeare,contents,dialogue,ACT V,SCENE I,ARIEL,1820,"Just as you left them; all prisoners, sir,"
1540,Tempest,THE TEMPEST,Comedy,1611,William Shakespeare,contents,dialogue,ACT V,SCENE I,ARIEL,1821,In the line grove which weather-fends your cell;
