short_title,gutenberg_title,genre,year,author,section,class,act,scene,character,line_number,text
Winter's Tale,THE WINTER’S TALE,Comedy,1611,William Shakespeare,front_matter,title,NA,NA,NA,NA,THE WINTER’S TALE
Winter's Tale,THE WINTER’S TALE,Comedy,1611,William Shakespeare,front_matter,author,NA,NA,NA,NA,by William Shakespeare
Winter's Tale,THE WINTER’S TALE,Comedy,1611,William Shakespeare,front_matter,contents_header,NA,NA,NA,NA,Contents
Winter's Tale,THE WINTER’S TALE,Comedy,1611,William Shakespeare,front_matter,contents,ACT I,NA,NA,NA,ACT I
Winter's Tale,THE WINTER’S TALE,Comedy,1611,William Shakespeare,front_matter,contents,ACT I,Scene I,NA,NA,Scene I. Sicilia. An Antechamber in Leontes’ Palace.
Winter's Tale,THE WINTER’S TALE,Comedy,1611,William Shakespeare,front_matter,contents,ACT I,Scene II,NA,NA,Scene II. The same. A Room of State in the Palace.
Winter's Tale,THE WINTER’S TALE,Comedy,1611,William Shakespeare,front_matter,contents,ACT II,NA,NA,NA,ACT II
Winter's Tale,THE WINTER’S TALE,Comedy,1611,William Shakespeare,front_matter,contents,ACT II,Scene I,NA,NA,Scene I. Sicilia. A Room in the Palace.
Winter's Tale,THE WINTER’S TALE,Comedy,1611,William Shakespeare,front_matter,contents,ACT II,Scene II,NA,NA,Scene II. The same. The outer Room of a Prison.
Winter's Tale,THE WINTER’S TALE,Comedy,1611,William Shakespeare,front_matter,contents,ACT II,Scene III,NA,NA,Scene III. The same. A Room in the Palace.
Winter's Tale,THE WINTER’S TALE,Comedy,1611,William Shakespeare,front_matter,contents,ACT III,NA,NA,NA,ACT III
Winter's Tale,THE WINTER’S TALE,Comedy,1611,William Shakespeare,front_matter,contents,ACT III,Scene I,NA,NA,Scene I. Sicilia. A Street in some Town.
Winter's Tale,THE WINTER’S TALE,Comedy,1611,William Shakespeare,front_matter,contents,ACT III,Scene II,NA,NA,Scene II. The same. A Court of Justice.
Winter's Tale,THE WINTER’S TALE,Comedy,1611,William Shakespeare,front_matter,contents,ACT III,Scene III,NA,NA,Scene III. Bohemia. A desert Country near the Sea.
Winter's Tale,THE WINTER’S TALE,Comedy,1611,William Shakespeare,front_matter,contents,ACT IV,NA,NA,NA,ACT IV
Winter's Tale,THE WINTER’S TALE,Comedy,1611,William Shakespeare,front_matter,contents,ACT IV,Scene I,NA,NA,Scene I. Prologue.
Winter's Tale,THE WINTER’S TALE,Comedy,1611,William Shakespeare,front_matter,contents,ACT IV,Scene II,NA,NA,Scene II. Bohemia. A Room in the palace of Polixenes.
Winter's Tale,THE WINTER’S TALE,Comedy,1611,William Shakespeare,front_matter,contents,ACT IV,Scene III,NA,NA,Scene III. The same. A Road near the Shepherd’s cottage.
Winter's Tale,THE WINTER’S TALE,Comedy,1611,William Shakespeare,front_matter,contents,ACT IV,Scene IV,NA,NA,Scene IV. The same. A Shepherd’s Cottage.
Winter's Tale,THE WINTER’S TALE,Comedy,1611,William Shakespeare,front_matter,contents,ACT V,NA,NA,NA,ACT V
Winter's Tale,THE WINTER’S TALE,Comedy,1611,William Shakespeare,front_matter,contents,ACT V,Scene I,NA,NA,Scene I. Sicilia. A Room in the palace of Leontes.
Winter's Tale,THE WINTER’S TALE,Comedy,1611,William Shakespeare,front_matter,contents,ACT V,Scene II,NA,NA,Scene II. The same. Before the Palace.
Winter's Tale,THE WINTER’S TALE,Comedy,1611,William Shakespeare,front_matter,contents,ACT V,Scene III,NA,NA,Scene III. The same. A Room in Paulina’s house.
Winter's Tale,THE WINTER’S TALE,Comedy,1611,William Shakespeare,front_matter,dramatis_header,NA,NA,NA,NA,Dramatis Personæ
Winter's Tale,THE WINTER’S TALE,Comedy,1611,William Shakespeare,front_matter,title,NA,NA,NA,NA,"LEONTES, King of Sicilia"
Winter's Tale,THE WINTER’S TALE,Comedy,1611,William Shakespeare,front_matter,title,NA,NA,NA,NA,"MAMILLIUS, his son"
Winter's Tale,THE WINTER’S TALE,Comedy,1611,William Shakespeare,front_matter,title,NA,NA,NA,NA,"CAMILLO, Sicilian Lord"
Winter's Tale,THE WINTER’S TALE,Comedy,1611,William Shakespeare,front_matter,title,NA,NA,NA,NA,"ANTIGONUS, Sicilian Lord"
Winter's Tale,THE WINTER’S TALE,Comedy,1611,William Shakespeare,front_matter,title,NA,NA,NA,NA,"CLEOMENES, Sicilian Lord"
Winter's Tale,THE WINTER’S TALE,Comedy,1611,William Shakespeare,front_matter,title,NA,NA,NA,NA,"DION, Sicilian Lord"
Winter's Tale,THE WINTER’S TALE,Comedy,1611,William Shakespeare,front_matter,title,NA,NA,NA,NA,"POLIXENES, King of Bohemia"
Winter's Tale,THE WINTER’S TALE,Comedy,1611,William Shakespeare,front_matter,title,NA,NA,NA,NA,"FLORIZEL, his son"
Winter's Tale,THE WINTER’S TALE,Comedy,1611,William Shakespeare,front_matter,title,NA,NA,NA,NA,"ARCHIDAMUS, a Bohemian Lord"
Winter's Tale,THE WINTER’S TALE,Comedy,1611,William Shakespeare,front_matter,title,NA,NA,NA,NA,"An Old Shepherd, reputed father of Perdita"
Winter's Tale,THE WINTER’S TALE,Comedy,1611,William Shakespeare,front_matter,title,NA,NA,NA,NA,"CLOWN, his son"
Winter's Tale,THE WINTER’S TALE,Comedy,1611,William Shakespeare,front_matter,title,NA,NA,NA,NA,"AUTOLYCUS, a rogue"
Winter's Tale,THE WINTER’S TALE,Comedy,1611,William Shakespeare,front_matter,title,NA,NA,NA,NA,A Mariner
Winter's Tale,THE WINTER’S TALE,Comedy,1611,William Shakespeare,front_matter,title,NA,NA,NA,NA,A Gaoler
Winter's Tale,THE WINTER’S TALE,Comedy,1611,William Shakespeare,front_matter,title,NA,NA,NA,NA,Servant to the Old Shepherd
Winter's Tale,THE WINTER’S TALE,Comedy,1611,William Shakespeare,front_matter,title,NA,NA,NA,NA,Other Sicilian Lords
Winter's Tale,THE WINTER’S TALE,Comedy,1611,William Shakespeare,front_matter,title,NA,NA,NA,NA,Sicilian Gentlemen
Winter's Tale,THE WINTER’S TALE,Comedy,1611,William Shakespeare,front_matter,title,NA,NA,NA,NA,Officers of a Court of Judicature
Winter's Tale,THE WINTER’S TALE,Comedy,1611,William Shakespeare,front_matter,title,NA,NA,NA,NA,"HERMIONE, Queen to Leontes"
Winter's Tale,THE WINTER’S TALE,Comedy,1611,William Shakespeare,front_matter,title,NA,NA,NA,NA,"PERDITA, daughter to Leontes and Hermione"
Winter's Tale,THE WINTER’S TALE,Comedy,1611,William Shakespeare,front_matter,title,NA,NA,NA,NA,"PAULINA, wife to Antigonus"
Winter's Tale,THE WINTER’S TALE,Comedy,1611,William Shakespeare,front_matter,title,NA,NA,NA,NA,"EMILIA, a lady attending on the Queen"
Winter's Tale,THE WINTER’S TALE,Comedy,1611,William Shakespeare,front_matter,title,NA,NA,NA,NA,"MOPSA, shepherdess"
Winter's Tale,THE WINTER’S TALE,Comedy,1611,William Shakespeare,front_matter,title,NA,NA,NA,NA,"DORCAS, shepherdess"
Winter's Tale,THE WINTER’S TALE,Comedy,1611,William Shakespeare,front_matter,title,NA,NA,NA,NA,"Other Ladies, attending on the Queen"
Winter's Tale,THE WINTER’S TALE,Comedy,1611,William Shakespeare,front_matter,title,NA,NA,NA,NA,"Lords, Ladies, and Attendants; Satyrs for a Dance; Shepherds,"
Winter's Tale,THE WINTER’S TALE,Comedy,1611,William Shakespeare,front_matter,title,NA,NA,NA,NA,"Shepherdesses, Guards, &c."
Winter's Tale,THE WINTER’S TALE,Comedy,1611,William Shakespeare,front_matter,title,NA,NA,NA,NA,"TIME, as Chorus"
Winter's Tale,THE WINTER’S TALE,Comedy,1611,William Shakespeare,front_matter,title,NA,NA,NA,NA,Scene: Sometimes in Sicilia; sometimes in Bohemia.
Winter's Tale,THE WINTER’S TALE,Comedy,1611,William Shakespeare,contents,reference,ACT I,NA,NA,NA,ACT I
Winter's Tale,THE WINTER’S TALE,Comedy,1611,William Shakespeare,contents,reference,ACT I,SCENE I,NA,NA,SCENE I. Sicilia. An Antechamber in Leontes’ Palace.
Winter's Tale,THE WINTER’S TALE,Comedy,1611,William Shakespeare,contents,directions,ACT I,SCENE I,NA,NA,Enter Camillo and Archidamus.
Winter's Tale,THE WINTER’S TALE,Comedy,1611,William Shakespeare,contents,dialogue,ACT I,SCENE I,ARCHIDAMUS,1,"If you shall chance, Camillo, to visit Bohemia, on the like occasion"
Winter's Tale,THE WINTER’S TALE,Comedy,1611,William Shakespeare,contents,dialogue,ACT I,SCENE I,ARCHIDAMUS,2,"whereon my services are now on foot, you shall see, as I have said,"
Winter's Tale,THE WINTER’S TALE,Comedy,1611,William Shakespeare,contents,dialogue,ACT I,SCENE I,ARCHIDAMUS,3,great difference betwixt our Bohemia and your Sicilia.
Winter's Tale,THE WINTER’S TALE,Comedy,1611,William Shakespeare,contents,dialogue,ACT I,SCENE I,CAMILLO,4,I think this coming summer the King of Sicilia means to pay Bohemia the
Winter's Tale,THE WINTER’S TALE,Comedy,1611,William Shakespeare,contents,dialogue,ACT I,SCENE I,CAMILLO,5,visitation which he justly owes him.
Winter's Tale,THE WINTER’S TALE,Comedy,1611,William Shakespeare,contents,dialogue,ACT I,SCENE I,ARCHIDAMUS,6,Wherein our entertainment shall shame us; we will be justified in our
Winter's Tale,THE WINTER’S TALE,Comedy,1611,William Shakespeare,contents,dialogue,ACT I,SCENE I,ARCHIDAMUS,7,"loves. For indeed,—"
Winter's Tale,THE WINTER’S TALE,Comedy,1611,William Shakespeare,contents,dialogue,ACT I,SCENE I,CAMILLO,8,Beseech you—
Winter's Tale,THE WINTER’S TALE,Comedy,1611,William Shakespeare,contents,dialogue,ACT I,SCENE I,ARCHIDAMUS,9,"Verily, I speak it in the freedom of my knowledge. We cannot with such"
Winter's Tale,THE WINTER’S TALE,Comedy,1611,William Shakespeare,contents,dialogue,ACT I,SCENE I,ARCHIDAMUS,10,magnificence—in so rare—I know not what to say. We will give you sleepy
Winter's Tale,THE WINTER’S TALE,Comedy,1611,William Shakespeare,contents,dialogue,ACT I,SCENE I,ARCHIDAMUS,11,"drinks, that your senses, unintelligent of our insufficience, may,"
Winter's Tale,THE WINTER’S TALE,Comedy,1611,William Shakespeare,contents,dialogue,ACT I,SCENE I,ARCHIDAMUS,12,"though they cannot praise us, as little accuse us."
Winter's Tale,THE WINTER’S TALE,Comedy,1611,William Shakespeare,contents,dialogue,ACT I,SCENE I,CAMILLO,13,You pay a great deal too dear for what’s given freely.
Winter's Tale,THE WINTER’S TALE,Comedy,1611,William Shakespeare,contents,dialogue,ACT I,SCENE I,ARCHIDAMUS,14,"Believe me, I speak as my understanding instructs me and as mine"
Winter's Tale,THE WINTER’S TALE,Comedy,1611,William Shakespeare,contents,dialogue,ACT I,SCENE I,ARCHIDAMUS,15,honesty puts it to utterance.
Winter's Tale,THE WINTER’S TALE,Comedy,1611,William Shakespeare,contents,dialogue,ACT I,SCENE I,CAMILLO,16,Sicilia cannot show himself over-kind to Bohemia. They were trained
Winter's Tale,THE WINTER’S TALE,Comedy,1611,William Shakespeare,contents,dialogue,ACT I,SCENE I,CAMILLO,17,"together in their childhoods, and there rooted betwixt them then such"
Winter's Tale,THE WINTER’S TALE,Comedy,1611,William Shakespeare,contents,dialogue,ACT I,SCENE I,CAMILLO,18,an affection which cannot choose but branch now. Since their more
Winter's Tale,THE WINTER’S TALE,Comedy,1611,William Shakespeare,contents,dialogue,ACT I,SCENE I,CAMILLO,19,mature dignities and royal necessities made separation of their
Winter's Tale,THE WINTER’S TALE,Comedy,1611,William Shakespeare,contents,dialogue,ACT I,SCENE I,CAMILLO,20,"society, their encounters, though not personal, have been royally"
Winter's Tale,THE WINTER’S TALE,Comedy,1611,William Shakespeare,contents,dialogue,ACT I,SCENE I,CAMILLO,21,"attorneyed with interchange of gifts, letters, loving embassies, that"
Winter's Tale,THE WINTER’S TALE,Comedy,1611,William Shakespeare,contents,dialogue,ACT I,SCENE I,CAMILLO,22,"they have seemed to be together, though absent; shook hands, as over a"
Winter's Tale,THE WINTER’S TALE,Comedy,1611,William Shakespeare,contents,dialogue,ACT I,SCENE I,CAMILLO,23,vast; and embraced as it were from the ends of opposed winds. The
Winter's Tale,THE WINTER’S TALE,Comedy,1611,William Shakespeare,contents,dialogue,ACT I,SCENE I,CAMILLO,24,heavens continue their loves!
Winter's Tale,THE WINTER’S TALE,Comedy,1611,William Shakespeare,contents,dialogue,ACT I,SCENE I,ARCHIDAMUS,25,I think there is not in the world either malice or matter to alter it.
Winter's Tale,THE WINTER’S TALE,Comedy,1611,William Shakespeare,contents,dialogue,ACT I,SCENE I,ARCHIDAMUS,26,You have an unspeakable comfort of your young Prince Mamillius. It is a
Winter's Tale,THE WINTER’S TALE,Comedy,1611,William Shakespeare,contents,dialogue,ACT I,SCENE I,ARCHIDAMUS,27,gentleman of the greatest promise that ever came into my note.
Winter's Tale,THE WINTER’S TALE,Comedy,1611,William Shakespeare,contents,dialogue,ACT I,SCENE I,CAMILLO,28,I very well agree with you in the hopes of him. It is a gallant child;
Winter's Tale,THE WINTER’S TALE,Comedy,1611,William Shakespeare,contents,dialogue,ACT I,SCENE I,CAMILLO,29,"one that indeed physics the subject, makes old hearts fresh. They that"
Winter's Tale,THE WINTER’S TALE,Comedy,1611,William Shakespeare,contents,dialogue,ACT I,SCENE I,CAMILLO,30,went on crutches ere he was born desire yet their life to see him a
Winter's Tale,THE WINTER’S TALE,Comedy,1611,William Shakespeare,contents,dialogue,ACT I,SCENE I,CAMILLO,31,man.
Winter's Tale,THE WINTER’S TALE,Comedy,1611,William Shakespeare,contents,dialogue,ACT I,SCENE I,ARCHIDAMUS,32,Would they else be content to die?
Winter's Tale,THE WINTER’S TALE,Comedy,1611,William Shakespeare,contents,dialogue,ACT I,SCENE I,CAMILLO,33,"Yes, if there were no other excuse why they should desire to live."
Winter's Tale,THE WINTER’S TALE,Comedy,1611,William Shakespeare,contents,dialogue,ACT I,SCENE I,ARCHIDAMUS,34,"If the king had no son, they would desire to live on crutches till he"
Winter's Tale,THE WINTER’S TALE,Comedy,1611,William Shakespeare,contents,dialogue,ACT I,SCENE I,ARCHIDAMUS,35,had one.
Winter's Tale,THE WINTER’S TALE,Comedy,1611,William Shakespeare,contents,directions,ACT I,SCENE I,NA,NA,[Exeunt.]
Winter's Tale,THE WINTER’S TALE,Comedy,1611,William Shakespeare,contents,reference,ACT I,SCENE II,NA,NA,SCENE II. The same. A Room of State in the Palace.
Winter's Tale,THE WINTER’S TALE,Comedy,1611,William Shakespeare,contents,directions,ACT I,SCENE II,NA,NA,"Enter Leontes, Polixenes, Hermione, Mamillius, Camillo and Attendants."
Winter's Tale,THE WINTER’S TALE,Comedy,1611,William Shakespeare,contents,dialogue,ACT I,SCENE II,POLIXENES,36,Nine changes of the watery star hath been
Winter's Tale,THE WINTER’S TALE,Comedy,1611,William Shakespeare,contents,dialogue,ACT I,SCENE II,POLIXENES,37,The shepherd’s note since we have left our throne
Winter's Tale,THE WINTER’S TALE,Comedy,1611,William Shakespeare,contents,dialogue,ACT I,SCENE II,POLIXENES,38,Without a burden. Time as long again
Winter's Tale,THE WINTER’S TALE,Comedy,1611,William Shakespeare,contents,dialogue,ACT I,SCENE II,POLIXENES,39,"Would be fill’d up, my brother, with our thanks;"
Winter's Tale,THE WINTER’S TALE,Comedy,1611,William Shakespeare,contents,dialogue,ACT I,SCENE II,POLIXENES,40,"And yet we should, for perpetuity,"
Winter's Tale,THE WINTER’S TALE,Comedy,1611,William Shakespeare,contents,dialogue,ACT I,SCENE II,POLIXENES,41,"Go hence in debt: and therefore, like a cipher,"
Winter's Tale,THE WINTER’S TALE,Comedy,1611,William Shakespeare,contents,dialogue,ACT I,SCENE II,POLIXENES,42,"Yet standing in rich place, I multiply"
Winter's Tale,THE WINTER’S TALE,Comedy,1611,William Shakespeare,contents,dialogue,ACT I,SCENE II,POLIXENES,43,With one “we thank you” many thousands more
Winter's Tale,THE WINTER’S TALE,Comedy,1611,William Shakespeare,contents,dialogue,ACT I,SCENE II,POLIXENES,44,That go before it.
Winter's Tale,THE WINTER’S TALE,Comedy,1611,William Shakespeare,contents,dialogue,ACT I,SCENE II,LEONTES,45,"Stay your thanks a while,"
Winter's Tale,THE WINTER’S TALE,Comedy,1611,William Shakespeare,contents,dialogue,ACT I,SCENE II,LEONTES,46,And pay them when you part.
Winter's Tale,THE WINTER’S TALE,Comedy,1611,William Shakespeare,contents,dialogue,ACT I,SCENE II,POLIXENES,47,"Sir, that’s tomorrow."
Winter's Tale,THE WINTER’S TALE,Comedy,1611,William Shakespeare,contents,dialogue,ACT I,SCENE II,POLIXENES,48,"I am question’d by my fears, of what may chance"
Winter's Tale,THE WINTER’S TALE,Comedy,1611,William Shakespeare,contents,dialogue,ACT I,SCENE II,POLIXENES,49,Or breed upon our absence; that may blow
Winter's Tale,THE WINTER’S TALE,Comedy,1611,William Shakespeare,contents,dialogue,ACT I,SCENE II,POLIXENES,50,"No sneaping winds at home, to make us say"
Winter's Tale,THE WINTER’S TALE,Comedy,1611,William Shakespeare,contents,dialogue,ACT I,SCENE II,POLIXENES,51,"“This is put forth too truly.” Besides, I have stay’d"
Winter's Tale,THE WINTER’S TALE,Comedy,1611,William Shakespeare,contents,dialogue,ACT I,SCENE II,POLIXENES,52,To tire your royalty.
Winter's Tale,THE WINTER’S TALE,Comedy,1611,William Shakespeare,contents,dialogue,ACT I,SCENE II,LEONTES,53,"We are tougher, brother,"
Winter's Tale,THE WINTER’S TALE,Comedy,1611,William Shakespeare,contents,dialogue,ACT I,SCENE II,LEONTES,54,Than you can put us to ’t.
Winter's Tale,THE WINTER’S TALE,Comedy,1611,William Shakespeare,contents,dialogue,ACT I,SCENE II,POLIXENES,55,No longer stay.
Winter's Tale,THE WINTER’S TALE,Comedy,1611,William Shakespeare,contents,dialogue,ACT I,SCENE II,LEONTES,56,One seve’night longer.
Winter's Tale,THE WINTER’S TALE,Comedy,1611,William Shakespeare,contents,dialogue,ACT I,SCENE II,POLIXENES,57,"Very sooth, tomorrow."
Winter's Tale,THE WINTER’S TALE,Comedy,1611,William Shakespeare,contents,dialogue,ACT I,SCENE II,LEONTES,58,We’ll part the time between ’s then: and in that
Winter's Tale,THE WINTER’S TALE,Comedy,1611,William Shakespeare,contents,dialogue,ACT I,SCENE II,LEONTES,59,I’ll no gainsaying.
Winter's Tale,THE WINTER’S TALE,Comedy,1611,William Shakespeare,contents,dialogue,ACT I,SCENE II,POLIXENES,60,"Press me not, beseech you, so,"
Winter's Tale,THE WINTER’S TALE,Comedy,1611,William Shakespeare,contents,dialogue,ACT I,SCENE II,POLIXENES,61,"There is no tongue that moves, none, none i’ th’ world,"
Winter's Tale,THE WINTER’S TALE,Comedy,1611,William Shakespeare,contents,dialogue,ACT I,SCENE II,POLIXENES,62,"So soon as yours, could win me: so it should now,"
Winter's Tale,THE WINTER’S TALE,Comedy,1611,William Shakespeare,contents,dialogue,ACT I,SCENE II,POLIXENES,63,"Were there necessity in your request, although"
Winter's Tale,THE WINTER’S TALE,Comedy,1611,William Shakespeare,contents,dialogue,ACT I,SCENE II,POLIXENES,64,’Twere needful I denied it. My affairs
Winter's Tale,THE WINTER’S TALE,Comedy,1611,William Shakespeare,contents,dialogue,ACT I,SCENE II,POLIXENES,65,Do even drag me homeward: which to hinder
Winter's Tale,THE WINTER’S TALE,Comedy,1611,William Shakespeare,contents,dialogue,ACT I,SCENE II,POLIXENES,66,"Were, in your love a whip to me; my stay"
Winter's Tale,THE WINTER’S TALE,Comedy,1611,William Shakespeare,contents,dialogue,ACT I,SCENE II,POLIXENES,67,"To you a charge and trouble: to save both,"
Winter's Tale,THE WINTER’S TALE,Comedy,1611,William Shakespeare,contents,dialogue,ACT I,SCENE II,POLIXENES,68,"Farewell, our brother."
Winter's Tale,THE WINTER’S TALE,Comedy,1611,William Shakespeare,contents,dialogue,ACT I,SCENE II,LEONTES,69,"Tongue-tied, our queen? Speak you."
Winter's Tale,THE WINTER’S TALE,Comedy,1611,William Shakespeare,contents,dialogue,ACT I,SCENE II,HERMIONE,70,"I had thought, sir, to have held my peace until"
Winter's Tale,THE WINTER’S TALE,Comedy,1611,William Shakespeare,contents,dialogue,ACT I,SCENE II,HERMIONE,71,"You had drawn oaths from him not to stay. You, sir,"
Winter's Tale,THE WINTER’S TALE,Comedy,1611,William Shakespeare,contents,dialogue,ACT I,SCENE II,HERMIONE,72,Charge him too coldly. Tell him you are sure
Winter's Tale,THE WINTER’S TALE,Comedy,1611,William Shakespeare,contents,dialogue,ACT I,SCENE II,HERMIONE,73,All in Bohemia’s well: this satisfaction
Winter's Tale,THE WINTER’S TALE,Comedy,1611,William Shakespeare,contents,dialogue,ACT I,SCENE II,HERMIONE,74,"The by-gone day proclaimed. Say this to him,"
Winter's Tale,THE WINTER’S TALE,Comedy,1611,William Shakespeare,contents,dialogue,ACT I,SCENE II,HERMIONE,75,He’s beat from his best ward.
Winter's Tale,THE WINTER’S TALE,Comedy,1611,William Shakespeare,contents,dialogue,ACT I,SCENE II,LEONTES,76,"Well said, Hermione."
Winter's Tale,THE WINTER’S TALE,Comedy,1611,William Shakespeare,contents,dialogue,ACT I,SCENE II,HERMIONE,77,To tell he longs to see his son were strong.
Winter's Tale,THE WINTER’S TALE,Comedy,1611,William Shakespeare,contents,dialogue,ACT I,SCENE II,HERMIONE,78,"But let him say so then, and let him go;"
Winter's Tale,THE WINTER’S TALE,Comedy,1611,William Shakespeare,contents,dialogue,ACT I,SCENE II,HERMIONE,79,"But let him swear so, and he shall not stay,"
Winter's Tale,THE WINTER’S TALE,Comedy,1611,William Shakespeare,contents,dialogue,ACT I,SCENE II,HERMIONE,80,We’ll thwack him hence with distaffs.
Winter's Tale,THE WINTER’S TALE,Comedy,1611,William Shakespeare,contents,dialogue,ACT I,SCENE II,HERMIONE,81,[To Polixenes.] Yet of your royal presence I’ll adventure
Winter's Tale,THE WINTER’S TALE,Comedy,1611,William Shakespeare,contents,dialogue,ACT I,SCENE II,HERMIONE,82,The borrow of a week. When at Bohemia
Winter's Tale,THE WINTER’S TALE,Comedy,1611,William Shakespeare,contents,dialogue,ACT I,SCENE II,HERMIONE,83,"You take my lord, I’ll give him my commission"
Winter's Tale,THE WINTER’S TALE,Comedy,1611,William Shakespeare,contents,dialogue,ACT I,SCENE II,HERMIONE,84,To let him there a month behind the gest
Winter's Tale,THE WINTER’S TALE,Comedy,1611,William Shakespeare,contents,dialogue,ACT I,SCENE II,HERMIONE,85,"Prefix’d for’s parting:—yet, good deed, Leontes,"
Winter's Tale,THE WINTER’S TALE,Comedy,1611,William Shakespeare,contents,dialogue,ACT I,SCENE II,HERMIONE,86,I love thee not a jar of th’ clock behind
Winter's Tale,THE WINTER’S TALE,Comedy,1611,William Shakespeare,contents,dialogue,ACT I,SCENE II,HERMIONE,87,What lady she her lord. You’ll stay?
Winter's Tale,THE WINTER’S TALE,Comedy,1611,William Shakespeare,contents,dialogue,ACT I,SCENE II,POLIXENES,88,"No, madam."
Winter's Tale,THE WINTER’S TALE,Comedy,1611,William Shakespeare,contents,dialogue,ACT I,SCENE II,HERMIONE,89,"Nay, but you will?"
Winter's Tale,THE WINTER’S TALE,Comedy,1611,William Shakespeare,contents,dialogue,ACT I,SCENE II,POLIXENES,90,"I may not, verily."
Winter's Tale,THE WINTER’S TALE,Comedy,1611,William Shakespeare,contents,dialogue,ACT I,SCENE II,HERMIONE,91,Verily!
Winter's Tale,THE WINTER’S TALE,Comedy,1611,William Shakespeare,contents,dialogue,ACT I,SCENE II,HERMIONE,92,"You put me off with limber vows; but I,"
Winter's Tale,THE WINTER’S TALE,Comedy,1611,William Shakespeare,contents,dialogue,ACT I,SCENE II,HERMIONE,93,"Though you would seek t’ unsphere the stars with oaths,"
Winter's Tale,THE WINTER’S TALE,Comedy,1611,William Shakespeare,contents,dialogue,ACT I,SCENE II,HERMIONE,94,"Should yet say “Sir, no going.” Verily,"
Winter's Tale,THE WINTER’S TALE,Comedy,1611,William Shakespeare,contents,dialogue,ACT I,SCENE II,HERMIONE,95,You shall not go. A lady’s verily is
Winter's Tale,THE WINTER’S TALE,Comedy,1611,William Shakespeare,contents,dialogue,ACT I,SCENE II,HERMIONE,96,As potent as a lord’s. Will go yet?
Winter's Tale,THE WINTER’S TALE,Comedy,1611,William Shakespeare,contents,dialogue,ACT I,SCENE II,HERMIONE,97,"Force me to keep you as a prisoner,"
Winter's Tale,THE WINTER’S TALE,Comedy,1611,William Shakespeare,contents,dialogue,ACT I,SCENE II,HERMIONE,98,Not like a guest: so you shall pay your fees
Winter's Tale,THE WINTER’S TALE,Comedy,1611,William Shakespeare,contents,dialogue,ACT I,SCENE II,HERMIONE,99,"When you depart, and save your thanks. How say you?"
Winter's Tale,THE WINTER’S TALE,Comedy,1611,William Shakespeare,contents,dialogue,ACT I,SCENE II,HERMIONE,100,"My prisoner or my guest? By your dread “verily,”"
Winter's Tale,THE WINTER’S TALE,Comedy,1611,William Shakespeare,contents,dialogue,ACT I,SCENE II,HERMIONE,101,One of them you shall be.
Winter's Tale,THE WINTER’S TALE,Comedy,1611,William Shakespeare,contents,dialogue,ACT I,SCENE II,POLIXENES,102,"Your guest, then, madam."
Winter's Tale,THE WINTER’S TALE,Comedy,1611,William Shakespeare,contents,dialogue,ACT I,SCENE II,POLIXENES,103,To be your prisoner should import offending;
Winter's Tale,THE WINTER’S TALE,Comedy,1611,William Shakespeare,contents,dialogue,ACT I,SCENE II,POLIXENES,104,Which is for me less easy to commit
Winter's Tale,THE WINTER’S TALE,Comedy,1611,William Shakespeare,contents,dialogue,ACT I,SCENE II,POLIXENES,105,Than you to punish.
Winter's Tale,THE WINTER’S TALE,Comedy,1611,William Shakespeare,contents,dialogue,ACT I,SCENE II,HERMIONE,106,"Not your gaoler then,"
Winter's Tale,THE WINTER’S TALE,Comedy,1611,William Shakespeare,contents,dialogue,ACT I,SCENE II,HERMIONE,107,"But your kind hostess. Come, I’ll question you"
Winter's Tale,THE WINTER’S TALE,Comedy,1611,William Shakespeare,contents,dialogue,ACT I,SCENE II,HERMIONE,108,Of my lord’s tricks and yours when you were boys.
Winter's Tale,THE WINTER’S TALE,Comedy,1611,William Shakespeare,contents,dialogue,ACT I,SCENE II,HERMIONE,109,You were pretty lordings then.
Winter's Tale,THE WINTER’S TALE,Comedy,1611,William Shakespeare,contents,dialogue,ACT I,SCENE II,POLIXENES,110,"We were, fair queen,"
Winter's Tale,THE WINTER’S TALE,Comedy,1611,William Shakespeare,contents,dialogue,ACT I,SCENE II,POLIXENES,111,Two lads that thought there was no more behind
Winter's Tale,THE WINTER’S TALE,Comedy,1611,William Shakespeare,contents,dialogue,ACT I,SCENE II,POLIXENES,112,"But such a day tomorrow as today,"
Winter's Tale,THE WINTER’S TALE,Comedy,1611,William Shakespeare,contents,dialogue,ACT I,SCENE II,POLIXENES,113,And to be boy eternal.
Winter's Tale,THE WINTER’S TALE,Comedy,1611,William Shakespeare,contents,dialogue,ACT I,SCENE II,HERMIONE,114,Was not my lord
Winter's Tale,THE WINTER’S TALE,Comedy,1611,William Shakespeare,contents,dialogue,ACT I,SCENE II,HERMIONE,115,The verier wag o’ th’ two?
Winter's Tale,THE WINTER’S TALE,Comedy,1611,William Shakespeare,contents,dialogue,ACT I,SCENE II,POLIXENES,116,We were as twinn’d lambs that did frisk i’ th’ sun
