short_title,gutenberg_title,genre,year,author,section,class,act,scene,character,line_number,text
Winter's Tale,THE WINTER’S TALE,Comedy,1611,William Shakespeare,contents,dialogue,ACT IV,SCENE II,POLIXENES,1576,denying thee anything; a death to grant this.
Winter's Tale,THE WINTER’S TALE,Comedy,1611,William Shakespeare,contents,dialogue,ACT IV,SCENE II,CAMILLO,1577,It is fifteen years since I saw my country. Though I have for the most
Winter's Tale,THE WINTER’S TALE,Comedy,1611,William Shakespeare,contents,dialogue,ACT IV,SCENE II,CAMILLO,1578,"part been aired abroad, I desire to lay my bones there. Besides, the"
Winter's Tale,THE WINTER’S TALE,Comedy,1611,William Shakespeare,contents,dialogue,ACT IV,SCENE II,CAMILLO,1579,"penitent king, my master, hath sent for me; to whose feeling sorrows I"
Winter's Tale,THE WINTER’S TALE,Comedy,1611,William Shakespeare,contents,dialogue,ACT IV,SCENE II,CAMILLO,1580,"might be some allay, or I o’erween to think so,—which is another spur"
Winter's Tale,THE WINTER’S TALE,Comedy,1611,William Shakespeare,contents,dialogue,ACT IV,SCENE II,CAMILLO,1581,to my departure.
Winter's Tale,THE WINTER’S TALE,Comedy,1611,William Shakespeare,contents,dialogue,ACT IV,SCENE II,POLIXENES,1582,"As thou lov’st me, Camillo, wipe not out the rest of thy services by"
Winter's Tale,THE WINTER’S TALE,Comedy,1611,William Shakespeare,contents,dialogue,ACT IV,SCENE II,POLIXENES,1583,"leaving me now: the need I have of thee, thine own goodness hath made;"
Winter's Tale,THE WINTER’S TALE,Comedy,1611,William Shakespeare,contents,dialogue,ACT IV,SCENE II,POLIXENES,1584,"better not to have had thee than thus to want thee. Thou, having made"
Winter's Tale,THE WINTER’S TALE,Comedy,1611,William Shakespeare,contents,dialogue,ACT IV,SCENE II,POLIXENES,1585,"me businesses which none without thee can sufficiently manage, must"
Winter's Tale,THE WINTER’S TALE,Comedy,1611,William Shakespeare,contents,dialogue,ACT IV,SCENE II,POLIXENES,1586,"either stay to execute them thyself, or take away with thee the very"
Winter's Tale,THE WINTER’S TALE,Comedy,1611,William Shakespeare,contents,dialogue,ACT IV,SCENE II,POLIXENES,1587,"services thou hast done, which if I have not enough considered (as too"
Winter's Tale,THE WINTER’S TALE,Comedy,1611,William Shakespeare,contents,dialogue,ACT IV,SCENE II,POLIXENES,1588,much I cannot) to be more thankful to thee shall be my study; and my
Winter's Tale,THE WINTER’S TALE,Comedy,1611,William Shakespeare,contents,dialogue,ACT IV,SCENE II,POLIXENES,1589,"profit therein the heaping friendships. Of that fatal country Sicilia,"
Winter's Tale,THE WINTER’S TALE,Comedy,1611,William Shakespeare,contents,dialogue,ACT IV,SCENE II,POLIXENES,1590,prithee speak no more; whose very naming punishes me with the
Winter's Tale,THE WINTER’S TALE,Comedy,1611,William Shakespeare,contents,dialogue,ACT IV,SCENE II,POLIXENES,1591,"remembrance of that penitent, as thou call’st him, and reconciled king,"
Winter's Tale,THE WINTER’S TALE,Comedy,1611,William Shakespeare,contents,dialogue,ACT IV,SCENE II,POLIXENES,1592,my brother; whose loss of his most precious queen and children are even
Winter's Tale,THE WINTER’S TALE,Comedy,1611,William Shakespeare,contents,dialogue,ACT IV,SCENE II,POLIXENES,1593,"now to be afresh lamented. Say to me, when sawest thou the Prince"
Winter's Tale,THE WINTER’S TALE,Comedy,1611,William Shakespeare,contents,dialogue,ACT IV,SCENE II,POLIXENES,1594,"Florizel, my son? Kings are no less unhappy, their issue not being"
Winter's Tale,THE WINTER’S TALE,Comedy,1611,William Shakespeare,contents,dialogue,ACT IV,SCENE II,POLIXENES,1595,"gracious, than they are in losing them when they have approved their"
Winter's Tale,THE WINTER’S TALE,Comedy,1611,William Shakespeare,contents,dialogue,ACT IV,SCENE II,POLIXENES,1596,virtues.
Winter's Tale,THE WINTER’S TALE,Comedy,1611,William Shakespeare,contents,dialogue,ACT IV,SCENE II,CAMILLO,1597,"Sir, it is three days since I saw the prince. What his happier affairs"
Winter's Tale,THE WINTER’S TALE,Comedy,1611,William Shakespeare,contents,dialogue,ACT IV,SCENE II,CAMILLO,1598,"may be, are to me unknown, but I have missingly noted he is of late"
Winter's Tale,THE WINTER’S TALE,Comedy,1611,William Shakespeare,contents,dialogue,ACT IV,SCENE II,CAMILLO,1599,"much retired from court, and is less frequent to his princely exercises"
Winter's Tale,THE WINTER’S TALE,Comedy,1611,William Shakespeare,contents,dialogue,ACT IV,SCENE II,CAMILLO,1600,than formerly he hath appeared.
Winter's Tale,THE WINTER’S TALE,Comedy,1611,William Shakespeare,contents,dialogue,ACT IV,SCENE II,POLIXENES,1601,"I have considered so much, Camillo, and with some care; so far that I"
Winter's Tale,THE WINTER’S TALE,Comedy,1611,William Shakespeare,contents,dialogue,ACT IV,SCENE II,POLIXENES,1602,have eyes under my service which look upon his removedness; from whom I
Winter's Tale,THE WINTER’S TALE,Comedy,1611,William Shakespeare,contents,dialogue,ACT IV,SCENE II,POLIXENES,1603,"have this intelligence, that he is seldom from the house of a most"
Winter's Tale,THE WINTER’S TALE,Comedy,1611,William Shakespeare,contents,dialogue,ACT IV,SCENE II,POLIXENES,1604,"homely shepherd, a man, they say, that from very nothing, and beyond"
Winter's Tale,THE WINTER’S TALE,Comedy,1611,William Shakespeare,contents,dialogue,ACT IV,SCENE II,POLIXENES,1605,"the imagination of his neighbours, is grown into an unspeakable estate."
Winter's Tale,THE WINTER’S TALE,Comedy,1611,William Shakespeare,contents,dialogue,ACT IV,SCENE II,CAMILLO,1606,"I have heard, sir, of such a man, who hath a daughter of most rare"
Winter's Tale,THE WINTER’S TALE,Comedy,1611,William Shakespeare,contents,dialogue,ACT IV,SCENE II,CAMILLO,1607,note: the report of her is extended more than can be thought to begin
Winter's Tale,THE WINTER’S TALE,Comedy,1611,William Shakespeare,contents,dialogue,ACT IV,SCENE II,CAMILLO,1608,from such a cottage.
Winter's Tale,THE WINTER’S TALE,Comedy,1611,William Shakespeare,contents,dialogue,ACT IV,SCENE II,POLIXENES,1609,"That’s likewise part of my intelligence: but, I fear, the angle that"
Winter's Tale,THE WINTER’S TALE,Comedy,1611,William Shakespeare,contents,dialogue,ACT IV,SCENE II,POLIXENES,1610,"plucks our son thither. Thou shalt accompany us to the place, where we"
Winter's Tale,THE WINTER’S TALE,Comedy,1611,William Shakespeare,contents,dialogue,ACT IV,SCENE II,POLIXENES,1611,"will, not appearing what we are, have some question with the shepherd;"
Winter's Tale,THE WINTER’S TALE,Comedy,1611,William Shakespeare,contents,dialogue,ACT IV,SCENE II,POLIXENES,1612,from whose simplicity I think it not uneasy to get the cause of my
Winter's Tale,THE WINTER’S TALE,Comedy,1611,William Shakespeare,contents,dialogue,ACT IV,SCENE II,POLIXENES,1613,"son’s resort thither. Prithee, be my present partner in this business,"
Winter's Tale,THE WINTER’S TALE,Comedy,1611,William Shakespeare,contents,dialogue,ACT IV,SCENE II,POLIXENES,1614,and lay aside the thoughts of Sicilia.
Winter's Tale,THE WINTER’S TALE,Comedy,1611,William Shakespeare,contents,dialogue,ACT IV,SCENE II,CAMILLO,1615,I willingly obey your command.
Winter's Tale,THE WINTER’S TALE,Comedy,1611,William Shakespeare,contents,dialogue,ACT IV,SCENE II,POLIXENES,1616,My best Camillo! We must disguise ourselves.
Winter's Tale,THE WINTER’S TALE,Comedy,1611,William Shakespeare,contents,directions,ACT IV,SCENE II,NA,NA,[Exeunt.]
Winter's Tale,THE WINTER’S TALE,Comedy,1611,William Shakespeare,contents,reference,ACT IV,SCENE III,NA,NA,SCENE III. The same. A Road near the Shepherd’s cottage.
Winter's Tale,THE WINTER’S TALE,Comedy,1611,William Shakespeare,contents,directions,ACT IV,SCENE III,NA,NA,"Enter Autolycus, singing."
Winter's Tale,THE WINTER’S TALE,Comedy,1611,William Shakespeare,contents,dialogue,ACT IV,SCENE III,AUTOLYCUS,1617,"When daffodils begin to peer,"
Winter's Tale,THE WINTER’S TALE,Comedy,1611,William Shakespeare,contents,dialogue,ACT IV,SCENE III,AUTOLYCUS,1618,"With, hey! the doxy over the dale,"
Winter's Tale,THE WINTER’S TALE,Comedy,1611,William Shakespeare,contents,dialogue,ACT IV,SCENE III,AUTOLYCUS,1619,"Why, then comes in the sweet o’ the year,"
Winter's Tale,THE WINTER’S TALE,Comedy,1611,William Shakespeare,contents,dialogue,ACT IV,SCENE III,AUTOLYCUS,1620,For the red blood reigns in the winter’s pale.
Winter's Tale,THE WINTER’S TALE,Comedy,1611,William Shakespeare,contents,dialogue,ACT IV,SCENE III,AUTOLYCUS,1621,"The white sheet bleaching on the hedge,"
Winter's Tale,THE WINTER’S TALE,Comedy,1611,William Shakespeare,contents,dialogue,ACT IV,SCENE III,AUTOLYCUS,1622,"With, hey! the sweet birds, O, how they sing!"
Winter's Tale,THE WINTER’S TALE,Comedy,1611,William Shakespeare,contents,dialogue,ACT IV,SCENE III,AUTOLYCUS,1623,Doth set my pugging tooth on edge;
Winter's Tale,THE WINTER’S TALE,Comedy,1611,William Shakespeare,contents,dialogue,ACT IV,SCENE III,AUTOLYCUS,1624,For a quart of ale is a dish for a king.
Winter's Tale,THE WINTER’S TALE,Comedy,1611,William Shakespeare,contents,dialogue,ACT IV,SCENE III,AUTOLYCUS,1625,"The lark, that tirra-lirra chants,"
Winter's Tale,THE WINTER’S TALE,Comedy,1611,William Shakespeare,contents,dialogue,ACT IV,SCENE III,AUTOLYCUS,1626,"With, hey! with, hey! the thrush and the jay,"
Winter's Tale,THE WINTER’S TALE,Comedy,1611,William Shakespeare,contents,dialogue,ACT IV,SCENE III,AUTOLYCUS,1627,"Are summer songs for me and my aunts,"
Winter's Tale,THE WINTER’S TALE,Comedy,1611,William Shakespeare,contents,dialogue,ACT IV,SCENE III,AUTOLYCUS,1628,While we lie tumbling in the hay.
Winter's Tale,THE WINTER’S TALE,Comedy,1611,William Shakespeare,contents,dialogue,ACT IV,SCENE III,AUTOLYCUS,1629,"I have served Prince Florizel, and in my time wore three-pile, but now"
Winter's Tale,THE WINTER’S TALE,Comedy,1611,William Shakespeare,contents,dialogue,ACT IV,SCENE III,AUTOLYCUS,1630,I am out of service.
Winter's Tale,THE WINTER’S TALE,Comedy,1611,William Shakespeare,contents,dialogue,ACT IV,SCENE III,AUTOLYCUS,1631,"But shall I go mourn for that, my dear?"
Winter's Tale,THE WINTER’S TALE,Comedy,1611,William Shakespeare,contents,dialogue,ACT IV,SCENE III,AUTOLYCUS,1632,The pale moon shines by night:
Winter's Tale,THE WINTER’S TALE,Comedy,1611,William Shakespeare,contents,dialogue,ACT IV,SCENE III,AUTOLYCUS,1633,"And when I wander here and there,"
Winter's Tale,THE WINTER’S TALE,Comedy,1611,William Shakespeare,contents,dialogue,ACT IV,SCENE III,AUTOLYCUS,1634,I then do most go right.
Winter's Tale,THE WINTER’S TALE,Comedy,1611,William Shakespeare,contents,dialogue,ACT IV,SCENE III,AUTOLYCUS,1635,"If tinkers may have leave to live,"
Winter's Tale,THE WINTER’S TALE,Comedy,1611,William Shakespeare,contents,dialogue,ACT IV,SCENE III,AUTOLYCUS,1636,"And bear the sow-skin budget,"
Winter's Tale,THE WINTER’S TALE,Comedy,1611,William Shakespeare,contents,dialogue,ACT IV,SCENE III,AUTOLYCUS,1637,Then my account I well may give
Winter's Tale,THE WINTER’S TALE,Comedy,1611,William Shakespeare,contents,dialogue,ACT IV,SCENE III,AUTOLYCUS,1638,And in the stocks avouch it.
Winter's Tale,THE WINTER’S TALE,Comedy,1611,William Shakespeare,contents,dialogue,ACT IV,SCENE III,AUTOLYCUS,1639,"My traffic is sheets; when the kite builds, look to lesser linen. My"
Winter's Tale,THE WINTER’S TALE,Comedy,1611,William Shakespeare,contents,dialogue,ACT IV,SCENE III,AUTOLYCUS,1640,"father named me Autolycus; who being, I as am, littered under Mercury,"
Winter's Tale,THE WINTER’S TALE,Comedy,1611,William Shakespeare,contents,dialogue,ACT IV,SCENE III,AUTOLYCUS,1641,was likewise a snapper-up of unconsidered trifles. With die and drab I
Winter's Tale,THE WINTER’S TALE,Comedy,1611,William Shakespeare,contents,dialogue,ACT IV,SCENE III,AUTOLYCUS,1642,"purchased this caparison, and my revenue is the silly cheat. Gallows"
Winter's Tale,THE WINTER’S TALE,Comedy,1611,William Shakespeare,contents,dialogue,ACT IV,SCENE III,AUTOLYCUS,1643,and knock are too powerful on the highway. Beating and hanging are
Winter's Tale,THE WINTER’S TALE,Comedy,1611,William Shakespeare,contents,dialogue,ACT IV,SCENE III,AUTOLYCUS,1644,"terrors to me. For the life to come, I sleep out the thought of it. A"
Winter's Tale,THE WINTER’S TALE,Comedy,1611,William Shakespeare,contents,dialogue,ACT IV,SCENE III,AUTOLYCUS,1645,prize! a prize!
Winter's Tale,THE WINTER’S TALE,Comedy,1611,William Shakespeare,contents,directions,ACT IV,SCENE III,NA,NA,Enter Clown.
Winter's Tale,THE WINTER’S TALE,Comedy,1611,William Shakespeare,contents,dialogue,ACT IV,SCENE III,CLOWN,1646,Let me see: every ’leven wether tods; every tod yields pound and odd
Winter's Tale,THE WINTER’S TALE,Comedy,1611,William Shakespeare,contents,dialogue,ACT IV,SCENE III,CLOWN,1647,"shilling; fifteen hundred shorn, what comes the wool to?"
Winter's Tale,THE WINTER’S TALE,Comedy,1611,William Shakespeare,contents,dialogue,ACT IV,SCENE III,AUTOLYCUS,1648,"[Aside.] If the springe hold, the cock’s mine."
Winter's Tale,THE WINTER’S TALE,Comedy,1611,William Shakespeare,contents,dialogue,ACT IV,SCENE III,CLOWN,1649,I cannot do’t without counters. Let me see; what am I to buy for our
Winter's Tale,THE WINTER’S TALE,Comedy,1611,William Shakespeare,contents,dialogue,ACT IV,SCENE III,CLOWN,1650,"sheep-shearing feast? “Three pound of sugar, five pound of currants,"
Winter's Tale,THE WINTER’S TALE,Comedy,1611,William Shakespeare,contents,dialogue,ACT IV,SCENE III,CLOWN,1651,rice”—what will this sister of mine do with rice? But my father hath
Winter's Tale,THE WINTER’S TALE,Comedy,1611,William Shakespeare,contents,dialogue,ACT IV,SCENE III,CLOWN,1652,"made her mistress of the feast, and she lays it on. She hath made me"
Winter's Tale,THE WINTER’S TALE,Comedy,1611,William Shakespeare,contents,dialogue,ACT IV,SCENE III,CLOWN,1653,"four-and-twenty nosegays for the shearers, three-man song-men all, and"
Winter's Tale,THE WINTER’S TALE,Comedy,1611,William Shakespeare,contents,dialogue,ACT IV,SCENE III,CLOWN,1654,"very good ones; but they are most of them means and basses, but one"
Winter's Tale,THE WINTER’S TALE,Comedy,1611,William Shakespeare,contents,dialogue,ACT IV,SCENE III,CLOWN,1655,"puritan amongst them, and he sings psalms to hornpipes. I must have"
Winter's Tale,THE WINTER’S TALE,Comedy,1611,William Shakespeare,contents,dialogue,ACT IV,SCENE III,CLOWN,1656,"saffron to colour the warden pies; “mace; dates”, none, that’s out of"
Winter's Tale,THE WINTER’S TALE,Comedy,1611,William Shakespeare,contents,dialogue,ACT IV,SCENE III,CLOWN,1657,"my note; “nutmegs, seven; a race or two of ginger”, but that I may beg;"
Winter's Tale,THE WINTER’S TALE,Comedy,1611,William Shakespeare,contents,dialogue,ACT IV,SCENE III,CLOWN,1658,"“four pound of prunes, and as many of raisins o’ th’ sun.”"
Winter's Tale,THE WINTER’S TALE,Comedy,1611,William Shakespeare,contents,dialogue,ACT IV,SCENE III,AUTOLYCUS,1659,[Grovelling on the ground.] O that ever I was born!
Winter's Tale,THE WINTER’S TALE,Comedy,1611,William Shakespeare,contents,dialogue,ACT IV,SCENE III,CLOWN,1660,I’ th’ name of me!
Winter's Tale,THE WINTER’S TALE,Comedy,1611,William Shakespeare,contents,dialogue,ACT IV,SCENE III,AUTOLYCUS,1661,"O, help me, help me! Pluck but off these rags; and then, death, death!"
Winter's Tale,THE WINTER’S TALE,Comedy,1611,William Shakespeare,contents,dialogue,ACT IV,SCENE III,CLOWN,1662,"Alack, poor soul! thou hast need of more rags to lay on thee, rather"
Winter's Tale,THE WINTER’S TALE,Comedy,1611,William Shakespeare,contents,dialogue,ACT IV,SCENE III,CLOWN,1663,than have these off.
Winter's Tale,THE WINTER’S TALE,Comedy,1611,William Shakespeare,contents,dialogue,ACT IV,SCENE III,AUTOLYCUS,1664,"O sir, the loathsomeness of them offends me more than the stripes I"
Winter's Tale,THE WINTER’S TALE,Comedy,1611,William Shakespeare,contents,dialogue,ACT IV,SCENE III,AUTOLYCUS,1665,"have received, which are mighty ones and millions."
Winter's Tale,THE WINTER’S TALE,Comedy,1611,William Shakespeare,contents,dialogue,ACT IV,SCENE III,CLOWN,1666,"Alas, poor man! a million of beating may come to a great matter."
Winter's Tale,THE WINTER’S TALE,Comedy,1611,William Shakespeare,contents,dialogue,ACT IV,SCENE III,AUTOLYCUS,1667,"I am robbed, sir, and beaten; my money and apparel ta’en from me, and"
Winter's Tale,THE WINTER’S TALE,Comedy,1611,William Shakespeare,contents,dialogue,ACT IV,SCENE III,AUTOLYCUS,1668,these detestable things put upon me.
Winter's Tale,THE WINTER’S TALE,Comedy,1611,William Shakespeare,contents,dialogue,ACT IV,SCENE III,CLOWN,1669,"What, by a horseman or a footman?"
Winter's Tale,THE WINTER’S TALE,Comedy,1611,William Shakespeare,contents,dialogue,ACT IV,SCENE III,AUTOLYCUS,1670,"A footman, sweet sir, a footman."
Winter's Tale,THE WINTER’S TALE,Comedy,1611,William Shakespeare,contents,dialogue,ACT IV,SCENE III,CLOWN,1671,"Indeed, he should be a footman by the garments he has left with thee:"
Winter's Tale,THE WINTER’S TALE,Comedy,1611,William Shakespeare,contents,dialogue,ACT IV,SCENE III,CLOWN,1672,"if this be a horseman’s coat, it hath seen very hot service. Lend me"
Winter's Tale,THE WINTER’S TALE,Comedy,1611,William Shakespeare,contents,dialogue,ACT IV,SCENE III,CLOWN,1673,"thy hand, I’ll help thee: come, lend me thy hand."
Winter's Tale,THE WINTER’S TALE,Comedy,1611,William Shakespeare,contents,directions,ACT IV,SCENE III,NA,NA,[Helping him up.]
Winter's Tale,THE WINTER’S TALE,Comedy,1611,William Shakespeare,contents,dialogue,ACT IV,SCENE III,AUTOLYCUS,1674,"O, good sir, tenderly, O!"
Winter's Tale,THE WINTER’S TALE,Comedy,1611,William Shakespeare,contents,dialogue,ACT IV,SCENE III,CLOWN,1675,"Alas, poor soul!"
Winter's Tale,THE WINTER’S TALE,Comedy,1611,William Shakespeare,contents,dialogue,ACT IV,SCENE III,AUTOLYCUS,1676,"O, good sir, softly, good sir. I fear, sir, my shoulder blade is out."
Winter's Tale,THE WINTER’S TALE,Comedy,1611,William Shakespeare,contents,dialogue,ACT IV,SCENE III,CLOWN,1677,How now! canst stand?
Winter's Tale,THE WINTER’S TALE,Comedy,1611,William Shakespeare,contents,dialogue,ACT IV,SCENE III,AUTOLYCUS,1678,"Softly, dear sir! [Picks his pocket.] good sir, softly. You ha’ done"
Winter's Tale,THE WINTER’S TALE,Comedy,1611,William Shakespeare,contents,dialogue,ACT IV,SCENE III,AUTOLYCUS,1679,me a charitable office.
Winter's Tale,THE WINTER’S TALE,Comedy,1611,William Shakespeare,contents,dialogue,ACT IV,SCENE III,CLOWN,1680,Dost lack any money? I have a little money for thee.
Winter's Tale,THE WINTER’S TALE,Comedy,1611,William Shakespeare,contents,dialogue,ACT IV,SCENE III,AUTOLYCUS,1681,"No, good sweet sir; no, I beseech you, sir: I have a kinsman not past"
Winter's Tale,THE WINTER’S TALE,Comedy,1611,William Shakespeare,contents,dialogue,ACT IV,SCENE III,AUTOLYCUS,1682,"three-quarters of a mile hence, unto whom I was going. I shall there"
Winter's Tale,THE WINTER’S TALE,Comedy,1611,William Shakespeare,contents,dialogue,ACT IV,SCENE III,AUTOLYCUS,1683,"have money or anything I want. Offer me no money, I pray you; that"
Winter's Tale,THE WINTER’S TALE,Comedy,1611,William Shakespeare,contents,dialogue,ACT IV,SCENE III,AUTOLYCUS,1684,kills my heart.
Winter's Tale,THE WINTER’S TALE,Comedy,1611,William Shakespeare,contents,dialogue,ACT IV,SCENE III,CLOWN,1685,What manner of fellow was he that robbed you?
Winter's Tale,THE WINTER’S TALE,Comedy,1611,William Shakespeare,contents,dialogue,ACT IV,SCENE III,AUTOLYCUS,1686,"A fellow, sir, that I have known to go about with troll-my-dames. I"
Winter's Tale,THE WINTER’S TALE,Comedy,1611,William Shakespeare,contents,dialogue,ACT IV,SCENE III,AUTOLYCUS,1687,"knew him once a servant of the prince; I cannot tell, good sir, for"
Winter's Tale,THE WINTER’S TALE,Comedy,1611,William Shakespeare,contents,dialogue,ACT IV,SCENE III,AUTOLYCUS,1688,"which of his virtues it was, but he was certainly whipped out of the"
Winter's Tale,THE WINTER’S TALE,Comedy,1611,William Shakespeare,contents,dialogue,ACT IV,SCENE III,AUTOLYCUS,1689,court.
Winter's Tale,THE WINTER’S TALE,Comedy,1611,William Shakespeare,contents,dialogue,ACT IV,SCENE III,CLOWN,1690,"His vices, you would say; there’s no virtue whipped out of the court."
Winter's Tale,THE WINTER’S TALE,Comedy,1611,William Shakespeare,contents,dialogue,ACT IV,SCENE III,CLOWN,1691,They cherish it to make it stay there; and yet it will no more but
Winter's Tale,THE WINTER’S TALE,Comedy,1611,William Shakespeare,contents,dialogue,ACT IV,SCENE III,CLOWN,1692,abide.
Winter's Tale,THE WINTER’S TALE,Comedy,1611,William Shakespeare,contents,dialogue,ACT IV,SCENE III,AUTOLYCUS,1693,"Vices, I would say, sir. I know this man well. He hath been since an"
Winter's Tale,THE WINTER’S TALE,Comedy,1611,William Shakespeare,contents,dialogue,ACT IV,SCENE III,AUTOLYCUS,1694,"ape-bearer, then a process-server, a bailiff. Then he compassed a"
Winter's Tale,THE WINTER’S TALE,Comedy,1611,William Shakespeare,contents,dialogue,ACT IV,SCENE III,AUTOLYCUS,1695,"motion of the Prodigal Son, and married a tinker’s wife within a mile"
Winter's Tale,THE WINTER’S TALE,Comedy,1611,William Shakespeare,contents,dialogue,ACT IV,SCENE III,AUTOLYCUS,1696,"where my land and living lies; and, having flown over many knavish"
Winter's Tale,THE WINTER’S TALE,Comedy,1611,William Shakespeare,contents,dialogue,ACT IV,SCENE III,AUTOLYCUS,1697,"professions, he settled only in rogue. Some call him Autolycus."
Winter's Tale,THE WINTER’S TALE,Comedy,1611,William Shakespeare,contents,dialogue,ACT IV,SCENE III,CLOWN,1698,"Out upon him! prig, for my life, prig: he haunts wakes, fairs, and"
Winter's Tale,THE WINTER’S TALE,Comedy,1611,William Shakespeare,contents,dialogue,ACT IV,SCENE III,CLOWN,1699,bear-baitings.
Winter's Tale,THE WINTER’S TALE,Comedy,1611,William Shakespeare,contents,dialogue,ACT IV,SCENE III,AUTOLYCUS,1700,"Very true, sir; he, sir, he; that’s the rogue that put me into this"
Winter's Tale,THE WINTER’S TALE,Comedy,1611,William Shakespeare,contents,dialogue,ACT IV,SCENE III,AUTOLYCUS,1701,apparel.
Winter's Tale,THE WINTER’S TALE,Comedy,1611,William Shakespeare,contents,dialogue,ACT IV,SCENE III,CLOWN,1702,Not a more cowardly rogue in all Bohemia. If you had but looked big and
Winter's Tale,THE WINTER’S TALE,Comedy,1611,William Shakespeare,contents,dialogue,ACT IV,SCENE III,CLOWN,1703,"spit at him, he’d have run."
Winter's Tale,THE WINTER’S TALE,Comedy,1611,William Shakespeare,contents,dialogue,ACT IV,SCENE III,AUTOLYCUS,1704,"I must confess to you, sir, I am no fighter. I am false of heart that"
Winter's Tale,THE WINTER’S TALE,Comedy,1611,William Shakespeare,contents,dialogue,ACT IV,SCENE III,AUTOLYCUS,1705,"way; and that he knew, I warrant him."
Winter's Tale,THE WINTER’S TALE,Comedy,1611,William Shakespeare,contents,dialogue,ACT IV,SCENE III,CLOWN,1706,How do you now?
Winter's Tale,THE WINTER’S TALE,Comedy,1611,William Shakespeare,contents,dialogue,ACT IV,SCENE III,AUTOLYCUS,1707,"Sweet sir, much better than I was. I can stand and walk: I will even"
Winter's Tale,THE WINTER’S TALE,Comedy,1611,William Shakespeare,contents,dialogue,ACT IV,SCENE III,AUTOLYCUS,1708,take my leave of you and pace softly towards my kinsman’s.
Winter's Tale,THE WINTER’S TALE,Comedy,1611,William Shakespeare,contents,dialogue,ACT IV,SCENE III,CLOWN,1709,Shall I bring thee on the way?
Winter's Tale,THE WINTER’S TALE,Comedy,1611,William Shakespeare,contents,dialogue,ACT IV,SCENE III,AUTOLYCUS,1710,"No, good-faced sir; no, sweet sir."
Winter's Tale,THE WINTER’S TALE,Comedy,1611,William Shakespeare,contents,dialogue,ACT IV,SCENE III,CLOWN,1711,Then fare thee well. I must go buy spices for our sheep-shearing.
Winter's Tale,THE WINTER’S TALE,Comedy,1611,William Shakespeare,contents,dialogue,ACT IV,SCENE III,AUTOLYCUS,1712,"Prosper you, sweet sir!"
Winter's Tale,THE WINTER’S TALE,Comedy,1611,William Shakespeare,contents,directions,ACT IV,SCENE III,NA,NA,[Exit Clown.]
Winter's Tale,THE WINTER’S TALE,Comedy,1611,William Shakespeare,contents,dialogue,ACT IV,SCENE III,AUTOLYCUS,1713,Your purse is not hot enough to purchase your spice. I’ll be with you
Winter's Tale,THE WINTER’S TALE,Comedy,1611,William Shakespeare,contents,dialogue,ACT IV,SCENE III,AUTOLYCUS,1714,at your sheep-shearing too. If I make not this cheat bring out
Winter's Tale,THE WINTER’S TALE,Comedy,1611,William Shakespeare,contents,dialogue,ACT IV,SCENE III,AUTOLYCUS,1715,"another, and the shearers prove sheep, let me be unrolled, and my name"
Winter's Tale,THE WINTER’S TALE,Comedy,1611,William Shakespeare,contents,dialogue,ACT IV,SCENE III,AUTOLYCUS,1716,put in the book of virtue!
Winter's Tale,THE WINTER’S TALE,Comedy,1611,William Shakespeare,contents,directions,ACT IV,SCENE III,NA,NA,[Sings.]
Winter's Tale,THE WINTER’S TALE,Comedy,1611,William Shakespeare,contents,dialogue,ACT IV,SCENE III,AUTOLYCUS,1717,"Jog on, jog on, the footpath way,"
Winter's Tale,THE WINTER’S TALE,Comedy,1611,William Shakespeare,contents,dialogue,ACT IV,SCENE III,AUTOLYCUS,1718,And merrily hent the stile-a:
Winter's Tale,THE WINTER’S TALE,Comedy,1611,William Shakespeare,contents,dialogue,ACT IV,SCENE III,AUTOLYCUS,1719,"A merry heart goes all the day,"
Winter's Tale,THE WINTER’S TALE,Comedy,1611,William Shakespeare,contents,dialogue,ACT IV,SCENE III,AUTOLYCUS,1720,Your sad tires in a mile-a.
Winter's Tale,THE WINTER’S TALE,Comedy,1611,William Shakespeare,contents,directions,ACT IV,SCENE III,NA,NA,[Exit.]
Winter's Tale,THE WINTER’S TALE,Comedy,1611,William Shakespeare,contents,reference,ACT IV,SCENE IV,NA,NA,SCENE IV. The same. A Shepherd’s Cottage.
Winter's Tale,THE WINTER’S TALE,Comedy,1611,William Shakespeare,contents,directions,ACT IV,SCENE IV,NA,NA,Enter Florizel and Perdita.
