short_title,gutenberg_title,genre,year,author,section,class,act,scene,character,line_number,text
Winter's Tale,THE WINTER’S TALE,Comedy,1611,William Shakespeare,contents,dialogue,ACT II,SCENE I,LEONTES,787,"Cleomenes and Dion, whom you know"
Winter's Tale,THE WINTER’S TALE,Comedy,1611,William Shakespeare,contents,dialogue,ACT II,SCENE I,LEONTES,788,Of stuff’d sufficiency: now from the oracle
Winter's Tale,THE WINTER’S TALE,Comedy,1611,William Shakespeare,contents,dialogue,ACT II,SCENE I,LEONTES,789,"They will bring all, whose spiritual counsel had,"
Winter's Tale,THE WINTER’S TALE,Comedy,1611,William Shakespeare,contents,dialogue,ACT II,SCENE I,LEONTES,790,Shall stop or spur me. Have I done well?
Winter's Tale,THE WINTER’S TALE,Comedy,1611,William Shakespeare,contents,dialogue,ACT II,SCENE I,FIRST LORD,791,"Well done, my lord."
Winter's Tale,THE WINTER’S TALE,Comedy,1611,William Shakespeare,contents,dialogue,ACT II,SCENE I,LEONTES,792,"Though I am satisfied, and need no more"
Winter's Tale,THE WINTER’S TALE,Comedy,1611,William Shakespeare,contents,dialogue,ACT II,SCENE I,LEONTES,793,"Than what I know, yet shall the oracle"
Winter's Tale,THE WINTER’S TALE,Comedy,1611,William Shakespeare,contents,dialogue,ACT II,SCENE I,LEONTES,794,"Give rest to the minds of others, such as he"
Winter's Tale,THE WINTER’S TALE,Comedy,1611,William Shakespeare,contents,dialogue,ACT II,SCENE I,LEONTES,795,Whose ignorant credulity will not
Winter's Tale,THE WINTER’S TALE,Comedy,1611,William Shakespeare,contents,dialogue,ACT II,SCENE I,LEONTES,796,Come up to th’ truth. So have we thought it good
Winter's Tale,THE WINTER’S TALE,Comedy,1611,William Shakespeare,contents,dialogue,ACT II,SCENE I,LEONTES,797,"From our free person she should be confin’d,"
Winter's Tale,THE WINTER’S TALE,Comedy,1611,William Shakespeare,contents,dialogue,ACT II,SCENE I,LEONTES,798,Lest that the treachery of the two fled hence
Winter's Tale,THE WINTER’S TALE,Comedy,1611,William Shakespeare,contents,dialogue,ACT II,SCENE I,LEONTES,799,"Be left her to perform. Come, follow us;"
Winter's Tale,THE WINTER’S TALE,Comedy,1611,William Shakespeare,contents,dialogue,ACT II,SCENE I,LEONTES,800,We are to speak in public; for this business
Winter's Tale,THE WINTER’S TALE,Comedy,1611,William Shakespeare,contents,dialogue,ACT II,SCENE I,LEONTES,801,Will raise us all.
Winter's Tale,THE WINTER’S TALE,Comedy,1611,William Shakespeare,contents,dialogue,ACT II,SCENE I,ANTIGONUS,802,"[Aside.] To laughter, as I take it,"
Winter's Tale,THE WINTER’S TALE,Comedy,1611,William Shakespeare,contents,dialogue,ACT II,SCENE I,ANTIGONUS,803,If the good truth were known.
Winter's Tale,THE WINTER’S TALE,Comedy,1611,William Shakespeare,contents,directions,ACT II,SCENE I,NA,NA,[Exeunt.]
Winter's Tale,THE WINTER’S TALE,Comedy,1611,William Shakespeare,contents,reference,ACT II,SCENE II,NA,NA,SCENE II. The same. The outer Room of a Prison.
Winter's Tale,THE WINTER’S TALE,Comedy,1611,William Shakespeare,contents,directions,ACT II,SCENE II,NA,NA,"Enter Paulina, a Gentleman and Attendants."
Winter's Tale,THE WINTER’S TALE,Comedy,1611,William Shakespeare,contents,dialogue,ACT II,SCENE II,PAULINA,804,"The keeper of the prison, call to him;"
Winter's Tale,THE WINTER’S TALE,Comedy,1611,William Shakespeare,contents,dialogue,ACT II,SCENE II,PAULINA,805,Let him have knowledge who I am.
Winter's Tale,THE WINTER’S TALE,Comedy,1611,William Shakespeare,contents,directions,ACT II,SCENE II,NA,NA,[Exit the Gentleman.]
Winter's Tale,THE WINTER’S TALE,Comedy,1611,William Shakespeare,contents,dialogue,ACT II,SCENE II,PAULINA,806,Good lady!
Winter's Tale,THE WINTER’S TALE,Comedy,1611,William Shakespeare,contents,dialogue,ACT II,SCENE II,PAULINA,807,No court in Europe is too good for thee;
Winter's Tale,THE WINTER’S TALE,Comedy,1611,William Shakespeare,contents,dialogue,ACT II,SCENE II,PAULINA,808,What dost thou then in prison?
Winter's Tale,THE WINTER’S TALE,Comedy,1611,William Shakespeare,contents,directions,ACT II,SCENE II,NA,NA,Enter Gentleman with the Gaoler.
Winter's Tale,THE WINTER’S TALE,Comedy,1611,William Shakespeare,contents,dialogue,ACT II,SCENE II,PAULINA,809,"Now, good sir,"
Winter's Tale,THE WINTER’S TALE,Comedy,1611,William Shakespeare,contents,dialogue,ACT II,SCENE II,PAULINA,810,"You know me, do you not?"
Winter's Tale,THE WINTER’S TALE,Comedy,1611,William Shakespeare,contents,dialogue,ACT II,SCENE II,GAOLER,811,For a worthy lady
Winter's Tale,THE WINTER’S TALE,Comedy,1611,William Shakespeare,contents,dialogue,ACT II,SCENE II,GAOLER,812,And one who much I honour.
Winter's Tale,THE WINTER’S TALE,Comedy,1611,William Shakespeare,contents,dialogue,ACT II,SCENE II,PAULINA,813,"Pray you then,"
Winter's Tale,THE WINTER’S TALE,Comedy,1611,William Shakespeare,contents,dialogue,ACT II,SCENE II,PAULINA,814,Conduct me to the queen.
Winter's Tale,THE WINTER’S TALE,Comedy,1611,William Shakespeare,contents,dialogue,ACT II,SCENE II,GAOLER,815,"I may not, madam."
Winter's Tale,THE WINTER’S TALE,Comedy,1611,William Shakespeare,contents,dialogue,ACT II,SCENE II,GAOLER,816,To the contrary I have express commandment.
Winter's Tale,THE WINTER’S TALE,Comedy,1611,William Shakespeare,contents,dialogue,ACT II,SCENE II,PAULINA,817,"Here’s ado, to lock up honesty and honour from"
Winter's Tale,THE WINTER’S TALE,Comedy,1611,William Shakespeare,contents,dialogue,ACT II,SCENE II,PAULINA,818,"Th’ access of gentle visitors! Is’t lawful, pray you,"
Winter's Tale,THE WINTER’S TALE,Comedy,1611,William Shakespeare,contents,dialogue,ACT II,SCENE II,PAULINA,819,To see her women? any of them? Emilia?
Winter's Tale,THE WINTER’S TALE,Comedy,1611,William Shakespeare,contents,dialogue,ACT II,SCENE II,GAOLER,820,"So please you, madam,"
Winter's Tale,THE WINTER’S TALE,Comedy,1611,William Shakespeare,contents,dialogue,ACT II,SCENE II,GAOLER,821,"To put apart these your attendants, I"
Winter's Tale,THE WINTER’S TALE,Comedy,1611,William Shakespeare,contents,dialogue,ACT II,SCENE II,GAOLER,822,Shall bring Emilia forth.
Winter's Tale,THE WINTER’S TALE,Comedy,1611,William Shakespeare,contents,dialogue,ACT II,SCENE II,PAULINA,823,"I pray now, call her."
Winter's Tale,THE WINTER’S TALE,Comedy,1611,William Shakespeare,contents,dialogue,ACT II,SCENE II,PAULINA,824,Withdraw yourselves.
Winter's Tale,THE WINTER’S TALE,Comedy,1611,William Shakespeare,contents,directions,ACT II,SCENE II,NA,NA,[Exeunt Gentleman and Attendants.]
Winter's Tale,THE WINTER’S TALE,Comedy,1611,William Shakespeare,contents,dialogue,ACT II,SCENE II,GAOLER,825,"And, madam,"
Winter's Tale,THE WINTER’S TALE,Comedy,1611,William Shakespeare,contents,dialogue,ACT II,SCENE II,GAOLER,826,I must be present at your conference.
Winter's Tale,THE WINTER’S TALE,Comedy,1611,William Shakespeare,contents,dialogue,ACT II,SCENE II,PAULINA,827,"Well, be’t so, prithee."
Winter's Tale,THE WINTER’S TALE,Comedy,1611,William Shakespeare,contents,directions,ACT II,SCENE II,NA,NA,[Exit Gaoler.]
Winter's Tale,THE WINTER’S TALE,Comedy,1611,William Shakespeare,contents,dialogue,ACT II,SCENE II,PAULINA,828,Here’s such ado to make no stain a stain
Winter's Tale,THE WINTER’S TALE,Comedy,1611,William Shakespeare,contents,dialogue,ACT II,SCENE II,PAULINA,829,As passes colouring.
Winter's Tale,THE WINTER’S TALE,Comedy,1611,William Shakespeare,contents,directions,ACT II,SCENE II,NA,NA,Re-enter Gaoler with Emilia.
Winter's Tale,THE WINTER’S TALE,Comedy,1611,William Shakespeare,contents,dialogue,ACT II,SCENE II,PAULINA,830,"Dear gentlewoman,"
Winter's Tale,THE WINTER’S TALE,Comedy,1611,William Shakespeare,contents,dialogue,ACT II,SCENE II,PAULINA,831,How fares our gracious lady?
Winter's Tale,THE WINTER’S TALE,Comedy,1611,William Shakespeare,contents,dialogue,ACT II,SCENE II,EMILIA,832,As well as one so great and so forlorn
Winter's Tale,THE WINTER’S TALE,Comedy,1611,William Shakespeare,contents,dialogue,ACT II,SCENE II,EMILIA,833,"May hold together: on her frights and griefs,"
Winter's Tale,THE WINTER’S TALE,Comedy,1611,William Shakespeare,contents,dialogue,ACT II,SCENE II,EMILIA,834,(Which never tender lady hath borne greater)
Winter's Tale,THE WINTER’S TALE,Comedy,1611,William Shakespeare,contents,dialogue,ACT II,SCENE II,EMILIA,835,"She is, something before her time, deliver’d."
Winter's Tale,THE WINTER’S TALE,Comedy,1611,William Shakespeare,contents,dialogue,ACT II,SCENE II,PAULINA,836,A boy?
Winter's Tale,THE WINTER’S TALE,Comedy,1611,William Shakespeare,contents,dialogue,ACT II,SCENE II,EMILIA,837,"A daughter; and a goodly babe,"
Winter's Tale,THE WINTER’S TALE,Comedy,1611,William Shakespeare,contents,dialogue,ACT II,SCENE II,EMILIA,838,"Lusty, and like to live: the queen receives"
Winter's Tale,THE WINTER’S TALE,Comedy,1611,William Shakespeare,contents,dialogue,ACT II,SCENE II,EMILIA,839,"Much comfort in ’t; says “My poor prisoner,"
Winter's Tale,THE WINTER’S TALE,Comedy,1611,William Shakespeare,contents,dialogue,ACT II,SCENE II,EMILIA,840,I am as innocent as you.”
Winter's Tale,THE WINTER’S TALE,Comedy,1611,William Shakespeare,contents,dialogue,ACT II,SCENE II,PAULINA,841,I dare be sworn.
Winter's Tale,THE WINTER’S TALE,Comedy,1611,William Shakespeare,contents,dialogue,ACT II,SCENE II,PAULINA,842,"These dangerous unsafe lunes i’ th’ king, beshrew them!"
Winter's Tale,THE WINTER’S TALE,Comedy,1611,William Shakespeare,contents,dialogue,ACT II,SCENE II,PAULINA,843,"He must be told on’t, and he shall: the office"
Winter's Tale,THE WINTER’S TALE,Comedy,1611,William Shakespeare,contents,dialogue,ACT II,SCENE II,PAULINA,844,Becomes a woman best. I’ll take’t upon me.
Winter's Tale,THE WINTER’S TALE,Comedy,1611,William Shakespeare,contents,dialogue,ACT II,SCENE II,PAULINA,845,"If I prove honey-mouth’d, let my tongue blister,"
Winter's Tale,THE WINTER’S TALE,Comedy,1611,William Shakespeare,contents,dialogue,ACT II,SCENE II,PAULINA,846,And never to my red-look’d anger be
Winter's Tale,THE WINTER’S TALE,Comedy,1611,William Shakespeare,contents,dialogue,ACT II,SCENE II,PAULINA,847,"The trumpet any more. Pray you, Emilia,"
Winter's Tale,THE WINTER’S TALE,Comedy,1611,William Shakespeare,contents,dialogue,ACT II,SCENE II,PAULINA,848,Commend my best obedience to the queen.
Winter's Tale,THE WINTER’S TALE,Comedy,1611,William Shakespeare,contents,dialogue,ACT II,SCENE II,PAULINA,849,"If she dares trust me with her little babe,"
Winter's Tale,THE WINTER’S TALE,Comedy,1611,William Shakespeare,contents,dialogue,ACT II,SCENE II,PAULINA,850,"I’ll show’t the king, and undertake to be"
Winter's Tale,THE WINTER’S TALE,Comedy,1611,William Shakespeare,contents,dialogue,ACT II,SCENE II,PAULINA,851,Her advocate to th’ loud’st. We do not know
Winter's Tale,THE WINTER’S TALE,Comedy,1611,William Shakespeare,contents,dialogue,ACT II,SCENE II,PAULINA,852,How he may soften at the sight o’ th’ child:
Winter's Tale,THE WINTER’S TALE,Comedy,1611,William Shakespeare,contents,dialogue,ACT II,SCENE II,PAULINA,853,The silence often of pure innocence
Winter's Tale,THE WINTER’S TALE,Comedy,1611,William Shakespeare,contents,dialogue,ACT II,SCENE II,PAULINA,854,"Persuades, when speaking fails."
Winter's Tale,THE WINTER’S TALE,Comedy,1611,William Shakespeare,contents,dialogue,ACT II,SCENE II,EMILIA,855,"Most worthy madam,"
Winter's Tale,THE WINTER’S TALE,Comedy,1611,William Shakespeare,contents,dialogue,ACT II,SCENE II,EMILIA,856,"Your honour and your goodness is so evident,"
Winter's Tale,THE WINTER’S TALE,Comedy,1611,William Shakespeare,contents,dialogue,ACT II,SCENE II,EMILIA,857,That your free undertaking cannot miss
Winter's Tale,THE WINTER’S TALE,Comedy,1611,William Shakespeare,contents,dialogue,ACT II,SCENE II,EMILIA,858,A thriving issue: there is no lady living
Winter's Tale,THE WINTER’S TALE,Comedy,1611,William Shakespeare,contents,dialogue,ACT II,SCENE II,EMILIA,859,So meet for this great errand. Please your ladyship
Winter's Tale,THE WINTER’S TALE,Comedy,1611,William Shakespeare,contents,dialogue,ACT II,SCENE II,EMILIA,860,"To visit the next room, I’ll presently"
Winter's Tale,THE WINTER’S TALE,Comedy,1611,William Shakespeare,contents,dialogue,ACT II,SCENE II,EMILIA,861,"Acquaint the queen of your most noble offer,"
Winter's Tale,THE WINTER’S TALE,Comedy,1611,William Shakespeare,contents,dialogue,ACT II,SCENE II,EMILIA,862,"Who but today hammer’d of this design,"
Winter's Tale,THE WINTER’S TALE,Comedy,1611,William Shakespeare,contents,dialogue,ACT II,SCENE II,EMILIA,863,"But durst not tempt a minister of honour,"
Winter's Tale,THE WINTER’S TALE,Comedy,1611,William Shakespeare,contents,dialogue,ACT II,SCENE II,EMILIA,864,Lest she should be denied.
Winter's Tale,THE WINTER’S TALE,Comedy,1611,William Shakespeare,contents,dialogue,ACT II,SCENE II,PAULINA,865,"Tell her, Emilia,"
Winter's Tale,THE WINTER’S TALE,Comedy,1611,William Shakespeare,contents,dialogue,ACT II,SCENE II,PAULINA,866,I’ll use that tongue I have: if wit flow from ’t
Winter's Tale,THE WINTER’S TALE,Comedy,1611,William Shakespeare,contents,dialogue,ACT II,SCENE II,PAULINA,867,"As boldness from my bosom, let’t not be doubted"
Winter's Tale,THE WINTER’S TALE,Comedy,1611,William Shakespeare,contents,dialogue,ACT II,SCENE II,PAULINA,868,I shall do good.
Winter's Tale,THE WINTER’S TALE,Comedy,1611,William Shakespeare,contents,dialogue,ACT II,SCENE II,EMILIA,869,Now be you blest for it!
Winter's Tale,THE WINTER’S TALE,Comedy,1611,William Shakespeare,contents,dialogue,ACT II,SCENE II,EMILIA,870,I’ll to the queen: please you come something nearer.
Winter's Tale,THE WINTER’S TALE,Comedy,1611,William Shakespeare,contents,dialogue,ACT II,SCENE II,GAOLER,871,"Madam, if ’t please the queen to send the babe,"
Winter's Tale,THE WINTER’S TALE,Comedy,1611,William Shakespeare,contents,dialogue,ACT II,SCENE II,GAOLER,872,"I know not what I shall incur to pass it,"
Winter's Tale,THE WINTER’S TALE,Comedy,1611,William Shakespeare,contents,dialogue,ACT II,SCENE II,GAOLER,873,Having no warrant.
Winter's Tale,THE WINTER’S TALE,Comedy,1611,William Shakespeare,contents,dialogue,ACT II,SCENE II,PAULINA,874,"You need not fear it, sir:"
Winter's Tale,THE WINTER’S TALE,Comedy,1611,William Shakespeare,contents,dialogue,ACT II,SCENE II,PAULINA,875,"This child was prisoner to the womb, and is,"
Winter's Tale,THE WINTER’S TALE,Comedy,1611,William Shakespeare,contents,dialogue,ACT II,SCENE II,PAULINA,876,By law and process of great nature thence
Winter's Tale,THE WINTER’S TALE,Comedy,1611,William Shakespeare,contents,dialogue,ACT II,SCENE II,PAULINA,877,Freed and enfranchis’d: not a party to
Winter's Tale,THE WINTER’S TALE,Comedy,1611,William Shakespeare,contents,dialogue,ACT II,SCENE II,PAULINA,878,"The anger of the king, nor guilty of,"
Winter's Tale,THE WINTER’S TALE,Comedy,1611,William Shakespeare,contents,dialogue,ACT II,SCENE II,PAULINA,879,"If any be, the trespass of the queen."
Winter's Tale,THE WINTER’S TALE,Comedy,1611,William Shakespeare,contents,dialogue,ACT II,SCENE II,GAOLER,880,I do believe it.
Winter's Tale,THE WINTER’S TALE,Comedy,1611,William Shakespeare,contents,dialogue,ACT II,SCENE II,PAULINA,881,"Do not you fear: upon mine honour, I"
Winter's Tale,THE WINTER’S TALE,Comedy,1611,William Shakespeare,contents,dialogue,ACT II,SCENE II,PAULINA,882,Will stand betwixt you and danger.
Winter's Tale,THE WINTER’S TALE,Comedy,1611,William Shakespeare,contents,directions,ACT II,SCENE II,NA,NA,[Exeunt.]
Winter's Tale,THE WINTER’S TALE,Comedy,1611,William Shakespeare,contents,reference,ACT II,SCENE III,NA,NA,SCENE III. The same. A Room in the Palace.
Winter's Tale,THE WINTER’S TALE,Comedy,1611,William Shakespeare,contents,directions,ACT II,SCENE III,NA,NA,"Enter Leontes, Antigonus, Lords and other Attendants."
Winter's Tale,THE WINTER’S TALE,Comedy,1611,William Shakespeare,contents,dialogue,ACT II,SCENE III,LEONTES,883,Nor night nor day no rest: it is but weakness
Winter's Tale,THE WINTER’S TALE,Comedy,1611,William Shakespeare,contents,dialogue,ACT II,SCENE III,LEONTES,884,"To bear the matter thus, mere weakness. If"
Winter's Tale,THE WINTER’S TALE,Comedy,1611,William Shakespeare,contents,dialogue,ACT II,SCENE III,LEONTES,885,"The cause were not in being,—part o’ th’ cause,"
Winter's Tale,THE WINTER’S TALE,Comedy,1611,William Shakespeare,contents,dialogue,ACT II,SCENE III,LEONTES,886,She th’ adultress; for the harlot king
Winter's Tale,THE WINTER’S TALE,Comedy,1611,William Shakespeare,contents,dialogue,ACT II,SCENE III,LEONTES,887,"Is quite beyond mine arm, out of the blank"
Winter's Tale,THE WINTER’S TALE,Comedy,1611,William Shakespeare,contents,dialogue,ACT II,SCENE III,LEONTES,888,"And level of my brain, plot-proof. But she"
Winter's Tale,THE WINTER’S TALE,Comedy,1611,William Shakespeare,contents,dialogue,ACT II,SCENE III,LEONTES,889,"I can hook to me. Say that she were gone,"
Winter's Tale,THE WINTER’S TALE,Comedy,1611,William Shakespeare,contents,dialogue,ACT II,SCENE III,LEONTES,890,"Given to the fire, a moiety of my rest"
Winter's Tale,THE WINTER’S TALE,Comedy,1611,William Shakespeare,contents,dialogue,ACT II,SCENE III,LEONTES,891,Might come to me again. Who’s there?
Winter's Tale,THE WINTER’S TALE,Comedy,1611,William Shakespeare,contents,dialogue,ACT II,SCENE III,FIRST ATTENDANT,892,My lord.
Winter's Tale,THE WINTER’S TALE,Comedy,1611,William Shakespeare,contents,dialogue,ACT II,SCENE III,LEONTES,893,How does the boy?
Winter's Tale,THE WINTER’S TALE,Comedy,1611,William Shakespeare,contents,dialogue,ACT II,SCENE III,FIRST ATTENDANT,894,He took good rest tonight;
Winter's Tale,THE WINTER’S TALE,Comedy,1611,William Shakespeare,contents,dialogue,ACT II,SCENE III,FIRST ATTENDANT,895,’Tis hop’d his sickness is discharg’d.
Winter's Tale,THE WINTER’S TALE,Comedy,1611,William Shakespeare,contents,dialogue,ACT II,SCENE III,LEONTES,896,"To see his nobleness,"
Winter's Tale,THE WINTER’S TALE,Comedy,1611,William Shakespeare,contents,dialogue,ACT II,SCENE III,LEONTES,897,Conceiving the dishonour of his mother.
Winter's Tale,THE WINTER’S TALE,Comedy,1611,William Shakespeare,contents,dialogue,ACT II,SCENE III,LEONTES,898,"He straight declin’d, droop’d, took it deeply,"
Winter's Tale,THE WINTER’S TALE,Comedy,1611,William Shakespeare,contents,dialogue,ACT II,SCENE III,LEONTES,899,"Fasten’d and fix’d the shame on’t in himself,"
Winter's Tale,THE WINTER’S TALE,Comedy,1611,William Shakespeare,contents,dialogue,ACT II,SCENE III,LEONTES,900,"Threw off his spirit, his appetite, his sleep,"
Winter's Tale,THE WINTER’S TALE,Comedy,1611,William Shakespeare,contents,dialogue,ACT II,SCENE III,LEONTES,901,"And downright languish’d. Leave me solely: go,"
Winter's Tale,THE WINTER’S TALE,Comedy,1611,William Shakespeare,contents,dialogue,ACT II,SCENE III,LEONTES,902,See how he fares.
Winter's Tale,THE WINTER’S TALE,Comedy,1611,William Shakespeare,contents,directions,ACT II,SCENE III,NA,NA,[Exit First Attendant.]
Winter's Tale,THE WINTER’S TALE,Comedy,1611,William Shakespeare,contents,dialogue,ACT II,SCENE III,LEONTES,903,"Fie, fie! no thought of him."
Winter's Tale,THE WINTER’S TALE,Comedy,1611,William Shakespeare,contents,dialogue,ACT II,SCENE III,LEONTES,904,The very thought of my revenges that way
Winter's Tale,THE WINTER’S TALE,Comedy,1611,William Shakespeare,contents,dialogue,ACT II,SCENE III,LEONTES,905,"Recoil upon me: in himself too mighty,"
Winter's Tale,THE WINTER’S TALE,Comedy,1611,William Shakespeare,contents,dialogue,ACT II,SCENE III,LEONTES,906,"And in his parties, his alliance. Let him be,"
Winter's Tale,THE WINTER’S TALE,Comedy,1611,William Shakespeare,contents,dialogue,ACT II,SCENE III,LEONTES,907,"Until a time may serve. For present vengeance,"
Winter's Tale,THE WINTER’S TALE,Comedy,1611,William Shakespeare,contents,dialogue,ACT II,SCENE III,LEONTES,908,Take it on her. Camillo and Polixenes
Winter's Tale,THE WINTER’S TALE,Comedy,1611,William Shakespeare,contents,dialogue,ACT II,SCENE III,LEONTES,909,Laugh at me; make their pastime at my sorrow:
Winter's Tale,THE WINTER’S TALE,Comedy,1611,William Shakespeare,contents,dialogue,ACT II,SCENE III,LEONTES,910,"They should not laugh if I could reach them, nor"
Winter's Tale,THE WINTER’S TALE,Comedy,1611,William Shakespeare,contents,dialogue,ACT II,SCENE III,LEONTES,911,"Shall she, within my power."
Winter's Tale,THE WINTER’S TALE,Comedy,1611,William Shakespeare,contents,directions,ACT II,SCENE III,NA,NA,"Enter Paulina carrying a baby, with Antigonus, lords and servants."
Winter's Tale,THE WINTER’S TALE,Comedy,1611,William Shakespeare,contents,dialogue,ACT II,SCENE III,FIRST LORD,912,You must not enter.
Winter's Tale,THE WINTER’S TALE,Comedy,1611,William Shakespeare,contents,dialogue,ACT II,SCENE III,PAULINA,913,"Nay, rather, good my lords, be second to me:"
Winter's Tale,THE WINTER’S TALE,Comedy,1611,William Shakespeare,contents,dialogue,ACT II,SCENE III,PAULINA,914,"Fear you his tyrannous passion more, alas,"
Winter's Tale,THE WINTER’S TALE,Comedy,1611,William Shakespeare,contents,dialogue,ACT II,SCENE III,PAULINA,915,"Than the queen’s life? a gracious innocent soul,"
Winter's Tale,THE WINTER’S TALE,Comedy,1611,William Shakespeare,contents,dialogue,ACT II,SCENE III,PAULINA,916,More free than he is jealous.
Winter's Tale,THE WINTER’S TALE,Comedy,1611,William Shakespeare,contents,dialogue,ACT II,SCENE III,ANTIGONUS,917,That’s enough.
Winter's Tale,THE WINTER’S TALE,Comedy,1611,William Shakespeare,contents,dialogue,ACT II,SCENE III,SERVANT,918,"Madam, he hath not slept tonight; commanded"
Winter's Tale,THE WINTER’S TALE,Comedy,1611,William Shakespeare,contents,dialogue,ACT II,SCENE III,SERVANT,919,None should come at him.
Winter's Tale,THE WINTER’S TALE,Comedy,1611,William Shakespeare,contents,dialogue,ACT II,SCENE III,PAULINA,920,"Not so hot, good sir;"
Winter's Tale,THE WINTER’S TALE,Comedy,1611,William Shakespeare,contents,dialogue,ACT II,SCENE III,PAULINA,921,"I come to bring him sleep. ’Tis such as you,"
Winter's Tale,THE WINTER’S TALE,Comedy,1611,William Shakespeare,contents,dialogue,ACT II,SCENE III,PAULINA,922,"That creep like shadows by him, and do sigh"
Winter's Tale,THE WINTER’S TALE,Comedy,1611,William Shakespeare,contents,dialogue,ACT II,SCENE III,PAULINA,923,"At each his needless heavings,—such as you"
Winter's Tale,THE WINTER’S TALE,Comedy,1611,William Shakespeare,contents,dialogue,ACT II,SCENE III,PAULINA,924,Nourish the cause of his awaking. I
Winter's Tale,THE WINTER’S TALE,Comedy,1611,William Shakespeare,contents,dialogue,ACT II,SCENE III,PAULINA,925,"Do come with words as med’cinal as true,"
Winter's Tale,THE WINTER’S TALE,Comedy,1611,William Shakespeare,contents,dialogue,ACT II,SCENE III,PAULINA,926,"Honest as either, to purge him of that humour"
Winter's Tale,THE WINTER’S TALE,Comedy,1611,William Shakespeare,contents,dialogue,ACT II,SCENE III,PAULINA,927,That presses him from sleep.
Winter's Tale,THE WINTER’S TALE,Comedy,1611,William Shakespeare,contents,dialogue,ACT II,SCENE III,LEONTES,928,"What noise there, ho?"
Winter's Tale,THE WINTER’S TALE,Comedy,1611,William Shakespeare,contents,dialogue,ACT II,SCENE III,PAULINA,929,"No noise, my lord; but needful conference"
Winter's Tale,THE WINTER’S TALE,Comedy,1611,William Shakespeare,contents,dialogue,ACT II,SCENE III,PAULINA,930,About some gossips for your highness.
Winter's Tale,THE WINTER’S TALE,Comedy,1611,William Shakespeare,contents,dialogue,ACT II,SCENE III,LEONTES,931,How!
Winter's Tale,THE WINTER’S TALE,Comedy,1611,William Shakespeare,contents,dialogue,ACT II,SCENE III,LEONTES,932,"Away with that audacious lady! Antigonus,"
Winter's Tale,THE WINTER’S TALE,Comedy,1611,William Shakespeare,contents,dialogue,ACT II,SCENE III,LEONTES,933,I charg’d thee that she should not come about me.
Winter's Tale,THE WINTER’S TALE,Comedy,1611,William Shakespeare,contents,dialogue,ACT II,SCENE III,LEONTES,934,I knew she would.
Winter's Tale,THE WINTER’S TALE,Comedy,1611,William Shakespeare,contents,dialogue,ACT II,SCENE III,ANTIGONUS,935,"I told her so, my lord,"
Winter's Tale,THE WINTER’S TALE,Comedy,1611,William Shakespeare,contents,dialogue,ACT II,SCENE III,ANTIGONUS,936,"On your displeasure’s peril and on mine,"
Winter's Tale,THE WINTER’S TALE,Comedy,1611,William Shakespeare,contents,dialogue,ACT II,SCENE III,ANTIGONUS,937,She should not visit you.
Winter's Tale,THE WINTER’S TALE,Comedy,1611,William Shakespeare,contents,dialogue,ACT II,SCENE III,LEONTES,938,"What, canst not rule her?"
Winter's Tale,THE WINTER’S TALE,Comedy,1611,William Shakespeare,contents,dialogue,ACT II,SCENE III,PAULINA,939,"From all dishonesty he can. In this,"
Winter's Tale,THE WINTER’S TALE,Comedy,1611,William Shakespeare,contents,dialogue,ACT II,SCENE III,PAULINA,940,"Unless he take the course that you have done,"
Winter's Tale,THE WINTER’S TALE,Comedy,1611,William Shakespeare,contents,dialogue,ACT II,SCENE III,PAULINA,941,"Commit me for committing honour—trust it,"
Winter's Tale,THE WINTER’S TALE,Comedy,1611,William Shakespeare,contents,dialogue,ACT II,SCENE III,PAULINA,942,He shall not rule me.
Winter's Tale,THE WINTER’S TALE,Comedy,1611,William Shakespeare,contents,dialogue,ACT II,SCENE III,ANTIGONUS,943,"La you now, you hear."
Winter's Tale,THE WINTER’S TALE,Comedy,1611,William Shakespeare,contents,dialogue,ACT II,SCENE III,ANTIGONUS,944,When she will take the rein I let her run;
Winter's Tale,THE WINTER’S TALE,Comedy,1611,William Shakespeare,contents,dialogue,ACT II,SCENE III,ANTIGONUS,945,But she’ll not stumble.
Winter's Tale,THE WINTER’S TALE,Comedy,1611,William Shakespeare,contents,dialogue,ACT II,SCENE III,PAULINA,946,"Good my liege, I come,—"
