short_title,gutenberg_title,genre,year,author,section,class,act,scene,character,line_number,text
Winter's Tale,THE WINTER’S TALE,Comedy,1611,William Shakespeare,contents,dialogue,ACT IV,SCENE IV,AUTOLYCUS,2377,"simple gentleman! I have sold all my trumpery. Not a counterfeit stone,"
Winter's Tale,THE WINTER’S TALE,Comedy,1611,William Shakespeare,contents,dialogue,ACT IV,SCENE IV,AUTOLYCUS,2378,"not a ribbon, glass, pomander, brooch, table-book, ballad, knife, tape,"
Winter's Tale,THE WINTER’S TALE,Comedy,1611,William Shakespeare,contents,dialogue,ACT IV,SCENE IV,AUTOLYCUS,2379,"glove, shoe-tie, bracelet, horn-ring, to keep my pack from fasting."
Winter's Tale,THE WINTER’S TALE,Comedy,1611,William Shakespeare,contents,dialogue,ACT IV,SCENE IV,AUTOLYCUS,2380,"They throng who should buy first, as if my trinkets had been hallowed"
Winter's Tale,THE WINTER’S TALE,Comedy,1611,William Shakespeare,contents,dialogue,ACT IV,SCENE IV,AUTOLYCUS,2381,and brought a benediction to the buyer: by which means I saw whose
Winter's Tale,THE WINTER’S TALE,Comedy,1611,William Shakespeare,contents,dialogue,ACT IV,SCENE IV,AUTOLYCUS,2382,"purse was best in picture; and what I saw, to my good use I remembered."
Winter's Tale,THE WINTER’S TALE,Comedy,1611,William Shakespeare,contents,dialogue,ACT IV,SCENE IV,AUTOLYCUS,2383,My clown (who wants but something to be a reasonable man) grew so in
Winter's Tale,THE WINTER’S TALE,Comedy,1611,William Shakespeare,contents,dialogue,ACT IV,SCENE IV,AUTOLYCUS,2384,love with the wenches’ song that he would not stir his pettitoes till
Winter's Tale,THE WINTER’S TALE,Comedy,1611,William Shakespeare,contents,dialogue,ACT IV,SCENE IV,AUTOLYCUS,2385,he had both tune and words; which so drew the rest of the herd to me
Winter's Tale,THE WINTER’S TALE,Comedy,1611,William Shakespeare,contents,dialogue,ACT IV,SCENE IV,AUTOLYCUS,2386,that all their other senses stuck in ears: you might have pinched a
Winter's Tale,THE WINTER’S TALE,Comedy,1611,William Shakespeare,contents,dialogue,ACT IV,SCENE IV,AUTOLYCUS,2387,"placket, it was senseless; ’twas nothing to geld a codpiece of a purse;"
Winter's Tale,THE WINTER’S TALE,Comedy,1611,William Shakespeare,contents,dialogue,ACT IV,SCENE IV,AUTOLYCUS,2388,"I would have filed keys off that hung in chains: no hearing, no"
Winter's Tale,THE WINTER’S TALE,Comedy,1611,William Shakespeare,contents,dialogue,ACT IV,SCENE IV,AUTOLYCUS,2389,"feeling, but my sir’s song, and admiring the nothing of it. So that in"
Winter's Tale,THE WINTER’S TALE,Comedy,1611,William Shakespeare,contents,dialogue,ACT IV,SCENE IV,AUTOLYCUS,2390,this time of lethargy I picked and cut most of their festival purses;
Winter's Tale,THE WINTER’S TALE,Comedy,1611,William Shakespeare,contents,dialogue,ACT IV,SCENE IV,AUTOLYCUS,2391,and had not the old man come in with a whoobub against his daughter and
Winter's Tale,THE WINTER’S TALE,Comedy,1611,William Shakespeare,contents,dialogue,ACT IV,SCENE IV,AUTOLYCUS,2392,"the king’s son, and scared my choughs from the chaff, I had not left a"
Winter's Tale,THE WINTER’S TALE,Comedy,1611,William Shakespeare,contents,dialogue,ACT IV,SCENE IV,AUTOLYCUS,2393,purse alive in the whole army.
Winter's Tale,THE WINTER’S TALE,Comedy,1611,William Shakespeare,contents,dialogue,ACT IV,SCENE IV,AUTOLYCUS,2394,"Camillo, Florizel and Perdita come forward."
Winter's Tale,THE WINTER’S TALE,Comedy,1611,William Shakespeare,contents,dialogue,ACT IV,SCENE IV,CAMILLO,2395,"Nay, but my letters, by this means being there"
Winter's Tale,THE WINTER’S TALE,Comedy,1611,William Shakespeare,contents,dialogue,ACT IV,SCENE IV,CAMILLO,2396,"So soon as you arrive, shall clear that doubt."
Winter's Tale,THE WINTER’S TALE,Comedy,1611,William Shakespeare,contents,dialogue,ACT IV,SCENE IV,FLORIZEL,2397,And those that you’ll procure from king Leontes?
Winter's Tale,THE WINTER’S TALE,Comedy,1611,William Shakespeare,contents,dialogue,ACT IV,SCENE IV,CAMILLO,2398,Shall satisfy your father.
Winter's Tale,THE WINTER’S TALE,Comedy,1611,William Shakespeare,contents,dialogue,ACT IV,SCENE IV,PERDITA,2399,Happy be you!
Winter's Tale,THE WINTER’S TALE,Comedy,1611,William Shakespeare,contents,dialogue,ACT IV,SCENE IV,PERDITA,2400,All that you speak shows fair.
Winter's Tale,THE WINTER’S TALE,Comedy,1611,William Shakespeare,contents,dialogue,ACT IV,SCENE IV,CAMILLO,2401,[Seeing Autolycus.] Who have we here?
Winter's Tale,THE WINTER’S TALE,Comedy,1611,William Shakespeare,contents,dialogue,ACT IV,SCENE IV,CAMILLO,2402,We’ll make an instrument of this; omit
Winter's Tale,THE WINTER’S TALE,Comedy,1611,William Shakespeare,contents,dialogue,ACT IV,SCENE IV,CAMILLO,2403,Nothing may give us aid.
Winter's Tale,THE WINTER’S TALE,Comedy,1611,William Shakespeare,contents,dialogue,ACT IV,SCENE IV,AUTOLYCUS,2404,"[Aside.] If they have overheard me now,—why, hanging."
Winter's Tale,THE WINTER’S TALE,Comedy,1611,William Shakespeare,contents,dialogue,ACT IV,SCENE IV,CAMILLO,2405,"How now, good fellow! why shakest thou so? Fear not, man; here’s no"
Winter's Tale,THE WINTER’S TALE,Comedy,1611,William Shakespeare,contents,dialogue,ACT IV,SCENE IV,CAMILLO,2406,harm intended to thee.
Winter's Tale,THE WINTER’S TALE,Comedy,1611,William Shakespeare,contents,dialogue,ACT IV,SCENE IV,AUTOLYCUS,2407,"I am a poor fellow, sir."
Winter's Tale,THE WINTER’S TALE,Comedy,1611,William Shakespeare,contents,dialogue,ACT IV,SCENE IV,CAMILLO,2408,"Why, be so still; here’s nobody will steal that from thee: yet, for the"
Winter's Tale,THE WINTER’S TALE,Comedy,1611,William Shakespeare,contents,dialogue,ACT IV,SCENE IV,CAMILLO,2409,outside of thy poverty we must make an exchange; therefore discase thee
Winter's Tale,THE WINTER’S TALE,Comedy,1611,William Shakespeare,contents,dialogue,ACT IV,SCENE IV,CAMILLO,2410,"instantly,—thou must think there’s a necessity in’t—and change garments"
Winter's Tale,THE WINTER’S TALE,Comedy,1611,William Shakespeare,contents,dialogue,ACT IV,SCENE IV,CAMILLO,2411,"with this gentleman: though the pennyworth on his side be the worst,"
Winter's Tale,THE WINTER’S TALE,Comedy,1611,William Shakespeare,contents,dialogue,ACT IV,SCENE IV,CAMILLO,2412,"yet hold thee, there’s some boot."
Winter's Tale,THE WINTER’S TALE,Comedy,1611,William Shakespeare,contents,directions,ACT IV,SCENE IV,NA,NA,[Giving money.]
Winter's Tale,THE WINTER’S TALE,Comedy,1611,William Shakespeare,contents,dialogue,ACT IV,SCENE IV,AUTOLYCUS,2413,"I am a poor fellow, sir: [Aside.] I know ye well enough."
Winter's Tale,THE WINTER’S TALE,Comedy,1611,William Shakespeare,contents,dialogue,ACT IV,SCENE IV,CAMILLO,2414,"Nay, prithee dispatch: the gentleman is half flayed already."
Winter's Tale,THE WINTER’S TALE,Comedy,1611,William Shakespeare,contents,dialogue,ACT IV,SCENE IV,AUTOLYCUS,2415,"Are you in earnest, sir? [Aside.] I smell the trick on’t."
Winter's Tale,THE WINTER’S TALE,Comedy,1611,William Shakespeare,contents,dialogue,ACT IV,SCENE IV,FLORIZEL,2416,"Dispatch, I prithee."
Winter's Tale,THE WINTER’S TALE,Comedy,1611,William Shakespeare,contents,dialogue,ACT IV,SCENE IV,AUTOLYCUS,2417,"Indeed, I have had earnest; but I cannot with conscience take it."
Winter's Tale,THE WINTER’S TALE,Comedy,1611,William Shakespeare,contents,dialogue,ACT IV,SCENE IV,CAMILLO,2418,"Unbuckle, unbuckle."
Winter's Tale,THE WINTER’S TALE,Comedy,1611,William Shakespeare,contents,directions,ACT IV,SCENE IV,NA,NA,[Florizel and Autolycus exchange garments.]
Winter's Tale,THE WINTER’S TALE,Comedy,1611,William Shakespeare,contents,dialogue,ACT IV,SCENE IV,CAMILLO,2419,"Fortunate mistress,—let my prophecy"
Winter's Tale,THE WINTER’S TALE,Comedy,1611,William Shakespeare,contents,dialogue,ACT IV,SCENE IV,CAMILLO,2420,Come home to you!—you must retire yourself
Winter's Tale,THE WINTER’S TALE,Comedy,1611,William Shakespeare,contents,dialogue,ACT IV,SCENE IV,CAMILLO,2421,Into some covert. Take your sweetheart’s hat
Winter's Tale,THE WINTER’S TALE,Comedy,1611,William Shakespeare,contents,dialogue,ACT IV,SCENE IV,CAMILLO,2422,"And pluck it o’er your brows, muffle your face,"
Winter's Tale,THE WINTER’S TALE,Comedy,1611,William Shakespeare,contents,dialogue,ACT IV,SCENE IV,CAMILLO,2423,"Dismantle you; and, as you can, disliken"
Winter's Tale,THE WINTER’S TALE,Comedy,1611,William Shakespeare,contents,dialogue,ACT IV,SCENE IV,CAMILLO,2424,The truth of your own seeming; that you may
Winter's Tale,THE WINTER’S TALE,Comedy,1611,William Shakespeare,contents,dialogue,ACT IV,SCENE IV,CAMILLO,2425,(For I do fear eyes over) to shipboard
Winter's Tale,THE WINTER’S TALE,Comedy,1611,William Shakespeare,contents,dialogue,ACT IV,SCENE IV,CAMILLO,2426,Get undescried.
Winter's Tale,THE WINTER’S TALE,Comedy,1611,William Shakespeare,contents,dialogue,ACT IV,SCENE IV,PERDITA,2427,I see the play so lies
Winter's Tale,THE WINTER’S TALE,Comedy,1611,William Shakespeare,contents,dialogue,ACT IV,SCENE IV,PERDITA,2428,That I must bear a part.
Winter's Tale,THE WINTER’S TALE,Comedy,1611,William Shakespeare,contents,dialogue,ACT IV,SCENE IV,CAMILLO,2429,No remedy.
Winter's Tale,THE WINTER’S TALE,Comedy,1611,William Shakespeare,contents,dialogue,ACT IV,SCENE IV,CAMILLO,2430,Have you done there?
Winter's Tale,THE WINTER’S TALE,Comedy,1611,William Shakespeare,contents,dialogue,ACT IV,SCENE IV,FLORIZEL,2431,"Should I now meet my father,"
Winter's Tale,THE WINTER’S TALE,Comedy,1611,William Shakespeare,contents,dialogue,ACT IV,SCENE IV,FLORIZEL,2432,He would not call me son.
Winter's Tale,THE WINTER’S TALE,Comedy,1611,William Shakespeare,contents,dialogue,ACT IV,SCENE IV,CAMILLO,2433,"Nay, you shall have no hat. [Giving it to Perdita.]"
Winter's Tale,THE WINTER’S TALE,Comedy,1611,William Shakespeare,contents,dialogue,ACT IV,SCENE IV,CAMILLO,2434,"Come, lady, come. Farewell, my friend."
Winter's Tale,THE WINTER’S TALE,Comedy,1611,William Shakespeare,contents,dialogue,ACT IV,SCENE IV,AUTOLYCUS,2435,"Adieu, sir."
Winter's Tale,THE WINTER’S TALE,Comedy,1611,William Shakespeare,contents,dialogue,ACT IV,SCENE IV,FLORIZEL,2436,"O Perdita, what have we twain forgot?"
Winter's Tale,THE WINTER’S TALE,Comedy,1611,William Shakespeare,contents,dialogue,ACT IV,SCENE IV,FLORIZEL,2437,Pray you a word.
Winter's Tale,THE WINTER’S TALE,Comedy,1611,William Shakespeare,contents,directions,ACT IV,SCENE IV,NA,NA,[They converse apart.]
Winter's Tale,THE WINTER’S TALE,Comedy,1611,William Shakespeare,contents,dialogue,ACT IV,SCENE IV,CAMILLO,2438,"[Aside.] What I do next, shall be to tell the king"
Winter's Tale,THE WINTER’S TALE,Comedy,1611,William Shakespeare,contents,dialogue,ACT IV,SCENE IV,CAMILLO,2439,"Of this escape, and whither they are bound;"
Winter's Tale,THE WINTER’S TALE,Comedy,1611,William Shakespeare,contents,dialogue,ACT IV,SCENE IV,CAMILLO,2440,Wherein my hope is I shall so prevail
Winter's Tale,THE WINTER’S TALE,Comedy,1611,William Shakespeare,contents,dialogue,ACT IV,SCENE IV,CAMILLO,2441,To force him after: in whose company
Winter's Tale,THE WINTER’S TALE,Comedy,1611,William Shakespeare,contents,dialogue,ACT IV,SCENE IV,CAMILLO,2442,I shall re-view Sicilia; for whose sight
Winter's Tale,THE WINTER’S TALE,Comedy,1611,William Shakespeare,contents,dialogue,ACT IV,SCENE IV,CAMILLO,2443,I have a woman’s longing.
Winter's Tale,THE WINTER’S TALE,Comedy,1611,William Shakespeare,contents,dialogue,ACT IV,SCENE IV,FLORIZEL,2444,Fortune speed us!
Winter's Tale,THE WINTER’S TALE,Comedy,1611,William Shakespeare,contents,dialogue,ACT IV,SCENE IV,FLORIZEL,2445,"Thus we set on, Camillo, to the sea-side."
Winter's Tale,THE WINTER’S TALE,Comedy,1611,William Shakespeare,contents,dialogue,ACT IV,SCENE IV,CAMILLO,2446,The swifter speed the better.
Winter's Tale,THE WINTER’S TALE,Comedy,1611,William Shakespeare,contents,directions,ACT IV,SCENE IV,NA,NA,"[Exeunt Florizel, Perdita and Camillo.]"
Winter's Tale,THE WINTER’S TALE,Comedy,1611,William Shakespeare,contents,dialogue,ACT IV,SCENE IV,AUTOLYCUS,2447,"I understand the business, I hear it. To have an open ear, a quick eye,"
Winter's Tale,THE WINTER’S TALE,Comedy,1611,William Shakespeare,contents,dialogue,ACT IV,SCENE IV,AUTOLYCUS,2448,"and a nimble hand, is necessary for a cut-purse; a good nose is"
Winter's Tale,THE WINTER’S TALE,Comedy,1611,William Shakespeare,contents,dialogue,ACT IV,SCENE IV,AUTOLYCUS,2449,"requisite also, to smell out work for the other senses. I see this is"
Winter's Tale,THE WINTER’S TALE,Comedy,1611,William Shakespeare,contents,dialogue,ACT IV,SCENE IV,AUTOLYCUS,2450,the time that the unjust man doth thrive. What an exchange had this
Winter's Tale,THE WINTER’S TALE,Comedy,1611,William Shakespeare,contents,dialogue,ACT IV,SCENE IV,AUTOLYCUS,2451,been without boot! What a boot is here with this exchange! Sure the
Winter's Tale,THE WINTER’S TALE,Comedy,1611,William Shakespeare,contents,dialogue,ACT IV,SCENE IV,AUTOLYCUS,2452,"gods do this year connive at us, and we may do anything extempore. The"
Winter's Tale,THE WINTER’S TALE,Comedy,1611,William Shakespeare,contents,dialogue,ACT IV,SCENE IV,AUTOLYCUS,2453,"prince himself is about a piece of iniquity, stealing away from his"
Winter's Tale,THE WINTER’S TALE,Comedy,1611,William Shakespeare,contents,dialogue,ACT IV,SCENE IV,AUTOLYCUS,2454,father with his clog at his heels: if I thought it were a piece of
Winter's Tale,THE WINTER’S TALE,Comedy,1611,William Shakespeare,contents,dialogue,ACT IV,SCENE IV,AUTOLYCUS,2455,"honesty to acquaint the king withal, I would not do’t: I hold it the"
Winter's Tale,THE WINTER’S TALE,Comedy,1611,William Shakespeare,contents,dialogue,ACT IV,SCENE IV,AUTOLYCUS,2456,more knavery to conceal it; and therein am I constant to my profession.
Winter's Tale,THE WINTER’S TALE,Comedy,1611,William Shakespeare,contents,directions,ACT IV,SCENE IV,NA,NA,Enter Clown and Shepherd.
Winter's Tale,THE WINTER’S TALE,Comedy,1611,William Shakespeare,contents,dialogue,ACT IV,SCENE IV,AUTOLYCUS,2457,"Aside, aside; here is more matter for a hot brain: every lane’s end,"
Winter's Tale,THE WINTER’S TALE,Comedy,1611,William Shakespeare,contents,dialogue,ACT IV,SCENE IV,AUTOLYCUS,2458,"every shop, church, session, hanging, yields a careful man work."
Winter's Tale,THE WINTER’S TALE,Comedy,1611,William Shakespeare,contents,dialogue,ACT IV,SCENE IV,CLOWN,2459,"See, see; what a man you are now! There is no other way but to tell the"
Winter's Tale,THE WINTER’S TALE,Comedy,1611,William Shakespeare,contents,dialogue,ACT IV,SCENE IV,CLOWN,2460,"king she’s a changeling, and none of your flesh and blood."
Winter's Tale,THE WINTER’S TALE,Comedy,1611,William Shakespeare,contents,dialogue,ACT IV,SCENE IV,SHEPHERD,2461,"Nay, but hear me."
Winter's Tale,THE WINTER’S TALE,Comedy,1611,William Shakespeare,contents,dialogue,ACT IV,SCENE IV,CLOWN,2462,"Nay, but hear me."
Winter's Tale,THE WINTER’S TALE,Comedy,1611,William Shakespeare,contents,dialogue,ACT IV,SCENE IV,SHEPHERD,2463,"Go to, then."
Winter's Tale,THE WINTER’S TALE,Comedy,1611,William Shakespeare,contents,dialogue,ACT IV,SCENE IV,CLOWN,2464,"She being none of your flesh and blood, your flesh and blood has not"
Winter's Tale,THE WINTER’S TALE,Comedy,1611,William Shakespeare,contents,dialogue,ACT IV,SCENE IV,CLOWN,2465,offended the king; and so your flesh and blood is not to be punished by
Winter's Tale,THE WINTER’S TALE,Comedy,1611,William Shakespeare,contents,dialogue,ACT IV,SCENE IV,CLOWN,2466,"him. Show those things you found about her, those secret things, all"
Winter's Tale,THE WINTER’S TALE,Comedy,1611,William Shakespeare,contents,dialogue,ACT IV,SCENE IV,CLOWN,2467,"but what she has with her: this being done, let the law go whistle, I"
Winter's Tale,THE WINTER’S TALE,Comedy,1611,William Shakespeare,contents,dialogue,ACT IV,SCENE IV,CLOWN,2468,warrant you.
Winter's Tale,THE WINTER’S TALE,Comedy,1611,William Shakespeare,contents,dialogue,ACT IV,SCENE IV,SHEPHERD,2469,"I will tell the king all, every word, yea, and his son’s pranks too;"
Winter's Tale,THE WINTER’S TALE,Comedy,1611,William Shakespeare,contents,dialogue,ACT IV,SCENE IV,SHEPHERD,2470,"who, I may say, is no honest man neither to his father nor to me, to go"
Winter's Tale,THE WINTER’S TALE,Comedy,1611,William Shakespeare,contents,dialogue,ACT IV,SCENE IV,SHEPHERD,2471,about to make me the king’s brother-in-law.
Winter's Tale,THE WINTER’S TALE,Comedy,1611,William Shakespeare,contents,dialogue,ACT IV,SCENE IV,CLOWN,2472,"Indeed, brother-in-law was the farthest off you could have been to him,"
Winter's Tale,THE WINTER’S TALE,Comedy,1611,William Shakespeare,contents,dialogue,ACT IV,SCENE IV,CLOWN,2473,and then your blood had been the dearer by I know how much an ounce.
Winter's Tale,THE WINTER’S TALE,Comedy,1611,William Shakespeare,contents,dialogue,ACT IV,SCENE IV,AUTOLYCUS,2474,"[Aside.] Very wisely, puppies!"
Winter's Tale,THE WINTER’S TALE,Comedy,1611,William Shakespeare,contents,dialogue,ACT IV,SCENE IV,SHEPHERD,2475,"Well, let us to the king: there is that in this fardel will make him"
Winter's Tale,THE WINTER’S TALE,Comedy,1611,William Shakespeare,contents,dialogue,ACT IV,SCENE IV,SHEPHERD,2476,scratch his beard.
Winter's Tale,THE WINTER’S TALE,Comedy,1611,William Shakespeare,contents,dialogue,ACT IV,SCENE IV,AUTOLYCUS,2477,[Aside.] I know not what impediment this complaint may be to the
Winter's Tale,THE WINTER’S TALE,Comedy,1611,William Shakespeare,contents,dialogue,ACT IV,SCENE IV,AUTOLYCUS,2478,flight of my master.
Winter's Tale,THE WINTER’S TALE,Comedy,1611,William Shakespeare,contents,dialogue,ACT IV,SCENE IV,CLOWN,2479,Pray heartily he be at’ palace.
Winter's Tale,THE WINTER’S TALE,Comedy,1611,William Shakespeare,contents,dialogue,ACT IV,SCENE IV,AUTOLYCUS,2480,"[Aside.] Though I am not naturally honest, I am so sometimes by"
Winter's Tale,THE WINTER’S TALE,Comedy,1611,William Shakespeare,contents,dialogue,ACT IV,SCENE IV,AUTOLYCUS,2481,chance. Let me pocket up my pedlar’s excrement. [Takes off his false
Winter's Tale,THE WINTER’S TALE,Comedy,1611,William Shakespeare,contents,dialogue,ACT IV,SCENE IV,AUTOLYCUS,2482,"beard.] How now, rustics! whither are you bound?"
Winter's Tale,THE WINTER’S TALE,Comedy,1611,William Shakespeare,contents,dialogue,ACT IV,SCENE IV,SHEPHERD,2483,"To the palace, an it like your worship."
Winter's Tale,THE WINTER’S TALE,Comedy,1611,William Shakespeare,contents,dialogue,ACT IV,SCENE IV,AUTOLYCUS,2484,"Your affairs there, what, with whom, the condition of that fardel, the"
Winter's Tale,THE WINTER’S TALE,Comedy,1611,William Shakespeare,contents,dialogue,ACT IV,SCENE IV,AUTOLYCUS,2485,"place of your dwelling, your names, your ages, of what having,"
Winter's Tale,THE WINTER’S TALE,Comedy,1611,William Shakespeare,contents,dialogue,ACT IV,SCENE IV,AUTOLYCUS,2486,"breeding, and anything that is fitting to be known? discover!"
Winter's Tale,THE WINTER’S TALE,Comedy,1611,William Shakespeare,contents,dialogue,ACT IV,SCENE IV,CLOWN,2487,"We are but plain fellows, sir."
Winter's Tale,THE WINTER’S TALE,Comedy,1611,William Shakespeare,contents,dialogue,ACT IV,SCENE IV,AUTOLYCUS,2488,A lie; you are rough and hairy. Let me have no lying. It becomes none
Winter's Tale,THE WINTER’S TALE,Comedy,1611,William Shakespeare,contents,dialogue,ACT IV,SCENE IV,AUTOLYCUS,2489,"but tradesmen, and they often give us soldiers the lie; but we pay them"
Winter's Tale,THE WINTER’S TALE,Comedy,1611,William Shakespeare,contents,dialogue,ACT IV,SCENE IV,AUTOLYCUS,2490,"for it with stamped coin, not stabbing steel; therefore they do not"
Winter's Tale,THE WINTER’S TALE,Comedy,1611,William Shakespeare,contents,dialogue,ACT IV,SCENE IV,AUTOLYCUS,2491,give us the lie.
Winter's Tale,THE WINTER’S TALE,Comedy,1611,William Shakespeare,contents,dialogue,ACT IV,SCENE IV,CLOWN,2492,"Your worship had like to have given us one, if you had not taken"
Winter's Tale,THE WINTER’S TALE,Comedy,1611,William Shakespeare,contents,dialogue,ACT IV,SCENE IV,CLOWN,2493,yourself with the manner.
Winter's Tale,THE WINTER’S TALE,Comedy,1611,William Shakespeare,contents,dialogue,ACT IV,SCENE IV,SHEPHERD,2494,"Are you a courtier, an ’t like you, sir?"
Winter's Tale,THE WINTER’S TALE,Comedy,1611,William Shakespeare,contents,dialogue,ACT IV,SCENE IV,AUTOLYCUS,2495,"Whether it like me or no, I am a courtier. Seest thou not the air of"
Winter's Tale,THE WINTER’S TALE,Comedy,1611,William Shakespeare,contents,dialogue,ACT IV,SCENE IV,AUTOLYCUS,2496,the court in these enfoldings? hath not my gait in it the measure of
Winter's Tale,THE WINTER’S TALE,Comedy,1611,William Shakespeare,contents,dialogue,ACT IV,SCENE IV,AUTOLYCUS,2497,the court? receives not thy nose court-odour from me? reflect I not on
Winter's Tale,THE WINTER’S TALE,Comedy,1611,William Shakespeare,contents,dialogue,ACT IV,SCENE IV,AUTOLYCUS,2498,"thy baseness court-contempt? Think’st thou, for that I insinuate, or"
Winter's Tale,THE WINTER’S TALE,Comedy,1611,William Shakespeare,contents,dialogue,ACT IV,SCENE IV,AUTOLYCUS,2499,"toaze from thee thy business, I am therefore no courtier? I am courtier"
Winter's Tale,THE WINTER’S TALE,Comedy,1611,William Shakespeare,contents,dialogue,ACT IV,SCENE IV,AUTOLYCUS,2500,"cap-a-pe, and one that will either push on or pluck back thy business"
Winter's Tale,THE WINTER’S TALE,Comedy,1611,William Shakespeare,contents,dialogue,ACT IV,SCENE IV,AUTOLYCUS,2501,there. Whereupon I command thee to open thy affair.
Winter's Tale,THE WINTER’S TALE,Comedy,1611,William Shakespeare,contents,dialogue,ACT IV,SCENE IV,SHEPHERD,2502,"My business, sir, is to the king."
Winter's Tale,THE WINTER’S TALE,Comedy,1611,William Shakespeare,contents,dialogue,ACT IV,SCENE IV,AUTOLYCUS,2503,What advocate hast thou to him?
Winter's Tale,THE WINTER’S TALE,Comedy,1611,William Shakespeare,contents,dialogue,ACT IV,SCENE IV,SHEPHERD,2504,"I know not, an ’t like you."
Winter's Tale,THE WINTER’S TALE,Comedy,1611,William Shakespeare,contents,dialogue,ACT IV,SCENE IV,CLOWN,2505,Advocate’s the court-word for a pheasant. Say you have none.
Winter's Tale,THE WINTER’S TALE,Comedy,1611,William Shakespeare,contents,dialogue,ACT IV,SCENE IV,SHEPHERD,2506,"None, sir; I have no pheasant, cock nor hen."
Winter's Tale,THE WINTER’S TALE,Comedy,1611,William Shakespeare,contents,dialogue,ACT IV,SCENE IV,AUTOLYCUS,2507,How bless’d are we that are not simple men!
Winter's Tale,THE WINTER’S TALE,Comedy,1611,William Shakespeare,contents,dialogue,ACT IV,SCENE IV,AUTOLYCUS,2508,"Yet nature might have made me as these are,"
Winter's Tale,THE WINTER’S TALE,Comedy,1611,William Shakespeare,contents,dialogue,ACT IV,SCENE IV,AUTOLYCUS,2509,Therefore I will not disdain.
Winter's Tale,THE WINTER’S TALE,Comedy,1611,William Shakespeare,contents,dialogue,ACT IV,SCENE IV,CLOWN,2510,This cannot be but a great courtier.
Winter's Tale,THE WINTER’S TALE,Comedy,1611,William Shakespeare,contents,dialogue,ACT IV,SCENE IV,SHEPHERD,2511,"His garments are rich, but he wears them not handsomely."
Winter's Tale,THE WINTER’S TALE,Comedy,1611,William Shakespeare,contents,dialogue,ACT IV,SCENE IV,CLOWN,2512,"He seems to be the more noble in being fantastical: a great man, I’ll"
Winter's Tale,THE WINTER’S TALE,Comedy,1611,William Shakespeare,contents,dialogue,ACT IV,SCENE IV,CLOWN,2513,warrant; I know by the picking on’s teeth.
Winter's Tale,THE WINTER’S TALE,Comedy,1611,William Shakespeare,contents,dialogue,ACT IV,SCENE IV,AUTOLYCUS,2514,The fardel there? What’s i’ th’ fardel? Wherefore that box?
Winter's Tale,THE WINTER’S TALE,Comedy,1611,William Shakespeare,contents,dialogue,ACT IV,SCENE IV,SHEPHERD,2515,"Sir, there lies such secrets in this fardel and box which none must"
Winter's Tale,THE WINTER’S TALE,Comedy,1611,William Shakespeare,contents,dialogue,ACT IV,SCENE IV,SHEPHERD,2516,"know but the king; and which he shall know within this hour, if I may"
Winter's Tale,THE WINTER’S TALE,Comedy,1611,William Shakespeare,contents,dialogue,ACT IV,SCENE IV,SHEPHERD,2517,come to th’ speech of him.
Winter's Tale,THE WINTER’S TALE,Comedy,1611,William Shakespeare,contents,dialogue,ACT IV,SCENE IV,AUTOLYCUS,2518,"Age, thou hast lost thy labour."
Winter's Tale,THE WINTER’S TALE,Comedy,1611,William Shakespeare,contents,dialogue,ACT IV,SCENE IV,SHEPHERD,2519,"Why, sir?"
Winter's Tale,THE WINTER’S TALE,Comedy,1611,William Shakespeare,contents,dialogue,ACT IV,SCENE IV,AUTOLYCUS,2520,The king is not at the palace; he is gone aboard a new ship to purge
Winter's Tale,THE WINTER’S TALE,Comedy,1611,William Shakespeare,contents,dialogue,ACT IV,SCENE IV,AUTOLYCUS,2521,"melancholy and air himself: for, if thou beest capable of things"
Winter's Tale,THE WINTER’S TALE,Comedy,1611,William Shakespeare,contents,dialogue,ACT IV,SCENE IV,AUTOLYCUS,2522,"serious, thou must know the king is full of grief."
Winter's Tale,THE WINTER’S TALE,Comedy,1611,William Shakespeare,contents,dialogue,ACT IV,SCENE IV,SHEPHERD,2523,"So ’tis said, sir; about his son, that should have married a shepherd’s"
Winter's Tale,THE WINTER’S TALE,Comedy,1611,William Shakespeare,contents,dialogue,ACT IV,SCENE IV,SHEPHERD,2524,daughter.
Winter's Tale,THE WINTER’S TALE,Comedy,1611,William Shakespeare,contents,dialogue,ACT IV,SCENE IV,AUTOLYCUS,2525,"If that shepherd be not in hand-fast, let him fly. The curses he shall"
Winter's Tale,THE WINTER’S TALE,Comedy,1611,William Shakespeare,contents,dialogue,ACT IV,SCENE IV,AUTOLYCUS,2526,"have, the tortures he shall feel, will break the back of man, the heart"
Winter's Tale,THE WINTER’S TALE,Comedy,1611,William Shakespeare,contents,dialogue,ACT IV,SCENE IV,AUTOLYCUS,2527,of monster.
Winter's Tale,THE WINTER’S TALE,Comedy,1611,William Shakespeare,contents,dialogue,ACT IV,SCENE IV,CLOWN,2528,"Think you so, sir?"
